date,tweet,word
2019-09-07 00:30:31+00:00,"#Amazonindia the call came in response to my filling in the link. Your team member calls only to say he cannot do anything and the 'large appliance' team has to resolve. Oh btw, that's the team who has been messing with me, but too bad!",amazonindia
2019-09-07 00:23:17+00:00,New Delhi (CNN Business)Amazon just opened its biggest office building in the world in the Indian city of Hyderabad.The online retail giant's new campus in the city's financial district opened on Wednesday. It covers 9.5 acres and has 1. #amazon #india #https://hemperbay.com/2019/08/22/amazons-new-biggest-office-building-is-not-in-the-united-states/,amazonindia
2019-09-07 00:04:04+00:00,HyperX HX-HSCSC-BK Cloud Stinger Core Gaming Headset (Black) [37% discount] https://amzn.to/2SjYCbv #AmazonIndia #DealsOnPC,amazonindia
2019-09-06 23:30:19+00:00,★COOKING WITH PASSION★ http://amzn.to/2MGHMFA http://wp.me/P5rIsN-23U CynB_Ainsworthe bookboost #ASMSG ✎via Pizzazz Book Promotions http://wp.me/P5rIsN-Ft #amazonindia,amazonindia
2019-09-06 23:04:20+00:00,Marshall Kilburn 4091189 Portable Speakers Wired and Wireless Bluetooth Speaker (Black) [32% discount] https://amzn.to/2NsPvnp #AmazonIndia #DealsOnElectronics,amazonindia
2019-09-06 22:04:22+00:00,"Flybot Viper Rugged Polyester Braided Unbreakable 2.4A Mfi Certified Lightning (Length - 1.5 Meter, Color - Sea Green) [46% discount] https://amzn.to/32mt1dP #AmazonIndia #DealsOnElectronics",amazonindia
2019-09-06 21:21:45+00:00,Actually I'm in Canada right now and I had ordered from Amazon Canada by using my Amazon India's account and thus I'm unable to track the package by the link you provided. How do I report it now?,amazonindia
2019-09-06 21:04:18+00:00,boAt Mumbai Indians Edition Rockerz 400 Bluetooth Wireless Headphone (Blue) [65% discount] https://amzn.to/2RZA87T #AmazonIndia #DealsOnElectronics,amazonindia
2019-09-06 20:14:09+00:00,#GoaDiary_Business_News Amazon India not impacted by demand slowdown in consumer appliance ,amazonindia
2019-09-06 20:04:19+00:00,Zoook Sports Cricket Glove 16GB USB Flash Drive [71% discount] https://amzn.to/2HRsyZl #AmazonIndia #DealsOnPC,amazonindia
2019-09-06 19:38:27+00:00,Amazon India to weed out single-use plastic packaging by June 2020 ,amazonindia
2019-09-06 19:21:16+00:00,"#Amazonindia #Flipkartoffers #deals #offers #sale #shoppingonline follow us &amp; enable notifications to ""all post"" so you never miss such updates Check full post here https://t.me/lootalert/4657",amazonindia
2019-09-06 19:07:51+00:00,Thanks Jeff. Any plans to sell Moon Salt on Amazon? India can help.,amazonindia
2019-09-06 19:04:23+00:00,PTron Magg Headphone Magnetic Earphone with Noise Cancellation in-Ear Wired Headset with Mic for All Smartphones (Gold) [79% discount] https://amzn.to/311oahR #AmazonIndia #DealsOnElectronics,amazonindia
2019-09-06 19:00:19+00:00,Amazon India sales to go up. ,amazonindia
2019-09-06 18:17:03+00:00,Amazon India to weed out single-use plastic packaging by June 2020 https://www.reuters.com/article/us-amazon-com-india-plastic/amazon-india-to-weed-out-single-use-plastic-packaging-by-june-2020-idUSKCN1VP0IA #3pl #warehousing #truckinglife #logistics #truckingcompany #wms #trucking #fulfillment #supplychain,amazonindia
2019-09-06 17:35:27+00:00,Not available at Amazon India right now.,amazonindia
2019-09-06 17:16:28+00:00,Money can’t buy happiness or save your neck! ★A DEAD HUSBAND★ http://amazon.com/gp/product/B00H870VMU/ aburke59 http://wp.me/P5rIsN-xM #ASMSG #amazonIndia ✎via Pizzazz Book Promotions http://wp.me/P5rIsN-Ft,amazonindia
2019-09-06 16:42:24+00:00,Rayban Aviator Sunglasses Gunmetal RB-3386/004/9A63 bought on 28 May 17 from Amazon India Website vide http://Amazon.in Order No 408-1813837-1118725,amazonindia
2019-09-06 16:36:44+00:00,"I got a acknowledgement already..still no further action ￼Your AccountAmazon.inMessage From Customer ServiceHello Pravin, I'm John from Amazon India Social Media Escalation team. I'm writing this email with regard to your Order #171-5131397-6681958.",amazonindia
2019-09-06 16:11:25+00:00,Thanks a lot mark very insightful as usual. When is your book on mindset to be released in Amazon India?,amazonindia
2019-09-06 16:09:25+00:00,That’s why i have shared my order screenshot here because I would like to share my experience to others and let them know what’s going on in #AmazonIndia @JeffBezos you don’t care about your customers then why should I listen and care about you,amazonindia
2019-09-06 16:00:51+00:00,Samsung Galaxy M30s UPCOMING LAUNCH https://kuniyaltechnical8.blogspot.com/2019/09/samsung-galaxy-m30s-upcoming-launch.html #SAMSUNG #AMAZONINDIA ,amazonindia
2019-09-06 15:19:25+00:00,Day 2: #LadiesLetsTalk Q: How should I cover my Career Break in my Resume ? A: check the video!! Short list for You: Returnee Programs in IT &amp; ITES: #1. #SAP - Stay in Touch #2. #Amazon India - #Rekindle #3. #INTUIT - #IntuitAgain #4. #GENP…,amazonindia
2019-09-06 15:10:08+00:00,"#OPPOReno2 #OPPOReno2Z #Quadcam #20xZoom #GodMorningFriday #amazonindia Buy now Oppo Reno 2Z, a high definition full screen smartphone, better feel in watching videos and playing games. Do not miss the offer. Pl. RT ",amazonindia
2019-09-06 14:58:30+00:00,Amazon India increases appliances selection ahead of festive season @amazon http://www.uniindia.com/~/amazon-india-increases-appliances-selection-ahead-of-festive-season/Business%20Economy/news/1721035.html#.XXJzyORAJms.twitter,amazonindia
2019-09-06 14:53:29+00:00,@ray_ban Rayban Aviator Sunglasses Gunmetal RB-3386/004/9A63 bought on 28 May 17 from Amazon India Website vide http://Amazon.in Order No 408-1813837-1118725 and turned defective within 13 months,amazonindia
2019-09-06 14:52:21+00:00,one day left but no mail no calll #AmazonIndia #sgindia,amazonindia
2019-09-06 14:44:31+00:00,Amazon India to weed out single-use plastic packaging by June 2020 ,amazonindia
2019-09-06 14:32:37+00:00,"10 Crazy Office Gadgets You Can Buy On Amazon INDIA 2019 | Gadgets Under Rs100, Rs200, Rs500, Rs1000 - https://www.thegeekpeek.com/?p=4931",amazonindia
2019-09-06 14:15:27+00:00,Available in Amazon India website ??? Sir,amazonindia
2019-09-06 14:13:37+00:00,Amazon India to weed out single-use plastic packaging by June 2020 https://reut.rs/2ZyIo5O,amazonindia
2019-09-06 14:00:30+00:00,"#AmazonIndia looks like the beginning of the end! Deliver a brand new refrigerator with a creaky, faulty door, dodge the promised replacement for 20 days! customer service offers status update in 5-6 working days, everyday! BTW, app says I should have got it on 21st Aug. Shame! ",amazonindia
2019-09-06 13:48:51+00:00,Amazon India Ads,amazonindia
2019-09-06 13:23:46+00:00,#AmazonIndia #FoodDelivery #eGADGETS,amazonindia
2019-09-06 13:09:30+00:00,Amazon entered food and delivery market in India..How are they going to be different then #Zomato or #swiggy? Is the market big enough? #AmazonIndia #foodpanda #FoodForThought #fooddelivery #startup #foodtech,amazonindia
2019-09-06 12:55:22+00:00,Top selling T-shirt right now on Amazon . #Amazon #AmazonIndia #TrafficRules #TrafficFine #trafficpolice #newtrafficrule,amazonindia
2019-09-06 12:39:04+00:00,This weekend Relaxation Travel with Mighty Vibe. Order now in Amazon and Flipkart! https://lnkd.in/fNW5-zq https://lnkd.in/f_gMdR2 #bemighty #spotify #amazonindia #flipkart #musicplayer #FitnessGoals #motivation #music #FitIndiaMovement #gadgets #musiclover #weeekendvibes,amazonindia
2019-09-06 12:36:36+00:00,Amazon US link: https://www.amazon.com/dp/B07WNTXJC4/ref=cm_sw_r_cp_api_i_A2KCDbN1FR5SR Amazon India link: https://www.amazon.in/Curse-Gandhari-ms-Aditi-Banerjee/dp/9388002008/ref=mp_s_a_1_1?keywords=curse+of+gandhari&amp;qid=1565713034&amp;s=gateway&amp;sprefix=curse+of+ga&amp;sr=8-1,amazonindia
2019-09-06 12:19:35+00:00,How @amazonin cheats... Answer to What are the few ways by which Amazon India cheats or fools it's customers? by Ritesh Jain https://www.quora.com/What-are-the-few-ways-by-which-Amazon-India-cheats-or-fools-its-customers/answer/Ritesh-Jain-158?ch=2&amp;share=708c6767&amp;srid=Xyuy,amazonindia
2019-09-06 12:03:57+00:00,TP-Link TL-WA850RE 300Mbps Universal Wi-Fi Range Extender (White) [60% discount] https://amzn.to/2HRvTaV #AmazonIndia #DealsOnPC,amazonindia
2019-09-06 11:58:50+00:00,@AmazonHelp I had security issue with my account and the same was reported to Amazon India via a call on 2nd sep. You promised to revert in 2 days. I have no clue all except fire stick are frozen. Please let me know how to go about,amazonindia
2019-09-06 11:56:53+00:00,#ModiSPlasticFreeIndia கீழ் 2020 ஆண்டுக்குள் ஒற்றை பயன்பாட்டு பிளாஸ்டிக் பயன்பாட்டை அகற்றுவதை நோக்கமாகக் கொண்டுள்ளதாக #AmazonIndia கூறியுள்ளது... #OnetimePlastic #UseanThrowPlastic,amazonindia
2019-09-06 11:48:22+00:00,Amazon India to shift from plastic to paper packaging http://sbne.ws/r/CQZ7,amazonindia
2019-09-06 11:39:08+00:00,"Panaji: Amazon India on Friday announced an increase in its select of large appliances, ahead of the festive season, to add up to its month on month growth in this segment. “My value and volume, the... https://goanewshub.com/amazon-adds-one-thousand-more-appliances-to-its-list/",amazonindia
2019-09-06 11:30:32+00:00,Is selling a combo of two products on #AmazonIndia more profitable than a single listing? Gain insights with this #Barrel13Blog. http://bit.ly/2lHkjGT #BenefitsofSellingProductCombo #SellonAmazon #AmazonSellers #ProductBundling,amazonindia
2019-09-06 11:30:16+00:00,@JeffBezos hi Sir sorry to message you for such a small thing but amazon india is very poor in customer experience my order is stranded for 3-4 days despite getting through delivery agent not received my order and no clear solution from call center i am feeling betrayed and cheat,amazonindia
2019-09-06 11:12:09+00:00,"#AmazonIndia i have placed a replacement request of faulty firetv remote 15 days back, my faulty remote picked up on very next day but i have not received new remote. Its been 15 days. #shame #worstproduct",amazonindia
2019-09-06 11:05:18+00:00,You can access all of our amazing products on Amazon. Check us out https://amzn.to/2ZnhJsX #oshee #OSHEEvitamins #VitaminDrink #OsheeIndia #OsheeNaturals #osheeonamazon #Antioxidant #amazonindia #shopnow #energydrinksonline #energydrink #amazonshopping #nowinindia,amazonindia
2019-09-06 10:55:27+00:00,@amazonIN will the gift card purchased from Amazon India be valid in Canada? Kindly clarify,amazonindia
2019-09-06 10:32:06+00:00,Amazon India to offer food delivery services starting next month. Talks with merchants go on. Demands comparatively less commission from merchants. #AmazonIndia #swiggy #Zomato,amazonindia
2019-09-06 10:07:55+00:00,"#DalalsStreet - Part Memoir, Part Fiction as claimed by the author @talliauthor . Now available on Amazon India and all leading bookstores in India. . http://niyogibooksindia.com/books/dalals-street",amazonindia
2019-09-06 09:39:16+00:00,Bring home the very best of hassle-free and handy kitchen appliances with Surya Flames. ...#SuryaFlame #Surya #KitchenAppliance #tips #tipoftheday #kitchen #cooking #juicermixer #ThePrideOfEveryKitchen #marketplace #Flipkart #FlipkartIndia #Amazon #AmazonIndia #shoponline,amazonindia
2019-09-06 09:26:31+00:00,"Amazon India to start food delivery from October. This service will start in Bengaluru first, following with Mumbai and Delhi will have this facility. @amazonIN",amazonindia
2019-09-06 09:22:22+00:00,"Looking to buy a new phone, look no further. Switch to #OPPOReno2Z with #QuadCam and #20xZoom and #UltraDarkMode. Experience the future. Now available at Amazon India. ",amazonindia
2019-09-06 09:18:09+00:00,Dear @JeffBezos Amazon india cheated No product delivered No refund granted No issue resolution Please look into matters @jagograhakjago @irvpaswan @smritiirani @mackenziebezos @amazonIN @amazon @AmazonHelp @AmazonPub @awscloud @PrimeVideoIN @amazonmusic @AmazonWatch,amazonindia
2019-09-06 09:08:31+00:00,"ஸ்விக்கி, சோமேட்டோவுக்கு ஆப்பு வைக்கும் அமேசான்.. அச்சத்தில் மற்ற நிறுவனங்கள்! | Amazon India ready to start food delivery with low restaurant commissions for next month https://onlinearticles.net/%e0%ae%b8%e0%af%8d%e0%ae%b5%e0%ae%bf%e0%ae%95%e0%af%8d%e0%ae%95%e0%ae%bf-%e0%ae%9a%e0%af%8b%e0%ae%ae%e0%af%87%e0%ae%9f%e0%af%8d%e0%ae%9f%e0%af%8b%e0%ae%b5%e0%af%81%e0%ae%95%e0%af%8d%e0%ae%95%e0%af%81/",amazonindia
2019-09-06 08:53:41+00:00,Birds of Haryana - A Field Guide is now available on Amazon India: https://www.amazon.in/dp/B07XDC9631?ref=myi_title_dp https://www.instagram.com/p/B2EFKv8lIe4/?igshid=1d86pntcogzbe,amazonindia
2019-09-06 08:39:13+00:00,Life is full of surprises! ★ALONG CAME CLAIRE★ http://bit.ly/AlongCameClaire-eBook http://bit.ly/AlongCameClaire-Paperback http://getbook.at/AlongCameClaire http://wp.me/P4D5bw-bo #ASMSG bookboost BridgitteLesley #amazonindia,amazonindia
2019-09-06 08:21:44+00:00,"Amazon India, Flipkart to go green #Amazon #Flipkart #SayNoToPlastic #PlasticBan https://bit.ly/2lFC4GA via @ShivalikJournal",amazonindia
2019-09-06 07:50:53+00:00,"Vivo Y12 (Aqua Blue, 3GB RAM, 64GB Storage) https://kuniyaltechnical8.blogspot.com/2019/09/vivo-y12-aqua-blue-3gb-ram-64gb-storage.html https://amzn.to/2HSdKtA #amazonindia #vivo",amazonindia
2019-09-06 07:41:11+00:00,@whirlpool_india @amazon @amazonIN #amazonindia worst customer care service in the history of customer care service industry ,amazonindia
2019-09-06 07:28:48+00:00,"Amazon India : Toyhouse Benz Push Car, White https://everyoffers.com/product/amazon-india-toyhouse-benz-push-car-white/ https://everyoffers.com/product/amazon-india-toyhouse-benz-push-car-white/",amazonindia
2019-09-06 07:26:13+00:00,"Amazon India : Lakme Absolute Ideal Tone Refinishing Night Concentrate, 15 ml https://everyoffers.com/product/amazon-india-lakme-absolute-ideal-tone-refinishing-night-concentrate-15-ml/ https://everyoffers.com/product/amazon-india-lakme-absolute-ideal-tone-refinishing-night-concentrate-15-ml/",amazonindia
2019-09-06 07:18:30+00:00,"If it would be easy, everyone would be doing it! Come check us out, we can definitely make it easy ! Follow @ayushvick #retail #marketingonline #onlinemarketing #amazonindia #sale #ecommerce… https://www.instagram.com/p/B2D6RexDDIW/?igshid=1btku73ez9gn1",amazonindia
2019-09-06 07:16:57+00:00,Found this product listing on Amazon India. Never knew they were generous enough to promote their arch-rival #Flipkart as the better platform to shop from @amazonIN : get your act together @Flipkart #amazonindia #ecommerce #onlineshopping,amazonindia
2019-09-06 07:10:39+00:00,#OPPOReno2seriesQuiz #amazonindia ,amazonindia
2019-09-06 07:01:58+00:00,#opporenoseriesquiz #amazonindia ,amazonindia
2019-09-06 06:46:40+00:00,"#Amazon India &amp; Walmart’s #Flipkart pledge to scrap single-use #plastic package in India! A signature campaign, with large companies now stepping forward to help the fight against #environmental #pollution All those who fought for this, well done #awareness (1/3)",amazonindia
2019-09-06 06:45:47+00:00,"All small items got delivered except recliner and tv unit. Delivery guys responsible for delivering furniture updated the status saying they are not able to locate me or my address. I live in Hyderabad (IT city, house of Amazon India).",amazonindia
2019-09-06 06:45:47+00:00,"@amazonIN , #AmazonPrime, @JeffBezos @FedExIndia @delhiveryHi Everyone, please don’t order Furniture from Amazon India. I being a Prime member, regularly use Amazon for shopping, I ordered 2-seater recliner and tv unit on 26th of August 2019 along with some 10 small items.",amazonindia
2019-09-06 06:27:05+00:00,Hey @microsoftindia can you guys please help me figure out where to buy Xbox One Official Power Supply? Whatever is listed on Amazon India arent official. Mine is broken.,amazonindia
2019-09-06 06:26:07+00:00,#QuizTimeMorningsWithAmazon #amazonindia #amazonprime #AmazonGiveaway #Amazon #quiztime #giveaway #amazon http://www.amazon.in,amazonindia
2019-09-06 06:26:00+00:00,"Right cards at the right time! Doesn’t matter if you don’t have the right bank card to avail an offer online. #UseMyCards will find someone who can order your product for you. Easy does it, yes? #BankCards #Cardsharing #Cardlending #Flipkart #AmazonIndia #OnlineOffers",amazonindia
2019-09-06 06:04:24+00:00,@amazonIN @AmazonHelp #Amazonindia It’s all lame experience even after talking to support and sharing pictures. My Parent’s Anniversary gift should wait for 5 days for your investigation team. #unreliable #badcustomerservice,amazonindia
2019-09-06 05:48:09+00:00,Directly message me if u really want to save amazon india,amazonindia
2019-09-06 05:47:45+00:00,Hi amazon india a fraud is going on on your website by few people,amazonindia
2019-09-06 05:46:51+00:00,@AmazonHelp @amazon @amazonIN Amounts of Rs 939.94 &amp; Rs 942.38 were deducted from my card on 05.08.19 and 05.09.19 respectively. I had raised issue when the amt was deducted in August. There was no proper response to that. I am Amazon India member and paid fees for 1 yr 1/2,amazonindia
2019-09-06 05:45:20+00:00,"Things spiral out of control in Humanity Ville, Texas! ★THE SYNAGOGUE OF SATAN★ http://amzn.to/31qxwEE http://wp.me/P5rIsN-3NF Spokenamos bookboost #ASMSG ✎via Pizzazz Book Promotions http://wp.me/P5rIsN-Ft #amazonindia",amazonindia
2019-09-06 05:41:05+00:00,"#QuizTimeMorningsWithAmazon #QuizTime #AmazonQuizTime #GoProHero7 gopro @GoProMotorplex goproject from amazonhelp amazonin #AmazonIndia #Amazon amazon amazondotin @Ferozepur-Jhirka, Haryana, India https://www.instagram.com/p/B2DvHThJ8zx/?igshid=16pba0khl17zj",amazonindia
2019-09-06 05:40:01+00:00,#QuizTimeMorningsWithAmazon #QuizTime #AmazonQuizTime #GoProHero7 @GoPro @GoProMotorplex @goproject from @AmazonHelp @amazonIN #AmazonIndia #Amazon,amazonindia
2019-09-06 05:39:23+00:00,#QuizTimeMorningsWithAmazon #GoProHero7 #AmazonQuiz #AmazonIndia #AmazonIn #Amazon,amazonindia
2019-09-06 05:30:00+00:00,My prayer is that you will see your story in my story and that my journey will become your journey. #CrackedMirrorClearReflection by #JulieBarbera is available for purchase today! Get your copy on Amazon #India at http://bit.ly/CrackedMirrorClearReflectionIn @KMSHETTYP @netai_charan @HumbleIndian,amazonindia
2019-09-06 05:29:23+00:00,"Amazon India team is worst, look at this @JeffBezos why no action such seller, are your teams sleeping or you guys trying to cheat people intentionally.",amazonindia
2019-09-06 05:25:03+00:00,Gearing up for your product launch on #AmazonIndia! Follow the checklist from this infographic post which will help you do it better. Sign up now: https://www.barrel13.com/ #ProductLaunch #StepstoLaunchYourAmazonProduct #SellonAmazon #AmazonSellers #AmazonProductResearchTool,amazonindia
2019-09-06 05:20:03+00:00,"#OPPOReno2seriesQuiz Done with quiz, #amazonindia",amazonindia
2019-09-06 05:17:30+00:00,@JeffBezos hello sir I am a customer of amazon india I return a fossil hybrid watch because of quality issues my product pickup was done on 1st sep but amazon taking very long to issue my refund my credit card statement generate on 14th please fast this process I am very old cust,amazonindia
2019-09-06 05:14:32+00:00,Amazon India to eliminate plastic packaging by 2020! https://cnn.it/2lEQffm #recycletoday #recycle #daily #globalnews #recyclingmadeasy #india #indiarecycles #plasticenvironmentalist,amazonindia
2019-09-06 05:08:02+00:00,"#OPPOReno2 #OPPOReno2Z #Quadcam #20xZoom #GodMorningFriday #amazonindia Check out vivo Z1Pro mobile phone 32MP In-Display Camera, also a best smartphone one can surely buy. pl. RT https://buybestsmartmobilephones.blogspot.com/2019/06/vivo-z1pro-mobile-phone-32mp-in-display.html",amazonindia
2019-09-06 05:08:01+00:00,Amazon India raises food delivery stakes with low restaurant commissions ,amazonindia
2019-09-06 05:04:20+00:00,An epic journey through the 20th century’s most iconic periods! ★UNEXPECTED GIFTS★ http://amzn.to/30VNLJr http://wp.me/P5rIsN-18S SarahMallery1 BookBoost #ASMSG #amazonindia ✎via Pizzazz Book Promotions http://wp.me/P5rIsN-Ft pic.twitter.com/xD33unAghT,amazonindia
2019-09-06 05:04:00+00:00,Xmate Mana [53% discount] https://amzn.to/30vx0Eh #AmazonIndia #DealsOnElectronics,amazonindia
2019-09-06 05:02:38+00:00,"On the auspicious occasion of Ganesh Chaturthi we launched QOOT COOKIES store at Amazon India, I am attaching link of my store below. We have listed 11 variety of premium cookies like Quinoa, Multi grain, Gluten... https://www.facebook.com/100009763869577/posts/919309195071201/",amazonindia
2019-09-06 04:53:22+00:00,PeopleSoft book rated 4 stars on Amazon India PeopleSoft Security Simplified: Step by step guide to PeopleSoft security https://www.amazon.com/dp/B07WGZGSHJ/ #peoplesoft #technology #computersecurity #kindleunlimited #indieauthor #peoplesoftsecurity #learnpeoplesoft #technologyeducation,amazonindia
2019-09-06 04:47:57+00:00,"#OPPOReno2Z price in India is set at Rs. 29,990 for its sole 8GB RAM + 256GB storage variant. It is available to buy via #Amazon India and #Flipkart",amazonindia
2019-09-06 04:47:46+00:00,"No slowdown in the e-com industry: Prakash Rochlani, Director, Last Mile Operations, Amazon India ",amazonindia
2019-09-06 04:41:38+00:00,"#OPPORenoSeries at #amazonindia get great deals on #mobile Here https://amzn.to/30Yo9LR Ocean green, 8GB RAM, 128GB Storage Get No cost EMI/Additional Exchange offers",amazonindia
2019-09-06 04:41:16+00:00,Twists and turns keep you guessing until the end! ★COZY MYSTERY 7 BOOK SET★ http://amzn.to/2QGtjYj sylviaselfman http://wp.me/P5rIsN-3cN #ASMSG ✎via Pizzazz Book Promotions http://wp.me/P5rIsN-Ft #amazonindia,amazonindia
2019-09-06 04:39:36+00:00,#Quiztimemorningswithamazon #AmazonIndia #AmazonPrime ,amazonindia
2019-09-06 04:25:12+00:00,"#Bittersweet is now available for international purchase on http://Amazon.com at http://bit.ly/BittersweetBook . And for those living not too far way from me, it's available in India too ;) . Amazon India: http://bit.ly/BittersweetIndia",amazonindia
2019-09-06 04:09:44+00:00,@amazonIN First time I felt BP raised with Amazon India yesterday. The return policy was changed without any notices. No. Of emails have been sent for promotion but they want to tell their policy. Or procedure changed,amazonindia
2019-09-06 04:09:28+00:00,"I don’t think you understand my question so, here it is again,”why do you issue unreal refund when I’ve paid hard earned cash for sending it across?” If it’s a policy issue, change it because it’s UNFAIR to anyone & profitable to amazon India only!!!@amazon @amazonIN @JeffBezos",amazonindia
2019-09-06 04:08:53+00:00,#QuizTimeMorningsWithAmazon #AmazonFire #AmazonGiftCard #AmazonMusic #AmazonPrime #AmazonPrimeMember #Amazonpay #AmazonPrimeVideo #Amazonpromo #AmazonKindle #AmazonIndia Done !! #Amazon I Hope I am this Quiz,amazonindia
2019-09-06 04:06:05+00:00,"after reading my tweets & order details, only a fool will order the said item or any item from amazon India. @amazon @amazonIN @JeffBezos @consumercourtin",amazonindia
2019-09-06 04:04:21+00:00,Amazon India raises food delivery stakes with low restaurant commissions ,amazonindia
2019-09-06 04:04:09+00:00,HP 128GB Class 10 MicroSD Memory Card (U1 TF Card 128GB) [75% discount] https://amzn.to/32polUp #AmazonIndia #DealsOnPC,amazonindia
2019-09-06 04:00:03+00:00,"ETRetail | No slowdown in the e-com industry: Prakash Rochlani, Director, Last Mile Operations, Amazon India ",amazonindia
2019-09-06 03:49:30+00:00,#OPPOReno2Z #opporeno2seriesquiz #amazonindia ,amazonindia
2019-09-06 03:44:38+00:00,"Upto 80% off on Gerua, Soch, Ziyaa and More Kurtis at Amazon India! Shop Here: https://amzn.to/34vpjka #SuperDealsIndia #offers",amazonindia
2019-09-06 03:38:10+00:00,Consumer Complaint ID - 1575061 #consumer #harassment #amazonindia #cheating #Indians,amazonindia
2019-09-06 03:30:56+00:00,Today's Lightning Deals of Amazon India! Shop Here: https://amzn.to/34vpjka #SuperDealsIndia #offers,amazonindia
2019-09-06 03:28:44+00:00,"Amazon India : Durex Condoms – 10 Count (Pack of 3, Extra Dots) https://everyoffers.com/product/amazon-india-durex-condoms-10-count-pack-of-3-extra-dots/",amazonindia
2019-09-06 03:24:55+00:00,"Amazon India : Soogo Glass Jar Set with Lid, 600ml, 2-Pieces, Transparent (SJS-18502) https://everyoffers.com/product/amazon-india-soogo-glass-jar-set-with-lid-600ml-2-pieces-transparent-sjs-18502/",amazonindia
2019-09-06 03:22:26+00:00,Amazon India : Levis Tan Men’s Wallet https://everyoffers.com/product/amazon-india-levis-tan-mens-wallet/ https://everyoffers.com/product/amazon-india-levis-tan-mens-wallet/,amazonindia
2019-09-06 03:12:14+00:00,@JeffBezos Terrible experience with Amazon India customer service. How can I share my feedback and escalate?,amazonindia
2019-09-06 03:12:10+00:00,#QuizTimeMorningsWithAmazon Good morning Amazon India Gagandeep Singh New Delhi,amazonindia
2019-09-06 02:49:14+00:00,#QuizTimeMorningsWithAmazon Thanks #AmazonIndia. Hope to win! ,amazonindia
2019-09-06 02:43:13+00:00,Trying to locate a group of missing young people! ★THERE ABIDETH HOPE★ http://amazon.com/dp/B07WCQM583/ http://wp.me/P5rIsN-3Z2 SharonKConnell #bookboost ASMSG ✎via Pizzazz Book Promotions http://wp.me/P5rIsN-Ft #amazonindia,amazonindia
2019-09-06 02:36:44+00:00,@amazonIN Hi Good Morning have answered all morning quiz questions correctly again today and within first 4 mins.... Hope to get a response from Amazon India... God knows best....!!! ,amazonindia
