date,tweet,word
2019-09-17 23:55:00+00:00,Amazon India announces Great Indian Festival and Amazon Festive Yatra.... #AmazonIN #AmazonGreatIndianFestival #India #Amazon #AmazonFestiveYatra,amazonindia
2019-09-17 23:54:44+00:00,"Vu Ultra Android TV Range Announced, Will Be Available Exclusively on Amazon India Starting September 28 ",amazonindia
2019-09-17 23:17:26+00:00,best selling products on amazon India – Dont miss to buy!! http://rviv.ly/crO5CG #trawod,amazonindia
2019-09-17 22:55:00+00:00,Amazon India announces Great Indian Festival and Amazon Festive Yatra... #AmazonIN #AmazonGreatIndianFestival #India #Amazon #AmazonFestiveYatra https://thepigeonexpress.com/amazon-india-announces-great-indian-festival-and-amazon-festive-yatra/,amazonindia
2019-09-17 22:10:40+00:00,"Very worst service of @SBICard_Connect . They cheated me in billing of my new phone purchased on Amazon India. In no cost EMI, they charged me interest rate on EMI however it was not applicable on my principal amount as per Amazon India policy. Somebody please help me on this.",amazonindia
2019-09-17 22:04:03+00:00,REO Desktop Intel Core i5 650 32 Ghz4 GB DDR3 Ram120 GB SSD [13% discount] https://amzn.to/2LwaNQv #AmazonIndia #DealsOnPC,amazonindia
2019-09-17 21:55:00+00:00,Amazon India announces Great Indian Festival and Amazon Festive Yatra... #AmazonIN #AmazonGreatIndianFestival #India #Amazon #AmazonFestiveYatra https://thepigeonexpress.com/amazon-india-announces-great-indian-festival-and-amazon-festive-yatra/,amazonindia
2019-09-17 21:04:09+00:00,CROSSLOOP Pro Series | Designer in-Ear Headphone | 3.5 mm Universal Earphones | Metallic Angular Earbuds | with Mic & Volume Control (Pink & Blue) [65% discount] https://amzn.to/2V1E9KE #AmazonIndia #DealsOnElectronics,amazonindia
2019-09-17 20:55:00+00:00,Amazon India announces Great Indian Festival and Amazon Festive Yatra.. #AmazonIN #AmazonGreatIndianFestival #India #Amazon #AmazonFestiveYatra https://thepigeonexpress.com/amazon-india-announces-great-indian-festival-and-amazon-festive-yatra/,amazonindia
2019-09-17 20:04:07+00:00,"boAt Rockerz 600 Wireless Bluetooth Headphones with HD Sound, Integrated Controls, in-Built Mic, boAt X Kunal Rawal Edition (Victoria Black) [58% discount] https://amzn.to/30j67n7 #AmazonIndia #DealsOnElectronics",amazonindia
2019-09-17 19:55:00+00:00,Amazon India announces Great Indian Festival and Amazon Festive Yatra.. #AmazonIN #AmazonGreatIndianFestival #India #Amazon #AmazonFestiveYatra https://thepigeonexpress.com/amazon-india-announces-great-indian-festival-and-amazon-festive-yatra/,amazonindia
2019-09-17 19:53:53+00:00,"I've just posted a new blog: Vu Ultra Android TV Declared, On Deal In Beginning Sept 28 https://ift.tt/2V0O6rF Vu Ultra Android TV Run Declared, Will Be Accessible Solely on Amazon India Beginning September 28 Indian TV producer Vu has been a pioneer of selling TVs on the w…",amazonindia
2019-09-17 19:04:04+00:00,Samsung EHS64 EHS64AVFBECINU Hands-Free with Remote Note (Black) [22% discount] https://amzn.to/2SZ6SxP #AmazonIndia #DealsOnElectronics,amazonindia
2019-09-17 19:00:16+00:00,Amazon India Category: Electronics Offer: Buy Watches Under Rs.599 http://couponsnagar.in/amazon-india-category-electronics-offer-buy-watches-under-rs-599-5,amazonindia
2019-09-17 18:55:00+00:00,Amazon India announces Great Indian Festival and Amazon Festive Yatra. #AmazonIN #AmazonGreatIndianFestival #India #Amazon #AmazonFestiveYatra https://thepigeonexpress.com/amazon-india-announces-great-indian-festival-and-amazon-festive-yatra/,amazonindia
2019-09-17 18:37:14+00:00,"Vu Ultra Android TV Range Announced, Will Be Available Exclusively on Amazon India Starting September 28 ",amazonindia
2019-09-17 18:12:56+00:00,"Dear Amazon India, I am not getting my payments for the past one and half month, and there has not been any concrete answer from http://Amazon.in team, I am tired of running from pillar to post, PLEASE PLEASE PLEASE help me, Amazon is my only source of income @JeffBezos",amazonindia
2019-09-17 18:10:54+00:00,"Dear Amazon India, I am not getting my payments for the past one and half month, and there has not been any concrete answer from http://Amazon.in team, I am tired of running from pillar to post, PLEASE PLEASE PLEASE help me, Amazon is my only source of income @JeffBezos",amazonindia
2019-09-17 17:55:00+00:00,Amazon India announces Great Indian Festival and Amazon Festive Yatra. #AmazonIN #AmazonGreatIndianFestival #India #Amazon #AmazonFestiveYatra https://thepigeonexpress.com/amazon-india-announces-great-indian-festival-and-amazon-festive-yatra/,amazonindia
2019-09-17 17:36:17+00:00,"Amazon India is switching to sustainable packaging, but what about Amazon USA? ",amazonindia
2019-09-17 17:11:24+00:00,★DEBAUCHERY★ http://amzn.to/2X83dDi aharemboysaga http://wp.me/P5rIsN-f7 #ASMSG bookboost ✎via Pizzazz Book Promotions http://wp.me/P5rIsN-Ft #amazonindia,amazonindia
2019-09-17 16:56:09+00:00,#AmazonGreatIndianSaleQuiz ThAnk you Amazon indiA to mAke fAstival with biggest surprising offer ,amazonindia
2019-09-17 16:55:00+00:00,Amazon India announces Great Indian Festival and Amazon Festive Yatra #AmazonIN #AmazonGreatIndianFestival #India #Amazon #AmazonFestiveYatra,amazonindia
2019-09-17 16:18:19+00:00,"Another thing Xiaomi India can take credit for - flurry of smart TV launches in India. Motorola, now OnePlus, and the already-known Vu also launched the ""UltraAndroid TV"" series on Amazon India. If it isn't for Xiaomi, TVs wouldn't have been affordable yet.",amazonindia
2019-09-17 15:58:29+00:00,#OPPOReno2seriesQuiz Buy OPPO Reno2 Z Online at Amazon India If you are on the lookout for a new-gen smartphone with breathtaking features? The latest model by OPPO is packed with stunning features that are sure to please you. The OPPO Reno2 Z comes with great features.,amazonindia
2019-09-17 15:53:07+00:00,Amazon India announces Great Indian Festival and Amazon Festive Yatra #AmazonIN #AmazonGreatIndianFestival #India #Amazon #AmazonFestiveYatra https://thepigeonexpress.com/amazon-india-announces-great-indian-festival-and-amazon-festive-yatra/,amazonindia
2019-09-17 15:29:30+00:00,"Met Mr. Gopal Pillai (Amazon India , Vice President) today at #AmazonConnect , what a knowledgeable person , great meeting you sir! @go2pal",amazonindia
2019-09-17 15:27:24+00:00,"अवर प्रादेशिक नियोजनालय सह मॉडल करियर सेन्टर , मुजफ्फरपुर द्वारा दिनांक - 20.09.2019 को निजी क्षेत्र में रोजगार देने हेतु Amazon India(Wings) pvt ltd Muzaffarpur की कंपनी जो संयुक्त श्रम भवन, गन्नीपुर नियर लॉ कॉलेज, अवर प्रादेशिक नियोजनालय, मुजफ्फरपुर में आ रही है। @BSDM",amazonindia
2019-09-17 15:25:16+00:00,you can read it whenever you want! It's available worldwide. Here's Amazon India: https://www.amazon.in/Lifescale-Establish-Rituals-Routines-Achieve/dp/1119535867,amazonindia
2019-09-17 15:09:15+00:00,"Thank you amazon India, #BoseFramesAmazonQuiz",amazonindia
2019-09-17 15:00:34+00:00,The OnePlus TV will reportedly support Alexa voice commands according to Amazon India's Alexa skill page #OnePlusTV #Alexa https://buff.ly/2LAOZo0,amazonindia
2019-09-17 15:00:12+00:00,‘Scars’ from my book ‘Poetic Letters To God’. The book is available worldwide on: Amazon India: https://amzn.to/30YItMK Flipkart: http://fkrt.it/nlmilKNNNN Amazon Global:… https://www.instagram.com/p/B2hD18oFEUW/?igshid=1nmkpkjsaz037,amazonindia
2019-09-17 14:43:02+00:00,Buying link plz.. not showing on @amazon india.,amazonindia
2019-09-17 14:39:25+00:00,@amazon Great exp with amazon india i am a regular customer of amazon and i have oredered a watch through it and it was defective and order was non returnable so i asked customer care and they gave me cashback and as order was not returnable i also got watch.,amazonindia
2019-09-17 14:04:38+00:00,Guess the specs and win a #OnePlus7T Give it a try as we already know the specs. #OnePlus7TSeries #AmazonIndia https://www.amazon.in/b?_encoding=UTF8&amp;node=18199392031&amp;pf_rd_i=1389401031&amp;pf_rd_m=A1VBAL9TL5WCBF&amp;pf_rd_p=fc714f0c-790b-4309-ae30-94655c5e56ec&amp;pf_rd_r=87DMHK1149RX1QYHWZFP&amp;pf_rd_s=mobile-browse-hero-2&amp;pf_rd_t=30901&amp;ref_=gwdb_hc_mobile-browse-hero-2_0846e6ab-5b8b-4409-83ca-5bcf8f7526e3,amazonindia
2019-09-17 14:00:12+00:00,No impact on sales due to slowdown: Amazon India - http://Moneycontrol.com,amazonindia
2019-09-17 13:58:36+00:00,I am unable to login my Amazon India account. Need help @AmazonHelp.,amazonindia
2019-09-17 13:42:47+00:00,Always looking forward for Amazon Great Indian Sales. Excited to buy some more electronic stuff. #AmazonGreatIndianFestival #AmazonIndia #AmazonPrime #AmazonIndia #Amazon #AmazonNews #AmazonGreatIndianSaleQuiz,amazonindia
2019-09-17 13:33:57+00:00,What follow up r u talking about?? Why refund not initiated for 14days?? #AmazonIndia #apnidukaan,amazonindia
2019-09-17 13:24:23+00:00,★THE GATEWAY★ http://amzn.to/2IwN2pN http://wp.me/P5rIsN-1oW Spokenamos bookboost #ASMSG ✎via Pizzazz Book Promotions http://wp.me/P5rIsN-Ft pic.twitter.com/yLcGzETrOf #amazonindia,amazonindia
2019-09-17 13:07:59+00:00,Happy clients are the beshtestt!! One of @amazonIN verified buyer ‘Mr. Raghav Mehta’ have come up with all praises for Rivona's Apple cider Vinegar shampoo and we can't hold our excitement back! . . . #amazon #amazonIndia #verified #buyer #rivona #applecidervinegar #shampoo,amazonindia
2019-09-17 13:07:08+00:00,Amazon Launches New Fulfilment Centre in Maharashtra: Amazon India plans to have more than 50 fulfilment centres in 13 states with a combined storage space of ... ,amazonindia
2019-09-17 13:03:53+00:00,Redgear Cloak RGB Gaming Headphones with Microphone for PC [53% discount] https://amzn.to/2ZYCvKz #AmazonIndia #DealsOnPC,amazonindia
2019-09-17 13:02:12+00:00,#AmazonGreatIndianSaleQuiz #Amazonin #AmazonIndia ,amazonindia
2019-09-17 12:52:00+00:00,#GreatIndianFestivalQuiz play and get a chance to win Rs. 1 lakh only on #Amazon #AmazonIndia ,amazonindia
2019-09-17 12:42:57+00:00,"Our #products are #designed to #deliver and our customers speak for us, here's yet another 5 star review on @AmazonIN #Truvison #TruPrice #Lifestyle #India #Bass #Treble #Sound #Speakers #Audio #Music #Songs #Best #AudioSystem #CustomerSatisfaction #Review #Amazon #AmazonIndia ",amazonindia
2019-09-17 12:41:11+00:00,what is happening to Amazon India. I have sent several e mails for which there is absolutely no response. My several calls to many numbers could not be reached. God save us,amazonindia
2019-09-17 12:37:59+00:00,http://www.apparelviews.com/maharashtra-signs-mou-with-amazon/ The Maharashtra State Handlooms Corporation (MSHC) recently signed a memorandum of understanding (MoU) with Amazon India under which the latter will launch on its marketplace handloom products.. @indrayanihandl1 @amazonin #ApparelViews,amazonindia
2019-09-17 12:31:54+00:00,Pathetic customer service. Going around in circles for 4 days and all I get is false promises. Wonder why you call it customer service at all? #amazonIndia #Pathetic @amazonIN,amazonindia
2019-09-17 12:30:11+00:00,Kiwi Slow Organic Black Pepper⁠ 50gm⁠ ⁠ BUY HERE: https://amzn.to/2m1uHJW⁠ ⁠ Shop our products on Amazon: https://amzn.to/2KPNyjW⁠ ⁠ Visit our website: http://www.kisanwindow.com⁠ #natural #KiWi #kisanwindow #amazonindia #dehradun #food #pepper #indianspices #dryspices,amazonindia
2019-09-17 12:27:01+00:00,#AmazonGreatIndianSaleQuiz. @amazonindia ,amazonindia
2019-09-17 12:24:16+00:00,"Vu Ultra Android TV Range Announced, Will Be Available Exclusively on Amazon India Starting September 28 ",amazonindia
2019-09-17 12:16:21+00:00,"Explore the big, wide world of entertainment as you stream your favourite shows, movies and videos with the Amazon Fire TV Stick. Buy Here: https://amzn.to/2lXIVvu #AmazonIndia #AmazonFireStick",amazonindia
2019-09-17 12:07:08+00:00,"Vu Ultra Android TV Range Announced, Will Be Available Exclusively on Amazon India Starting September 28: Vu, which has typically launched key product lineups with... https://gadgets.ndtv.com/tv/news/vu-televisions-ultra-android-tv-amazon-exclusive-india-2102396",amazonindia
2019-09-17 12:04:12+00:00,Your email is giving only assurance but no action. I have been given this kind of assurances from your REPRESENTATIVES multiple times since long when i made this purchase and got main part missing thrice! @amazonIN #AmazonIndia Just refund my amount thats all.,amazonindia
2019-09-17 12:03:09+00:00,@amazonIN is the new CHEAT! Ordered a Pronto 75 cm trolley on 15th Sep for urgent requirement. Paid extra to get the item delivered the next day. And surprise !! I received a 48 cm trolley. Such insane! #cheat #amazonindia ,amazonindia
2019-09-17 12:00:48+00:00,"@amazonIN #SleepWellQuiz #QuizTime #AppOnly #AmazonQuizTime #AmazonGreatIndianFestival #AmazonIndia #amazondeals Eligible to WIN ₹ 20,000 @amazonpay @amazonIN @mysleepwell",amazonindia
2019-09-17 11:59:14+00:00,"#SleepWellQuiz #QuizTime #AppOnly #AmazonQuizTime #AmazonGreatIndianFestival #AmazonIndia #amazondeals Eligible to WIN ₹ 20,000 @amazonpay @amazonIN",amazonindia
2019-09-17 11:55:24+00:00,"Vu Ultra Android TV Range Announced, Will Be Available Exclusively on Amazon India Starting September 28 https://dailynews-india.com/vu-ultra-android-tv-range-announced-will-be-available-exclusively-on-amazon-india-starting-september-28/",amazonindia
2019-09-17 11:55:23+00:00,"Vu Ultra Android TV Range Announced, Will Be Available Exclusively on Amazon India Starting September 28 https://dailynews-india.com/vu-ultra-android-tv-range-announced-will-be-available-exclusively-on-amazon-india-starting-september-28/",amazonindia
2019-09-17 11:49:20+00:00,"Vu Ultra Android TV Range Announced, Will Be Available Exclusively on Amazon India Starting September 28 https://fatech.in/vu-ultra-android-tv-range-announced-will-be-available-exclusively-on-amazon-india-starting-september-28/",amazonindia
2019-09-17 11:48:37+00:00,"Vu Ultra Android TV Range Announced, Will Be Available Exclusively on Amazon India Starting September 28 https://is.gd/9VD1Dj",amazonindia
2019-09-17 11:44:30+00:00,@amazonIN #AmazonIndia #cloudtail #India almost 17 hours passed with no results whatsoever. Still no pickup and no refund happened!,amazonindia
2019-09-17 11:40:11+00:00,"Vu Ultra Android TV Range Announced, Will Be Available Exclusively on Amazon India Starting September 28 ",amazonindia
2019-09-17 11:36:01+00:00,"Vu Ultra Android TV Range Announced, Will Be Available Exclusively on Amazon India Starting September 28 https://gadgets.ndtv.com/tv/news/vu-televisions-ultra-android-tv-amazon-exclusive-india-2102396",amazonindia
2019-09-17 11:33:35+00:00,Awesome? That's a silver lining. Feed yourself with a dose of awesome right here: http://www.dsignerworld.com Also available on Myntra Flipkart Amazon India #DSIGNERWatches #since1991 #ILoveMyTime,amazonindia
2019-09-17 11:25:05+00:00,"With #GreatIndianFestival coming soon, improving your conversion &amp; increasing your sales on #AmazonIndia is crucial. Find out how with this blog post. http://bit.ly/2kNOaxq #ImproveAmazonConversion #SellProfitably ##HowtoIncreaseProfitability #AmazonProductResearchTool",amazonindia
2019-09-17 11:18:48+00:00,@bookmyshow The Biggest fraud company ever met with. Changing the terms After payment has been made. #AmazonIndia #Flipkart,amazonindia
2019-09-17 11:18:34+00:00,Amazon India - https://goo.gl/alerts/ZS7K9 #GoogleAlerts,amazonindia
2019-09-17 11:17:42+00:00,Amazon India - https://goo.gl/alerts/ZS7K9 #GoogleAlerts,amazonindia
2019-09-17 11:03:59+00:00,"Nokia 6.1 Plus (6GB RAM, 64GB Storage) for Rs. 10999 at Amazon India! Shop Here: https://amzn.to/2NlQxnV #SuperDealsIndia #offers",amazonindia
2019-09-17 10:59:45+00:00," GREAT INDIAN FESTIVAL Coming Soon Sale starts 29th September - 4th October Sale starts early on 28th September, 12 Noon for Prime Members Free Delivery on your First Order | T&amp;C Apply #GreatIndianFestival #AmazonIndia #BankOffer https://amzn.to/2LCtLWS",amazonindia
2019-09-17 10:58:40+00:00,@JeffBezos this is delivery by amazon india to me ( @rishisom ) an unsealed bottle of acetone and burn receipt.,amazonindia
2019-09-17 10:51:55+00:00,We just received #AmazonEcho invite from @amazondotin a new device Launching tomorrow. #alexa #amazonindia #PrepYourVoice #AmazonEchoIndia,amazonindia
2019-09-17 10:44:58+00:00,"#AmazonIndia #OnlineMarketing I just listed: Dns Thermo/Stainless Steel/Double Wall Vacuum Water Bottle Hot and Cold Upto 24 Hours, 1000 ml (Color as per Availability), for ₹729.00 via @amazon",amazonindia
2019-09-17 10:12:59+00:00,#Maybeline_New_York #Whitening #Compact #Buy_now #Amazon_India #Product is on offer Product World: Maybelline New York whitening compact https://worldsproduct.blogspot.com/2019/06/maybelline-new-york-whitening-compact.html?spref=tw,amazonindia
2019-09-17 09:22:42+00:00,Amazon India expects ‘bigger and better’ festive sales this year ,amazonindia
2019-09-17 09:17:07+00:00,#amazonconnect #AmazonIndia Amazing Event And all things ,amazonindia
2019-09-17 08:56:15+00:00,@PUMARunning Bought these Puma shoes in December 2018 from Amazon India. Disappointed that the soles of these shoes have got detached from the shoe within 9 months of use. Please improve the quality of your shoes. Amazon link for these shoes : https://www.amazon.in/dp/B07FQJPF53/ref=cm_sw_r_cp_apap_DXy41Uzcsiaqn,amazonindia
2019-09-17 08:52:14+00:00,Money can’t buy happiness or save your neck! ★A DEAD HUSBAND★ http://amazon.com/gp/product/B00H870VMU/ aburke59 http://wp.me/P5rIsN-xM #ASMSG #amazonIndia ✎via Pizzazz Book Promotions http://wp.me/P5rIsN-Ft,amazonindia
2019-09-17 08:42:33+00:00,#Zarshi #ZarshiInternational #Fashion #Style #Women #WomenFashion #BollywoodFashion #Bag #Handbag #WomensEra #OnlineShoppingIndia #AmazonIndia #Flipkart #Amazon https://www.amazon.in/dp/B07XWF554K/ref=cm_sw_r_fa_dp_U_BUjGDbPH9292P,amazonindia
2019-09-17 08:19:40+00:00,#AmazonGreatIndianSaleQuiz Thanku Amazon india to make fastival with biggest surprising offer ,amazonindia
2019-09-17 08:08:16+00:00,want to buy 65inch frm which date it on sale on mi website or amazon india,amazonindia
2019-09-17 08:06:12+00:00,Amazon India announces the 'Great Indian Festival' http://ow.ly/z15s30pxZyl @amazon #businessgrowth #ecommerce #onlineshopping,amazonindia
2019-09-17 08:00:00+00:00,"Ravi Desai, Director, Mass and Brand Marketing, Amazon India, talks about the 6,000-km truck tour for the sale campaign, the marketing spends and going regional. @amazonIN",amazonindia
2019-09-17 07:40:00+00:00,Amazon India announces Great Indian Festival and Amazon Festive Yatra** #India #Amazon #AmazonIN #AmazonGreatIndianFestival #AmazonFestiveYatra,amazonindia
2019-09-17 07:18:45+00:00,"It's an amazing chance given by Amazon India to win such big prizes by trying your luck so, go and play this quiz try your luck #AmazonGreatIndianSaleQuiz",amazonindia
2019-09-17 07:13:04+00:00,Amazon India Online Shopping and Payments http://dlvr.it/RDFzNc,amazonindia
2019-09-17 07:13:04+00:00,Amazon India Online Shopping and Payments http://dlvr.it/RDFzPC,amazonindia
2019-09-17 06:58:45+00:00,"#AmazonIndia #amazonIN #GreatIndianFestival 2019. #Budget will not be a limit for this #celebration! Start #shopping #Diwali offers ranging across big deals on big brands, See More Details Here - https://amzn.to/2QeookX",amazonindia
2019-09-17 06:57:25+00:00,"Hi Amazon India, We are a seller on Amazon and our name of the store is Aart Store. some trying to redirect customer by giving his number on question and answer section. help us to fix this problem immediately product Link- https://www.amazon.in/Aart-High-Density-Furniture-Cushion-Perfect/dp/B07SGX6QFL/",amazonindia
2019-09-17 06:57:14+00:00,"In fact, there are such laundry-basket-type-kits for kids (available on Amazon US) to learn metamorphosis. Costs a bomb on Amazon India.",amazonindia
2019-09-17 06:42:30+00:00,#amazonIN #AmazonIndia Check out this page from HeadriseStart - BazaarRewards https://www.amazon.in/shop/influencer-15ce8b98?ref=cm_sw_tw_r_inf_own_influencer-15ce8b98_dp_Vo8d3OCfj6NXD,amazonindia
2019-09-17 06:30:00+00:00,Amazon India announces Great Indian Festival and Amazon Festive Yatra. || #India #Amazon #AmazonIN #AmazonGreatIndianFestival #AmazonFestiveYatra https://thepigeonexpress.com/amazon-india-announces-great-indian-festival-and-amazon-festive-yatra/,amazonindia
2019-09-17 06:28:52+00:00,@amazonIN #amazonindia #OPPOReno2Z,amazonindia
2019-09-17 06:20:07+00:00,"Amazon India remains optimistic for festive sale season https://in.fashionnetwork.com/news/Amazon-India-remains-optimistic-for-festive-sale-season,1137796.html?src=twt#twt",amazonindia
2019-09-17 06:17:28+00:00,#AmazonGreatIndianSaleQuiz #1Lakh #AmazonQuiz #AmazonIndia #AmazonIn #Amazon,amazonindia
2019-09-17 06:17:04+00:00,#AmazonGreatIndianSaleQuiz #amazonquiz #amazon #amazonindia @amazonIN @amazon @JeffBezos @narendramodi @BeingSalmanKhan @Cristiano @BarackObama,amazonindia
2019-09-17 06:14:28+00:00,Amazon India deals on Refrigerators https://broadbandforum.co/threads/amazon-india-deals-on-refrigerators.174904/,amazonindia
2019-09-17 06:13:56+00:00,I have answered all the question provided by Amazon India contest .So thanks to Vivo for providing this type of quiz .#vivoU10,amazonindia
2019-09-17 06:10:53+00:00,Everycom Electronics At #amazonconnect #amazonindia @AmazonConnect,amazonindia
2019-09-17 06:05:37+00:00,#SanyoAmazonQuiz #Sanyo43'4KTV #AmazonQuiz #AmazonIndia #AmazonIn #Amazon,amazonindia
2019-09-17 06:03:01+00:00,Yaa they said it only one first order.. But it doesn't say so on the sales page!!!! .. He directed me to the here's how section.. Don't expect such deceptive behavior from Amazon.. #amazonindia,amazonindia
2019-09-17 05:52:46+00:00,At Amazon connect Super Event #amazonconnect #amazonindia ,amazonindia
2019-09-17 05:50:13+00:00,Amazon connect @AmazonConnect #amazonconnect #AmazonGreatIndianFestival #amazonindia ,amazonindia
2019-09-17 05:40:00+00:00,Amazon India announces Great Indian Festival and Amazon Festive Yatra* #India #Amazon #AmazonIN #AmazonGreatIndianFestival #AmazonFestiveYatra,amazonindia
2019-09-17 05:39:54+00:00,#vivoU10Quiz #VivoU10 #AmazonQuiz #AmazonIndia #AmazonIn #Amazon,amazonindia
2019-09-17 05:28:48+00:00,"#amazonIN #AmazonIndia #Laptops price starting below ₹20,000: Shop from a wide range of laptops Across all leading top brands with secure https://amzn.to/2w5eBkf",amazonindia
2019-09-17 05:25:03+00:00,"Never undermine your struggles, as they always tend to be the base of all the fruitful endeavors in future. Sign up now: https://www.barrel13.com #ThoughtOfTheDay #Barrel13 #Quoteoftheday #empoweringwords #TuesdayThoughts #Amazonproductresearchtool #AmazonIndia #Amazonsellers",amazonindia
2019-09-17 05:25:00+00:00,Win a OnePlus7Pro with #OnePlus7ProQuiz at #Amazonindia,amazonindia
2019-09-17 05:15:54+00:00,"Braving the slowdown in consumption demand, e-commerce major Amazon India is eyeing 50 per cent more sales in the festive season this year. Amazon sees 50 per cent more sales this year - https://asianage.com/business/companies/170919/amazon-sees-50-per-cent-more-sales-this-year.html @AmitGoelLive @mi6rajesh @handleguru @ARC90114911",amazonindia
2019-09-17 05:15:54+00:00,"#amazonIN #AmazonBusiness is changing the way companies buy supplies. For most small businesses, #AmazonIndia Business is the solution and brings big benefits to businesses of all sizes and industries. http://bit.ly/DoBusiness",amazonindia
2019-09-17 05:08:16+00:00,#AmazonGreatIndianSaleQuiz #Amazonindia @amazon,amazonindia
2019-09-17 05:07:51+00:00,#AmazonGreatIndianSaleQuiz its time to celebrate because Amazon great indian sale is coming soon. go and check Amazon quiz and win exiting price. #amazonindia @amazon @amazongiveaway please guys go and check amazing quiz.,amazonindia
2019-09-17 05:03:58+00:00,AmazonBasics 15.6-inch Laptop and Tablet Bag [25% discount] https://amzn.to/2PTnRV4 #AmazonIndia #DealsOnPC,amazonindia
2019-09-17 05:01:24+00:00,Dietary fibers help improve digestive system. Nutriora Quinoa as grain has 2x dietary fiber compared to normal white rice. Nutriora. Shop Online Here: Nutriora : https://shop.nutriora.in Amazon India : Snap Deal : Flipkart : Paytm : #nutriora #indore,amazonindia
2019-09-17 05:00:00+00:00,Amazon India announces Great Indian Festival and Amazon Festive Yatra || #India #Amazon #AmazonIN #AmazonGreatIndianFestival #AmazonFestiveYatra https://thepigeonexpress.com/amazon-india-announces-great-indian-festival-and-amazon-festive-yatra/,amazonindia
2019-09-17 04:58:34+00:00,Get the #boult #audio #bass click here https://amzn.to/2LCiTZ7 #run #sports #amazonindia #getfit #sound #music #dealsoftheday,amazonindia
2019-09-17 04:43:59+00:00,"#amazonIN #AmazonBusiness is changing the way companies buy supplies. For most small businesses, #AmazonIndia Business is the solution and brings big benefits to businesses of all sizes and industries. http://bit.ly/DoBusiness",amazonindia
2019-09-17 04:37:33+00:00,#amazonIN #AmazonIndia Online shopping for #GreatIndianFestival #Quiz-1: Stores at https://amzn.to/305xy7E,amazonindia
2019-09-17 04:35:38+00:00,#QuizTimeMornigsWithAmazon #AmazonIndia #quiztimemorningwithamazon,amazonindia
2019-09-17 04:34:55+00:00,#amazonIN #AmazonIndia Online shopping from a great selection at #Amazon #App #Contest Store. https://amzn.to/3048Lkv,amazonindia
2019-09-17 04:04:55+00:00,#AmazonGreatIndianSaleQuiz Hope to be Winner Thank you #Amazon india,amazonindia
