date,tweet,word
2019-09-03 19:03:53+00:00,Kingston DT MicroDuo 32GB USB3.0 OTG Pen Drive [40% discount] https://amzn.to/32rc0zk #AmazonIndia #DealsOnPC,amazonindia
2019-09-03 18:19:26+00:00,I have done all possible things from my end but amazon India is still allowing other seller to sell under my brand name IF AMAZON DOES NOT REMOVE SELLERS FROM MY BRAND I WILL REPORT IN Consumer protection court for using my brand ASIN:B07X3JVY23 @flipkartsupport - BEST SERVICE,amazonindia
2019-09-03 18:09:33+00:00,"La OnePlus TV integrará 8 altavoces y soporte para Dolby Atmos: Según una filtración de Amazon India, la OnePlus TV llegará con 8 altavoces y 50 vatios de potencia. Además, tendrá soporte para sonido envolvente Dolby Atmos. OnePlus entrará de lleno en la… http://dlvr.it/RCPkhD",amazonindia
2019-09-03 17:40:42+00:00,#amazonindia #jeffbezos I have sent a detailed feedback to you on my experience but i must mention that Amazon's world class reputation is really on stack and may reduce drastically if you guys keep functioning this way,amazonindia
2019-09-03 17:18:13+00:00,Ustaz Ghamidi's book Meezan (English Translation) now available in India BUY THE BOOK ON Amazon India: https://amzn.to/34oIuMv,amazonindia
2019-09-03 17:10:25+00:00,#amazon #india #offers #fashion #freebies #coupons #deals #sale #discounts #pricedrop Get 1 Year Free Flipkart Plus Members ( Only For Students ). App Only Deal ( Open Link In App ) : https://www.flipkart.com/plus? Open Link In App &amp; Click Flipkart Plus Logo From Top Left Corner…,amazonindia
2019-09-03 17:04:34+00:00,#amazonindia #Amazon #jeffbezos #poorcustomerservice Worst ever experience buying a premium cellphone on Amazon Still struggling to return despite manufacturing defect Technical inspection partners and delivery partners are pathetic Service team has no authority to solve issues,amazonindia
2019-09-03 16:42:51+00:00,OnePlus TV è già presente su Amazon India con tanti nuovi succosi dettagli http://bit.ly/2ZE7qzJ,amazonindia
2019-09-03 16:34:52+00:00,"""Good intentions don't work you need mechanism"", quotes Amit Agarwal, Global Senior Vice President & Country Manager, Amazon India, in an exclusive session on 'Inventing on behalf of Customer' at #ETILC Watch now: http://bit.ly/2k0RUeE Know More: http://bit.ly/30tvYsA",amazonindia
2019-09-03 16:31:42+00:00,@Amazon_Buyers Very poor service from Amazon Here made a transaction without my permission What happened in Amazon India,amazonindia
2019-09-03 16:26:22+00:00,"Very cheap service...cheal third class ,,,,,frustrated delivery service by amazon india",amazonindia
2019-09-03 15:58:14+00:00,"Move over Ballet Slippers, there's a new polish in town. Consider Pink Lace the moodier, younger sister of everyone's favorite pinky-nude shade. Find more on Amazon India | http://www.juicecosmetics.in #JuiceCosmetics #JuiceLover",amazonindia
2019-09-03 15:52:03+00:00,"OnePlus TV Landing Page Live on Amazon India, Will Have 8 Speakers With Dolby Sound ",amazonindia
2019-09-03 15:52:03+00:00,"OnePlus TV Landing Page Live on Amazon India, Will Have 8 Speakers With Dolby Sound http://dlvr.it/RCPK8T @slideme",amazonindia
2019-09-03 15:50:18+00:00,"OnePlus TV Landing Page Live on Amazon India, Will Have 8 Speakers With Dolby Sound. https://drd.life/2ZPOeLL",amazonindia
2019-09-03 15:25:01+00:00,#amazon #india #offers #fashion #freebies #coupons #deals #sale #discounts #pricedrop Copper jug 1000ml ₹299 https://amzn.to/2LfAB4c,amazonindia
2019-09-03 14:58:43+00:00,"@amazon #amazonindia I was ordered iloft silicon MI3 band but order not delivered &amp; status showing delivered Tracking I'd:228455126469, this is 2nd time happened with my order. Very wrost customer support everytime they call without information. Amazon wrost courier facility.",amazonindia
2019-09-03 14:34:11+00:00,"@ShashiTharoor Sir, where can I place an order for author signed edition of ""An Era of Darkness""? I had placed an order with @amazonindia for Rs600 for an author signed edition. To my dismay, I received a poor quality pirated edition with a printed price of 99, not signed.",amazonindia
2019-09-03 14:26:29+00:00,#cheater #Amazon #Worstproductmanagement #Cheatingoncustomers #AmazonIndia #Nastycustomercaresevice #Rudecustomercarepeople After more than 15 follow ups replacement not dispatched.Customer care people not interested to take care the issue.Everytime asking to wait another 5 days.,amazonindia
2019-09-03 14:08:58+00:00,#amazonindia your Discount Price is more than MRP @amazonIN Why cheat customers with wrong mrp? @PiyushGoyal E-commerce price duping issue. @RamVilasPaswan_ National Consumer affair Price: Actual MRP 920/- Amazon MRP 2000/- After Discount 1000/- Delivery charges 100/-,amazonindia
2019-09-03 13:45:16+00:00,still my return #order is not picked 512274204461 . . recd a confirmation call but after that no response @amazonIN #Amazon #India #OnlineMarketing #CauveryACTION,amazonindia
2019-09-03 13:28:59+00:00,"We did have it available on Amazon India, but it's all sold out there! I'm not sure when the restock will be, but hopefully it'll come back soon.",amazonindia
2019-09-03 13:13:55+00:00,"Lost in the headlines about Amazon India offering domestic flights is that Amazon has been increasing its discount/cashback offerings from Oyo, Yatra, redBus, Abhibus, MakeMyTrip, Zoomcar, Fab Hotels, yada yada.",amazonindia
2019-09-03 13:09:20+00:00,Book Domestic Flight Tickets Online at Amazon India Get upto Rs 2000/- Cash back for Prime Members https://amzn.to/2PFB1VP,amazonindia
2019-09-03 13:04:56+00:00,"[Lowest Price Ever] Honor 9 Lite (Black, 4GB RAM, 64GB Storage) for Rs. 7999 at Amazon India Shop Here: https://amzn.to/2UnKQX2 #SuperDealsIndia #Offers",amazonindia
2019-09-03 13:03:54+00:00,boAt Stone 200 Portable Bluetooth Speakers (Blue) [60% discount] https://amzn.to/2E2T3ID #AmazonIndia #DealsOnElectronics,amazonindia
2019-09-03 13:02:04+00:00,Detals are below - Order no - 408-5492135-4874716 I have made arround 60 calls to the delivery boy since afternoon but he is not responding. @amazonIN @AmazonHelp #amazonindia #amazon what is happening? Where is my order.,amazonindia
2019-09-03 12:43:59+00:00,@JeffBezos @bolsavs @jeffblackburn @jeffawilke can you guys please hlp me with my issue amazon India is not helping me at all its been more than 10 days they are literally being very rude and unhelpful not even ready to help and they know they have not sent the right product. ,amazonindia
2019-09-03 12:36:04+00:00,Hello September. Wishing you wonderful with surprising Music Month. Order now in Amazon and Flipkart! https://lnkd.in/fNW5-zq https://lnkd.in/f_gMdR2 #bemighty #spotify #amazonindia #flipkart #musicplayer #fitness #wellness #motivation #music #bluetooth #fitindia #September,amazonindia
2019-09-03 12:05:44+00:00,OnePlus TV specs confirmed via Amazon India listing: look out for 55-inch 4K QLED with Dolby Atmos. @oneplus @OnePlus_IN,amazonindia
2019-09-03 12:03:53+00:00,boAt Chennai Super Kings Edition Bassheads 100 Wired Earphone with in-line Mic (Yellow) [70% discount] https://amzn.to/2OAHWyU #AmazonIndia #DealsOnElectronics,amazonindia
2019-09-03 12:01:02+00:00,"@amazonindia8 http://mazon.in Amazon India fooling prime customers with return policy T&amp;C, delivery staff says T&amp;C incorrect, broken price can be accepted but should be working ref clause 2.iv. #order 407-8920601-6653909 what a logic",amazonindia
2019-09-03 11:56:42+00:00,#OnePlus TV specs confirmed via Amazon India listing: look out for 55-inch 4K QLED with Dolby Atmos https://yourstory.com/2019/09/oneplus-tv-specifications-launch-amazon-india-listing @YourStoryCo,amazonindia
2019-09-03 11:45:29+00:00,"As per the landing page on @Amazon India, #SamsungM30s with 6.4"" sAmoled Infinity-U display, 48MP triple rear cameras and a massive 6000 mAh battery will launch at 12PM on 18th September. #Beeps ",amazonindia
2019-09-03 11:29:41+00:00,Amazon India defends its business strategies after spat with trader group over discounts https://www.indiatoday.in/business/story/amazon-india-defends-business-strategies-spat-discounts-1593916-2019-08-31 via @indiatoday #ChannelMAX #Amazon,amazonindia
2019-09-03 11:25:06+00:00,Find Best-Selling Amazon India products in your specific niche! Watch this Barrel13 Product Database tutorial to know how. http://bit.ly/2k1qrtm #AmazonBestSellers #ProductDatabase #Barrel13Tutorials #FindBestSellingProducts #AmazonProductResearchTool,amazonindia
2019-09-03 11:20:03+00:00,More OnePlus TV specifications confirmed via Amazon India listing http://ow.ly/XTjd30psYob [@TechRadar],amazonindia
2019-09-03 11:09:51+00:00,#OnePlusTV is coming with Alexa enabled control. So now control TV with voice #OneplusIndia #amazonindia ,amazonindia
2019-09-03 10:54:20+00:00,More OnePlus TV specifications confirmed via Amazon India listing – TechRadar https://www.betadroid.in/blog/more-oneplus-tv-specifications-confirmed-via-amazon-india-listing-techradar/,amazonindia
2019-09-03 10:53:58+00:00,"#news OnePlus TV su Amazon India: si sa tutto, prezzo escluso – HDblog https://goo.gl/fb/6oGtbD #android #234 #235",amazonindia
2019-09-03 10:52:46+00:00,"OnePlus TV su Amazon India: si sa tutto, prezzo escluso https://www.trendynet.it/oneplus-tv-su-amazon-india-si-sa-tutto-prezzo-escluso/",amazonindia
2019-09-03 10:47:30+00:00,"#Amazonindia #Flipkartoffers #deals #offers #sale #shoppingonline follow us &amp; enable notifications to ""all post"" so you never miss such updates Check full post here https://t.me/lootalert/4622",amazonindia
2019-09-03 10:45:13+00:00,"OnePlus TV su Amazon India: si sa tutto, prezzo escluso https://www.hdblog.it/2019/09/03/oneplus-tv-amazon-india-caratteristiche-prezzo/",amazonindia
2019-09-03 10:43:48+00:00,#amazon #india #offers #fashion #freebies #coupons #deals #sale #discounts #pricedrop Loot : wrangler women's jeans 85% off Starts ₹357 only Link http://fkrt.it/0DJ2MoNNNN,amazonindia
2019-09-03 10:14:23+00:00,OnePlus TV è già presente su Amazon India con tanti nuovi succosi dettagli - http://TuttoAndroid.net https://ift.tt/2Zu3qmo,amazonindia
2019-09-03 09:49:04+00:00,"https://www.icvstech.com/blog/flipkart-announces-hindi-interface-with-plans-for-other-native-languages Flipkart, the Indian e-commerce giant, is also now available in Hindi. Walmart-owned e-commerce platform is following in the footsteps of Amazon India as well as offering its interface in Hindi.",amazonindia
2019-09-03 09:43:06+00:00,OnePlus TV appare su Amazon India che ne conferma i dettagli http://dlvr.it/RCN8VF,amazonindia
2019-09-03 09:41:27+00:00,"@BoatNirvana These headphones work properly and the sound quality/battery backup is great. However, the earmuffs have been causing a lot of problem even and seem to wear and tear very easily. I had bought these from Amazon India back in late 2017. Can I get a replacement ? ",amazonindia
2019-09-03 09:35:07+00:00,OnePlus TV apare listat pe Amazon India https://arenait.ro/2019/09/03/oneplus-apare-listat-amazon-india.html,amazonindia
2019-09-03 09:33:03+00:00,Amazon India : LVS Toys Lord Ganesha Hindu Idol Soft Teddy Bear in 25 cm https://everyoffers.com/product/amazon-india-lvs-toys-lord-ganesha-hindu-idol-soft-teddy-bear-in-25-cm/,amazonindia
2019-09-03 09:28:05+00:00,"OnePlus TV su Amazon India: si sa tutto, prezzo escluso http://dlvr.it/RCN6TQ via @HDblog",amazonindia
2019-09-03 09:20:30+00:00,"amazon india best price: SONY Pan Drive Best Gadgets, https://amazoninbestprice.blogspot.com/2019/09/sony-pan-drive-best-gadgets.html?spref=tw",amazonindia
2019-09-03 09:11:57+00:00,OnePlus TV è già presente su Amazon India con tanti nuovi succosi dettagli https://ift.tt/2Zu3qmo,amazonindia
2019-09-03 09:05:01+00:00,OnePlus TV Listed on Amazon India; Revealing Key Features https://www.hellpc.net/oneplus-tv-listed-amazon-india/,amazonindia
2019-09-03 09:00:03+00:00,To kindle users in India.. here is a free ebook for the day: https://www.amazon.in/Nikola-Tesla-Imagination-Invented-Century-ebook/dp/B00CATSONE/ref=zg_bs_156563011_f_15?_encoding=UTF8&amp;psc=1&amp;refRID=4ZJF8T4BETRA66VT8VC0 Nikola Tesla: Imagination and the Man That Invented the 20th Century #kindle #AmazonIndia #FreeEbooks,amazonindia
2019-09-03 08:58:53+00:00,Amazon India : Klaxon Royal Corner Glass Shelf with Brass Fittings – 10 * 10 Inches https://everyoffers.com/product/amazon-india-klaxon-royal-corner-glass-shelf-with-brass-fittings-10-10-inches/,amazonindia
2019-09-03 08:53:58+00:00,"Amazon India : Signoraware Soup Set, 18-Pieces, Off White https://everyoffers.com/product/amazon-india-signoraware-soup-set-18-pieces-off-white/ https://everyoffers.com/product/amazon-india-signoraware-soup-set-18-pieces-off-white/",amazonindia
2019-09-03 08:38:25+00:00,What to do? no one gives a shit about my order in Amazon india.,amazonindia
2019-09-03 08:35:07+00:00,"Pathatic service by Amazon India. NO one is bother to do delivery of products i ordered. No 3rd time, its happening and i am a prime member also. I don’t know what is wrong with you. @amazonIN @JeffBezos @AmazonHelp @amazon",amazonindia
2019-09-03 08:28:38+00:00,More OnePlus TV specifications confirmed via Amazon India listing | TechRadar – NEWPAPER24 https://newpaper24.com/more-oneplus-tv-specifications-confirmed-via-amazon-india-listing-techradar-newpaper24/,amazonindia
2019-09-03 08:00:43+00:00,More OnePlus TV specifications confirmed via Amazon India listing https://qworldnews.com/more-oneplus-tv-specifications-confirmed-via-amazon-india-listing/,amazonindia
2019-09-03 07:56:30+00:00,More OnePlus TV specifications confirmed via Amazon India listing https://ift.tt/2MSqWTl,amazonindia
2019-09-03 07:55:23+00:00,More OnePlus TV specifications confirmed via Amazon India listing | TechRadar OnePlus is lastly transferring past sma... https://tech.ra... ,amazonindia
2019-09-03 07:49:13+00:00,Amazon India defends its business strategies after spat with trader group over discounts https://www.indiatoday.in/business/story/amazon-india-defends-business-strategies-spat-discounts-1593916-2019-08-31 via @indiatoday,amazonindia
2019-09-03 07:43:26+00:00,#AmazonPrime's #TheFamilyMan's poster is part of a marketing collaboration between #AmazonIndia and #OnePlus. Have you seen the poster yet? https://www.bgr.in/news/heres-the-first-look-of-amazon-primes-the-family-man-shot-using-a-oneplus-phone/,amazonindia
2019-09-03 07:42:44+00:00,OnePlus TV gets listed on Amazon India; Key specs revealed ,amazonindia
2019-09-03 07:40:03+00:00,OnePlus TV tem especificações confirmadas em listagem da Amazon Índia http://dlvr.it/RCMr9R,amazonindia
2019-09-03 07:31:43+00:00,More OnePlus TV specifications confirmed via Amazon India listing https://ift.tt/2ZqyzH8,amazonindia
2019-09-03 07:30:51+00:00,Automatic & Semi Automatic Washing Machine. CARE Electronics Limited Manufacturer Of Home Appliances. #care @washingmachine #automatic #semiautomatic #washingmachine. tradindia Amazon - India Flipkart Washing Machine CARE India Ashish Kumar Bansal http://careelectronicslimited.com,amazonindia
2019-09-03 07:16:34+00:00,"OnePlus TV spunta su Amazon India: il debutto è dietro l'angolo? ONEPLUS, OnePlus TV https://gizchina.it/2019/09/oneplus-tv-su-amazon-india-lancio-vicino/?utm_medium=Snap&amp;utm_source=Twitter",amazonindia
2019-09-03 07:12:45+00:00,"More OnePlus TV specifications confirmed via Amazon India listing The upcoming OnePlus TV has been leaked once again, this time via the Amazon India landing page. https://ift.tt/34kQwG7",amazonindia
2019-09-03 07:10:15+00:00,OnePlus TV gets listed on Amazon India revealing more details #oneplustv #OnePlus,amazonindia
2019-09-03 07:00:12+00:00,More OnePlus TV specifications confirmed via Amazon India listing http://www.techradar.com/reviews/more-oneplus-tv-specifications-confirmed-via-amazon-india-listing,amazonindia
2019-09-03 06:56:17+00:00,OnePlus TV gets listed on Amazon India revealing more details https://www.gizmochina.com/2019/09/03/oneplus-tv-amazon-india/,amazonindia
2019-09-03 06:50:59+00:00,#More #OnePlus #TV #Specifications #Confirmed #Via #Amazon #India #Listing https://is.gd/EtlWgM,amazonindia
2019-09-03 06:45:35+00:00,Mastela Musicsl Foldup Infant Seat. #ruchiez #ruchiezproduct #ruchiezfashion #onlinebabyshop #onlineshopping #shopping #style #fashion #babyshop #infantseat #babychair #bestonlineshop #tiktok #amazon @India https://www.instagram.com/p/B18IHIpFjtF/?igshid=jdety6a0v0t7,amazonindia
2019-09-03 06:39:46+00:00,More OnePlus TV specifications confirmed via Amazon India listing | TechRadar https://dailynews-india.com/more-oneplus-tv-specifications-confirmed-via-amazon-india-listing-techradar/,amazonindia
2019-09-03 06:39:43+00:00,More OnePlus TV specifications confirmed via Amazon India listing | TechRadar https://dailynews-india.com/more-oneplus-tv-specifications-confirmed-via-amazon-india-listing-techradar/,amazonindia
2019-09-03 06:39:19+00:00,OnePlus TV gets listed on Amazon India revealing more details – gizmochina https://www.betadroid.in/blog/oneplus-tv-gets-listed-on-amazon-india-revealing-more-details-gizmochina/,amazonindia
2019-09-03 06:36:34+00:00,"Get the #dealoftheday at #amazonindia #Vivo #V15Pro #mobilephone Vivo V15 Pro (Topaz Blue, 6GB RAM, 128GB Storage) with No Cost EMI/Additional Exchange Offers 16.23cm(6.39) FHD+ Ultra Fullview Super AMOLED display Triple Rear Camera Powerful Performance https://amzn.to/2Zxx1eq",amazonindia
2019-09-03 06:34:36+00:00,https://twitter.com/amitwani_512/status/1168496732306432001?s=19 @jeffawilke @go2pal @JeffBezos @consumerforum_ @JagoGrahakJago_ Hope you guys take my issue seriously #amazon #amazonindia @amazonIN,amazonindia
2019-09-03 06:34:17+00:00,More OnePlus TV specifications confirmed via Amazon India listing | TechRadar – Techlooks https://www.etechlooks.in/more-oneplus-tv-specifications-confirmed-via-amazon-india-listing-techradar-techlooks/,amazonindia
2019-09-03 06:32:14+00:00,Amazon India Offer : Get upto 70% off on Kids Footwear https://linksredirect.com/?pub_id=37279&amp;url=https://www.amazon.in/b/ref=PD_hm%3Fnode=4091095031%26pf_rd_p=550c7614-f598-4fbd-a9d7-96f9f9f3c992%26pf_rd_r=8AN5Z9T11KX5SQF52351 Valid till : Stock Lasts,amazonindia
2019-09-03 06:32:02+00:00,More OnePlus TV specifications confirmed via Amazon India listing http://dlvr.it/RCMh0W http://bit.ly/2IRT6fR,amazonindia
2019-09-03 06:25:08+00:00,https://ift.tt/2HUw0Td OnePlus TV specifications confirmed via Amazon India listing https://ift.tt/2MSqWTl Aakash Jhaveri 0,amazonindia
2019-09-03 06:25:07+00:00,"@Amazon india what is wrong with u people, my wife ordered some kitchen utensils n in return she got Adidas shorts.",amazonindia
2019-09-03 06:21:33+00:00,Till I don't get my money back I will be telling people through all media that Amazon India Chor hi thug hi they are looting people so please do not buy anything from them.,amazonindia
2019-09-03 06:20:07+00:00,OnePlus TV teaser page goes live on Amazon India #Uncategorized,amazonindia
2019-09-03 06:20:07+00:00,OnePlus TV teaser page goes live on Amazon India #Uncategorized https://techlomedia.in/2019/09/oneplus-tv-teaser-page-goes-live-on-amazon-india-70155/,amazonindia
2019-09-03 06:17:12+00:00,OnePlus TV gets listed on Amazon India; Key specs revealed ,amazonindia
2019-09-03 06:15:00+00:00,OnePlus TV 'Notify Me' page goes live on Amazon India; launch seems imminent ,amazonindia
2019-09-03 06:09:49+00:00,More OnePlus TV specifications confirmed via Amazon India listing https://upmytech.com/2019/09/02/23/more-oneplus-tv-specifications-confirmed-via-amazon-india-listing/,amazonindia
2019-09-03 06:09:22+00:00,Más especificaciones de OnePlus TV confirmadas a través de la lista de Amazon India | LaComparacion https://LACOMPARACION.COM/mas-especificaciones-de-oneplus-tv-confirmadas-a-traves-de-la-lista-de-amazon-india-lacomparacion/,amazonindia
2019-09-03 06:05:30+00:00,#amazonindia #twitter COD PRODUCT GOT RETURNED WITHOUT MY CONFIRMATION AND NOW THE SAME product customer services advised to order on pre paid. No escalation and complained registered taken,amazonindia
2019-09-03 06:05:20+00:00,Your favourite product on discount but don’t have the right bank card to avail it? Doesn’t matter. #UseMyCards is here to connect you to some noble soul who has the card and is willing to order the product for you. #BankCards #Cardsharing #Cardlending #Flipkart #AmazonIndia,amazonindia
2019-09-03 06:05:08+00:00,More OnePlus TV specifications confirmed via Amazon India listing https://clearcritique.com/more-oneplus-tv-specifications-confirmed-via-amazon-india-listing/,amazonindia
2019-09-03 06:04:56+00:00,@amazonIN hello Amazon india can you tell me why are you providing me the delivery boy details. Like contact number and etc. My parcel was out for delivery but their is no information given by your side regarding out for delivery. ,amazonindia
2019-09-03 05:59:42+00:00,"PURA One Life, One Bottle concept. Bottle can be converted into a straw, Sippy or small water bottle by swapping with another Pura Silicon lid Amazon India https://amzn.to/2UxteeP Firstcry:- https://goo.gl/KZpQrz",amazonindia
2019-09-03 05:58:30+00:00,"E-commerce market analyst said, Amazon India should hire more youth in their 20s and 30s given that unemployment rate is at a 45-year peak and job opportunities are scarce due to economic slowdown! https://www.hindustantimes.com/india-news/amazon-india-to-offer-to-jobs-to-ex-servicemen-their-spouses/story-EtrWCvAnK9vc5TyUjcNsYK.html #TuesdayThoughts #Recruitment #Jobs",amazonindia
2019-09-03 05:37:51+00:00,Amazon India if Replacement also does not work then,amazonindia
2019-09-03 05:37:13+00:00,Ups and downs and all the in-betweens. It would be an education! ★AN EDUCATION!★ http://bit.ly/AnEducation-BridgitteLesley #ASMSG bookboost #amazonindia,amazonindia
2019-09-03 05:31:24+00:00,"#AmazonIndia reveals a few key specifications of the upcoming #OnePlusTV, including its display size and more. Read on to find out @oneplus @OnePlus_IN https://www.bgr.in/news/oneplus-tv-key-specifications-confirmed-via-amazon-india-ahead-of-official-launch/",amazonindia
2019-09-03 05:27:16+00:00,An epic journey through the 20th century’s most iconic periods! ★UNEXPECTED GIFTS★ http://amzn.to/30VNLJr http://wp.me/P5rIsN-18S SarahMallery1 BookBoost #ASMSG #amazonindia ✎via Pizzazz Book Promotions http://wp.me/P5rIsN-Ft,amazonindia
2019-09-03 05:25:03+00:00,Not all products need Brick & Mortar Shops! Presenting some of the products you can easily start selling from home through #AmazonIndia! Sign up now: https://www.barrel13.com/ #ThingsYouCanSellFromHome #AmazonSellers #SellonAmazon #Books #EssentialOils #Barrel13,amazonindia
2019-09-03 05:20:11+00:00,Amazon India Chor hi thug hi they are looting people so please do not buy anything from them,amazonindia
2019-09-03 05:17:34+00:00,"OnePlus TV listed on Amazon India suggest 4K QLED, 50W 8 Speaker Setup #OnePlus #OnePlusTV #Amazon #India #SmartTV",amazonindia
2019-09-03 05:11:11+00:00,"Amazon India launched its delivery station in Pune, Maharashtra which is its largest delivery station in India. @projects_today @amazonIN @CMOMaharashtra @Dev_Fadnavis #warehouse Read More: http://bit.ly/2ZLOR90",amazonindia
2019-09-03 05:10:57+00:00,Amazon India : Cloth Theory Men’s Sweatshirt https://everyoffers.com/product/amazon-india-cloth-theory-mens-sweatshirt/,amazonindia
2019-09-03 05:04:03+00:00,Ant Audio W56 Wired Metal in Ear Stereo Bass Headphone (Black) [60% discount] https://amzn.to/2OXSEdL #AmazonIndia #DealsOnElectronics,amazonindia
2019-09-03 05:04:01+00:00,"Amazon India : Signoraware Velvet Jumbo Plastic Tumbler, 500ml, Pink https://everyoffers.com/product/amazon-india-signoraware-velvet-jumbo-plastic-tumbler-500ml-pink/ https://everyoffers.com/product/amazon-india-signoraware-velvet-jumbo-plastic-tumbler-500ml-pink/",amazonindia
2019-09-03 04:57:30+00:00,Amazon India rolls out initiative to hire former military personnel http://www.ecoti.in/8KW4Ra via @economictimes,amazonindia
2019-09-03 04:52:50+00:00,A charger whole family can share. Buy now on Amazon India: http://amazon.in/regor,amazonindia
2019-09-03 04:49:37+00:00,#QuizTimeMorningsWithAmazon #BlaupunktSpeakers #AmazonQuiz #AmazonIndia #AmazonIn #Amazon,amazonindia
2019-09-03 04:44:37+00:00,#QuizTimeMorningsWithAmazon #Amazonkindle #AmazonEcho #AmazonasFire #AmazonMusic #AmazonGiveaway #Amazonpromo #AmazonPrime #AmazonPrimeVideo #AmazonPrimeMembership #AmazonIndia Done !! #Amazon,amazonindia
2019-09-03 04:43:34+00:00,#QuizTimeMornigsWithAmazon #AmazonIndia #quiztimemorningwithamazon,amazonindia
2019-09-03 04:42:43+00:00,@amazon @AmazonHelp @amazonIN @JeffBezos Cheating by amazon india No product delivered No refund granted Now amazon India team is saying that i am not eligible for refund Dear @JeffBezos why i m not eligible for refund Need explanation from @amazonIN,amazonindia
2019-09-03 04:42:35+00:00,@amazon @AmazonHelp @amazonIN @JeffBezos Cheating by amazon india No product delivered No refund granted Now amazon India team is saying that i am not eligible for refund Dear @JeffBezos why i m not eligible for refund Need explanation from @amazonIN,amazonindia
2019-09-03 04:42:25+00:00,#OnePlusTV listing is live on Amazon India ,amazonindia
2019-09-03 04:41:18+00:00,@amazon @AmazonHelp @amazonIN @JeffBezos Cheating by amazon india No product delivered No refund granted Now amazon India team is saying that i am not eligible for refund Dear @JeffBezos why i m not eligible for refund Need explanation from @amazonIN,amazonindia
2019-09-03 04:41:04+00:00,@amazon @AmazonHelp @amazonIN @JeffBezos Cheating by amazon india No product delivered No refund granted Now amazon India team is saying that i am not eligible for refund Dear @JeffBezos why i m not eligible for refund Need explanation from @amazonIN,amazonindia
