date,tweet,word
2019-12-04 11:20:34+00:00,"And 3. Why PhonePe asked me to ""register"" yesterday, I tried giving my number and did 'forgot password', it said there is no user and asked me to register! Also, there is no SMS / Email communication from #PhonePe to me.",flipkart
2019-12-04 11:19:00+00:00,What do I need to do for an Honor 20 Fortnite Code? HUH?,flipkart
2019-12-04 11:17:52+00:00,"My questions are still not answered. 1. I didn't install Phone Pe in 2016. Then how this ID was created? 2. Your support team asked me if my card is linked to @Flipkart and YES, it is. But then you called after 10 minutes and said Flipkart has nothing to do with this!!",flipkart
2019-12-04 11:17:18+00:00,thanks flipkart for spoiling everything. Pls issue refund alse i am going to raise dipute eith my credit card.,flipkart
2019-12-04 11:16:07+00:00,D. All Of Above #NavyDay2019 #IndianNavy #contest #contestalert #giveaway #shopping #voucher #flipkart #indiannavyday #myloancare #baataapkeinterestki #WednesdayWisdom #WednesdayMotivation @MyLoanCare,flipkart
2019-12-04 11:15:58+00:00,Flipkart pe grocery hai. TataCliq pe clothes ,flipkart
2019-12-04 11:14:08+00:00,@rajneeeshkumar @_Kalyan_K @flipkartsupport @WorkAtFlipkart @Flipkart @FlipkartStories Undelivered: Sony PS4 Slim 1 TB wit... with tracking ID xxxxx could not be delivered today. We will deliver tomorrow.,flipkart
2019-12-04 11:13:53+00:00,ஆர்டர் செய்ததோ கேமரா... கிடைத்ததோ டைல்ஸ் கற்கள்- Flipkart நிகழ்ந்த சம்பவம் #Flipkart #Camera #Tiles #NewsJ https://www.newsj.tv/view/Ordered-Camera-...-Got-Tiles-Gems---Flipkart-incident-32588,flipkart
2019-12-04 11:13:36+00:00,@FlipkartStories @Flipkart @flipkartsupport @Walmart @FlipkartSellers,flipkart
2019-12-04 11:13:36+00:00,@flipkartsupport,flipkart
2019-12-04 11:13:14+00:00,@Flipkart how do i activate apple warranty on apple products brought from flipkart? Is it activated out of the box or do i have to do it myself?,flipkart
2019-12-04 11:12:52+00:00,"To ensure your Flipkart account details are safe, please start a private chat with us by clicking on the below link. - Sachin (2/2) ",flipkart
2019-12-04 11:10:55+00:00,COLOUR OS is The only thing letting this phone down for not buying!,flipkart
2019-12-04 11:09:36+00:00,At least add an colour picker accent customisation option to change the shity green accent color! It's easy you said you've got 6500 Dev's working on the os! Anyway you lied and failed to make it close to stock android!,flipkart
2019-12-04 11:08:57+00:00,After what time the payment is not deposited in your branch,flipkart
2019-12-04 11:08:22+00:00,Answer) D. All Of Above #NavyDay2019 #IndianNavy #contestalert #giveaway #shopping #voucher #flipkart #indiannavyday #indiacontest #myloancare. Join @SoniaKaurBindr1 @SajidSilawat1 @aanchalsweet92 @jaydip4m @7thNovember,flipkart
2019-12-04 11:07:28+00:00,Site for a five-star hotel http://bit.ly/@2Yd6AXN @ExportersIndia @ExportWW @IndiaEximBank @EximBankUS @CloudExpoAsia @AeroIndiashow @ICCCImumbai @CIIEvents @IndianBankInfo @TiEGlobal @USIBC @UKIBC @Walmart @Flipkart @amazonIN @DGCX @Airbus @Boeing @UNWTO @Indiamiceawards,flipkart
2019-12-04 11:07:22+00:00,"Not only amazon and flipkart there is Bigbasket, grofers,paytm mall and many more needs govt curbs.",flipkart
2019-12-04 11:07:08+00:00,D) All Of Above #NavyDay2019 #IndianNavy #contestalert #giveaway #shopping #voucher #flipkart #indiannavyday #indiacontest #myloancare,flipkart
2019-12-04 11:06:45+00:00,I would be very happy to go with MI note 8 4 64 variant@9999 killer beast hai moonlight white mai,flipkart
2019-12-04 11:06:04+00:00,"Ans Option D. All of the above, Mumbai, Kochi, Visakhapatnam #NavyDay2019 #IndianNavy #giveaway #shopping #voucher #flipkart #indiannavyday #myloancare #baataapkeinterestki #WednesdayWisdom #WednesdayMotivation @meensjaya @padmajaanu @2019Girijakriz @Madhumathy15 @tweety_aysshh",flipkart
2019-12-04 11:06:01+00:00,"Débat sur les Progressive Web Apps (PWA): belle dynamique dans les pays Android (Flipkart en Inde, au Brésil) qui va s'accélérer en 2020: au global selon @forrester 16% utilisent ou en pilote et 18% pensent tester dans les 12 prochains mois.",flipkart
2019-12-04 11:05:27+00:00,"Hybrid online-offline models such as this will drive increased penetration, growth and hopefully profits. Your views ? #myntra #flipkart ",flipkart
2019-12-04 11:05:22+00:00,"Top smartphones to buy under Rs 15,000 in December 2019 https://buff.ly/2sLxf2f @oppomobileindia @Vivo_India @Samsung_IN @XiaomiIndia @RedmiIndia @realmemobiles @amazonIN @Flipkart ",flipkart
2019-12-04 11:04:11+00:00,Answer) D. All Of Above #NavyDay2019 #IndianNavy #contestalert #giveaway #shopping #voucher #flipkart #indiannavyday #indiacontest #myloancare @vishalmalavya @swatic12 @TheMayankMishra @acidkidrock @Sanjiv_34,flipkart
2019-12-04 11:03:46+00:00,Answer) D. All Of Above #NavyDay2019 #IndianNavy #contestalert #giveaway #shopping #voucher #flipkart #indiannavyday #indiacontest #myloancare @Riannaoliver @bhansali_pramod @rkj14389 @saahil247 @Nitiraajsingh,flipkart
2019-12-04 11:02:56+00:00,Answer) D. All Of Above #NavyDay2019 #IndianNavy #contestalert #giveaway #shopping #voucher #flipkart #indiannavyday #indiacontest #myloancare @AmitChhajer8 @drjasminemehta @33reetika21 @Dhavalp363 @umeshkumar874,flipkart
2019-12-04 11:02:37+00:00,Answer) D. All Of Above #NavyDay2019 #IndianNavy #contestalert #giveaway #shopping #voucher #flipkart #indiannavyday #indiacontest #myloancare,flipkart
2019-12-04 11:02:22+00:00,Is this how you treat your prime customers!? Your Gurgaon sohna rd team cuts customers calls? This after promising the delivery- Shame on you guys - I should have chosen @Flipkart - pathetic and condescending!,flipkart
2019-12-04 11:00:50+00:00,"@Harman @JBLINDIA The issue was raised as soon as I got D product in April '19 invoice added 4 history of the case ,I get a call from some courier company that they are going to pick up the faculty equipment, there's no information from this brand could @Flipkart confirm ",flipkart
2019-12-04 11:00:22+00:00,Your service engineer came and I gave this using link,flipkart
2019-12-04 10:59:03+00:00,D. All Of Above #NavyDay2019 #IndianNavy #contestalert #giveaway #shopping #voucher #flipkart #indiannavyday #indiacontest #myloancare #baataapkeinterestki #win #WednesdayWisdom #WednesdayMotivation Join2win @ankittokalwar @Dhanashrirandi2 @himanshu_atram @shubhamdurge51,flipkart
2019-12-04 10:58:47+00:00,"@flipkartsupport very wrost services...This stuff was going to come today. But none of its delivery messages came. Call the people of Flipkart, then they are saying that the order will come till the head today. And this stuff is still in Varanasi. ",flipkart
2019-12-04 10:58:13+00:00,Ans- D. All Of Above #NavyDay2019 #IndianNavy #contest #contestalert #giveaway #shopping #voucher #flipkart #indiannavyday #myloancare #baataapkeinterestki #WednesdayWisdom #WednesdayMotivation,flipkart
2019-12-04 10:56:44+00:00,Ans) D All Of Above #NavyDay2019 #IndianNavy #contest #contestalert #giveaway #shopping #voucher #flipkart #indiannavyday #myloancare #baataapkeinterestki #WednesdayWisdom #WednesdayMotivation @MyLoanCare Join @BhavikaRajaswan @Chhayadhamecha @vidyathapa76 @mysterioussu,flipkart
2019-12-04 10:55:46+00:00,Please fill up the details in the below link and our team will get in touch with you: http://in.miquery.ind.mi.com,flipkart
2019-12-04 10:54:53+00:00,"Ready to sweat, ready for style! The #NUSHAthleisure Collection is live now! Available now on http://www.nush.in @myntra – http://myntra.com/nush @Flipkart @centralandme @AJIOLife @TataCLiQ &amp; @AmazonFashionIn | @AnushkaSharma",flipkart
2019-12-04 10:54:44+00:00,Please enable camera 2 api support in Nokia 5.1 plus..,flipkart
2019-12-04 10:54:38+00:00, ALL OF THE ABOVE #NavyDay2019 #IndianNavyDay #ContestAlert #giveaway #Flipkart #baataapkeinterestki @MyLoanCare Join @Shailes01893067 @JainShantilal12 @harshj5765 @tweetysweetie_2 @Dazzlingcutie1 @Rahul_14389 @cutebabe1028 @SonalJ_89 @SultanMd29,flipkart
2019-12-04 10:54:32+00:00,"Hi Rahul, we request you to kindly get in touch with Flipkart for further assistance. -Nadia",flipkart
2019-12-04 10:53:31+00:00,D. All Of Above #NavyDay2019 #IndianNavy #contestalert #giveaway #shopping #voucher #flipkart #indiannavyday #indiacontest #myloancare Join @Asheesh__Dubey @manish81080733 @amitpednekar85,flipkart
2019-12-04 10:53:20+00:00,"#Realme5s कल दोपहर 12 बजे #Flipkart पर बिक्री के लिए आएगा, जानें कीमत और ऑफर्स https://www.bgr.in/hi/mobile/realme-5s-flash-sale-tomorrow-12pm-via-flipkart-price-sale-offers-and-more-862009/",flipkart
2019-12-04 10:52:26+00:00,Ans) D. All Of Above #NavyDay2019 #IndianNavy #contest #contestalert #giveaway #shopping #voucher #flipkart #indiannavyday #myloancare #baataapkeinterestki #WednesdayWisdom #WednesdayMotivation @MyLoanCare Join @SushilChoudant2 @Freak35868338 @ContestOnly1 @InPulte,flipkart
2019-12-04 10:51:44+00:00,"@MiTVIndia @Flipkart The service engineer visited, and said that it is not working, you talk to the center, on talking, the center in charge said that this problem is coming in everyone, we cannot do anything in it, right now this problem is all over India. ",flipkart
2019-12-04 10:51:28+00:00,"To ensure that your Flipkart account information is safe, please start a private message with us. (2/2) - Suhas ",flipkart
2019-12-04 10:50:19+00:00,"Currently this is only a Flipkart member only meet-up, the idea is to bring people out of their stage fear to share their knowledge with people but if things go well we will open it to the entire UI/UX community. We cannot wait to do that!",flipkart
2019-12-04 10:49:39+00:00,@Paytm @Paytmcare @Flipkart @flipkartsupport Received call for KYC &amp; lottery winner Can u please explain how my order details gets passed on to scammers. Previously had complained to customer care regarding this. Scammers are using loopholes in ur system to scam people.,flipkart
2019-12-04 10:48:40+00:00,@Flipkart @flipkartsupport Your customer service team is of no use. Had to cancel multiple orders because of this.,flipkart
2019-12-04 10:48:37+00:00,D. All Of Above #NavyDay2019 #IndianNavy #contestalert #giveaway #shopping #voucher #flipkart #indiannavyday #indiacontest #myloancare Join @GauravP26479152 @NikitaBobade3 @bhavnajain189 @vishal_vadoliya @alpa_gupta @sd12dec @RiyaPorwal6 @Chandra56039776 @MeetuMyself,flipkart
2019-12-04 10:48:22+00:00,@Flipkart @Flipkart where is the order ? ,flipkart
2019-12-04 10:47:57+00:00,"First ask them to give proper service ,it take 2 months to process refund",flipkart
2019-12-04 10:46:47+00:00,There is no protection for consumers....cheat @Flipkart @Walmart still saying they sent an Apple iphone 6....will goto consumer court..trace the fingerprints in RIN Soap and conclude https://twitter.com/shrishastry/status/1200826333569224704,flipkart
2019-12-04 10:46:19+00:00,Ans {D} All Of Above #NavyDay2019 #IndianNavy #contest #contestalert #giveaway #shopping #voucher #flipkart #indiannavyday #myloancare #baataapkeinterestki #WednesdayWisdom #WednesdayMotivation @MyLoanCare Join @hars__98 @pareek932 @ranchikuldeep @Rubalsandhu5,flipkart
2019-12-04 10:45:59+00:00,Ans) D. All Of Above #NavyDay2019 #IndianNavy #contest #contestalert #giveaway #shopping #voucher #flipkart #indiannavyday #myloancare #baataapkeinterestki #WednesdayWisdom #WednesdayMotivation @MyLoanCare,flipkart
2019-12-04 10:44:47+00:00,"Sorry to hear that. We understand your concern about your Flipkart account. Please be assured, we'll definitely look into it and will get in touch with you at the earliest to address your concern. Request your patience. (1/2)",flipkart
2019-12-04 10:44:36+00:00,D. All Of Above #NavyDay2019 #IndianNavy #contestalert #giveaway #shopping #voucher #flipkart #indiannavyday #indiacontest #myloancare Join friends. @Ruchita33281726 @MeghnaJ46032597 @SanjayJ45449140 @GauravP26479152 @3Madhvi,flipkart
2019-12-04 10:44:35+00:00,@_Kalyan_K @Flipkart @flipkartsupport Is the customer service so worst.? I don't have any communication.. any solution.. no calls . And also products were not delivered today also. Are you guys sleeping? This is what the customer values to you? Very very worst experience ever,flipkart
2019-12-04 10:44:03+00:00,"Swaad Bhi, Sehat Bhi Try out our Premium Param Desi Ghee. Now available on #Flipkart #AmazonPrime #PaytmMall http://www.paramdairy.com",flipkart
2019-12-04 10:43:55+00:00,"Very, very nice beautiful promotional picture of ranbir kapoor sir for flipkart fashion ad superb excllent fantastic awesome wow outstanding he is wearing a black colour sunglesses is superb nice perfect ",flipkart
2019-12-04 10:43:51+00:00,Flagship Killer #RealmeX2Pro #fastestChargingFlagship Technology Hope ,flipkart
2019-12-04 10:43:07+00:00,"Flipkart SmartBuy Fast Charge Titanium Coated Cordless USB Trimmer (Black, Blue) ₹ 950 ₹ 569 http://fkrt.it/hwv0C~uuuN",flipkart
2019-12-04 10:42:41+00:00,#retailnet I placed one order from Flipkart and exchange cancellation request is still not accepted from your end please help me out,flipkart
2019-12-04 10:42:33+00:00,"New post (Flipkart parent infuses Rs 2,839 crore in wholesale arm) has been published on http://Fuzzy.One - http://www.fuzzy.one/blog/2019/12/03/flipkart-parent-infuses-rs-2839-crore-in-wholesale-arm/",flipkart
2019-12-04 10:42:21+00:00,#NavyDay2019 #contestalert #giveaway #voucher #flipkart #indiannavyday #myloancare #baataapkeinterestki #WednesdayWisdom #WednesdayMotivation Answer - (d) All Of Above,flipkart
2019-12-04 10:40:19+00:00,"@_Kalyan_K at least as a CEO of Flipkart have a courtesy to call it's customers who are facing issues with the customer service... Worst website, worst customer service .. #Flipkartfraud",flipkart
2019-12-04 10:39:50+00:00,"Flipkart SmartBuy Fast Charge Titanium Coated Cordless USB Trimmer (Black, Blue) ₹ 950 ₹ 569 http://fkrt.it/hwv0C~uuuN",flipkart
2019-12-04 10:38:57+00:00,Ans) D. All Of Above #NavyDay2019 #IndianNavy #contest #contestalert #giveaway #shopping #voucher #flipkart #indiannavyday #myloancare #baataapkeinterestki #WednesdayWisdom #WednesdayMotivation @MyLoanCare Join @HarpreetS95 @Chhayadhamecha @VimalDarji5 @mysterioussu,flipkart
2019-12-04 10:38:23+00:00,"Thanks for taking the time to let us know. We'll certainly work on it. In future, to ensure that your Flipkart account information is safe, please start a private message with us by clicking on the link below. - Somaiah ",flipkart
2019-12-04 10:38:09+00:00,[Promotional Picture] Ranbir Kapoor for #FlipkartFashion @Flipkart ,flipkart
2019-12-04 10:37:10+00:00,@Flipkart why is the option to pay via phone is available ? I paid thru phone pe but your executive says to pay COD...wht to do now ?,flipkart
2019-12-04 10:37:06+00:00,#hotstar #netflix #ebay #flipkart #amazonkindle #kobo #aws #azure #googlecloud #twitch #mlg #youtube #amazonpay #googlepay #paytm #amazonlogistics #fedex #twitter,flipkart
2019-12-04 10:36:35+00:00,"D. All Of Above #NavyDay2019 #IndianNavy #contestalert #giveaway #shopping #voucher #flipkart #indiannavyday #indiacontest #myloancare Tagging, @KSneha005 @Jay_parmar17 @SweetsSmiling @KulAnik8 @Monu_17",flipkart
2019-12-04 10:36:17+00:00,@Flipkart please offer 10 years warranty on compressor for marq side by side refrigerators as most of the companies are offering it and consumers can beleive it as good brand,flipkart
2019-12-04 10:35:38+00:00,With 1.5 year old Opreating System ye bhi toh mention karo #WeWantcoloros7,flipkart
2019-12-04 10:35:31+00:00,"@Flipkart ordered labrada whey protein (product weight around 2kg vanilla flavor). I rcvd 1875gm vanilla. Info. displayed on your site, customer should get what he/she is ordering. We are paying for something &amp; getting something else, no return policy is there for this product.",flipkart
2019-12-04 10:35:30+00:00,D. All Of Above #NavyDay2019 #IndianNavy #contest #contestalert #giveaway #shopping #voucher #flipkart #indiannavyday #indiacontest #myloancare #baataapkeinterestki #win #WednesdayWisdom #WednesdayMotivation Join @jainusha30 @BhavikaRajaswan @bhavnajain189 @pinkyk1980 @kliverma,flipkart
2019-12-04 10:34:38+00:00,Realme the phone you rejected to give update are the real influencer of realme So don't dare to cheat with us Ek batt batao 7 realme phone mene khud ne recommend logo koh kiye ha family me friend me sab mujhse aah kar puchte ha ki kon sa phone lu ye buget ha #WeWantcoloros7,flipkart
2019-12-04 10:33:53+00:00,Yes we want it #WeWantcoloros7,flipkart
2019-12-04 10:33:14+00:00,"Grab the Deal - https://bit.ly/2YmTW8I Flipkart Big Shopping Days Sale: Buy TV, Electronics &amp; Large Appliances + Get Upto 70% OFF + Flat 7% GP Rewards + 10% Off On HDFC Cards. #FlipkartSale #FlipkartOffers #FlipkartBigShoppingDaysSale #GoPaisaOffers #GoPaisaDeals #GPCashback",flipkart
2019-12-04 10:33:06+00:00,"Hi Kamal, we would like to inform you that Flipkart is our authorized online seller. Thanks! - Team JBL",flipkart
2019-12-04 10:31:21+00:00,"To ensure that your Flipkart account information is safe, please start a private message with us by clicking on the link below. - Shalni (2/2) https://bit.ly/2OgiIkt",flipkart
2019-12-04 10:30:46+00:00,Flipkart- Buy Nivea Water lily &amp; Oil Shower Gel – Pack of 3 (3 x 250 ml) at Rs 289 https://is.gd/f9JqnQ,flipkart
2019-12-04 10:30:42+00:00,"It's really sad, flipkart is still not giving any priority to my case. Its been more than a month since I posted the complaint.",flipkart
2019-12-04 10:30:13+00:00,#NavyDay2019 #IndianNavy #contestalert #giveaway #voucher #flipkart #indiannavyday #myloancare #baataapkeinterestki #WednesdayWisdom #WednesdayMotivation Answer- (d) All of the above. Tagging-@chilled_Sup @PritiNivoriya @SoumickBose1,flipkart
2019-12-04 10:30:10+00:00,*INCREASED CASHBACK ALERT* Why step out in the cold when fresh groceries can come knocking at your door?! Order Now: http://bit.ly/2qnOyWk . #grocery #supermart #Flipkart #FlipkartIndia #CashKaro #Cashback #CashbackApp #YouGetMore #savings,flipkart
2019-12-04 10:30:00+00:00,Then they will say we have given Android 10 update that's it you got one major update #WeWantcoloros7,flipkart
2019-12-04 10:28:54+00:00,#NavyDay2019 #contestalert #giveaway #voucher #flipkart #indiannavyday #myloancare #baataapkeinterestki #WednesdayWisdom #WednesdayMotivation Answer - (d) All Of Above,flipkart
2019-12-04 10:28:17+00:00,D. All Of Above #NavyDay2019 #IndianNavy #contestalert #giveaway #shopping #voucher #flipkart #indiannavyday #indiacontest #myloancare Join @GauravP26479152 @NikitaBobade3 @RiyaPorwal6 @Chandra56039776 @MeetuMyself,flipkart
2019-12-04 10:28:17+00:00,AWB no. is with FLIPKART. As the product is to be returned via FLIPKART,flipkart
2019-12-04 10:28:16+00:00,D. All Of Above #NavyDay2019 #IndianNavy #contest #contestalert #giveaway #shopping #voucher #flipkart #indiannavyday #myloancare #baataapkeinterestki #WednesdayWisdom #WednesdayMotivation @MyLoanCare Tagging @imsomak @1986_jaiswal @imshrija @much_simran @Jay_parmar17,flipkart
2019-12-04 10:28:15+00:00,@flipkartsupport @flipkartsupport @_Kalyan_K NOW I M FILING A CASE AGAINT YOU AS YOU R NOT GIVING ME ANY UPDATE ON THE MONEY THAT I HAD IN MY FLIPKART WALLET ALSO I SIMPLY ASKED YOU TO CALL ME FOR THIS DISCUSSION BUT U R PLAYING WITH THIS GAME OF EMAIL,flipkart
2019-12-04 10:27:30+00:00,never ever use @Flipkart for shopping use @amazonIN. because they deliver product late and customer care take 20 min to understand our concern then say it's a technical error you will get it by tomorrow and in last my product got canceled by your delivery agent.worst experience,flipkart
2019-12-04 10:25:29+00:00,Flipkart- Buy Nivea Water lily &amp; Oil Shower Gel – Pack of 3 (3 x 250 ml) at Rs 289 http://www.dealnloot.com/daily-deals/health-beauty/flipkart-buy-nivea-water-lily-oil-shower-gel-pack-of-3-3-x-250-ml-at-rs-289/,flipkart
2019-12-04 10:25:10+00:00,Ans D). All Of Above #NavyDay2019 #IndianNavy #contestalert #giveaway #shopping #voucher #flipkart #indiannavyday Join __________________ @KDivya18740584 @Hemantk26918833 @LokeshD47301142 @shubham599gupta @mysterioussu @wasimkh00 @karan875 @coolkishore59,flipkart
2019-12-04 10:24:10+00:00,D. All Of Above #NavyDay2019 #IndianNavy #contestalert #giveaway #shopping #voucher #flipkart #indiannavyday #indiacontest #myloancare Join @RuchikaJain89 @Raghavendra0703 @ramyavellanki @cuteushakumari @sumeet0901,flipkart
2019-12-04 10:24:02+00:00,D. All Of Above #NavyDay2019 #IndianNavy #contestalert #giveaway #shopping #voucher #flipkart #indiannavyday #indiacontest #myloancare @MyLoanCare,flipkart
2019-12-04 10:23:30+00:00,d). All Of Above #NavyDay2019 #IndianNavy #contestalert #giveaway #shopping #voucher #flipkart #indiannavyday Join @shaiti7 @Piyujain12 @ChinmayaNaik09,flipkart
2019-12-04 10:23:29+00:00,D. All Of Above #NavyDay2019 #IndianNavy #contestalert #giveaway #shopping #voucher #flipkart #indiannavyday #indiacontest #myloancare,flipkart
2019-12-04 10:23:22+00:00,Flipkart- Buy Kodak 108cm (43 inch) Ultra HD (4K) LED Smart TV at Rs 19999+ 10% off via HDFC Card https://is.gd/7yWDax,flipkart
2019-12-04 10:23:13+00:00,D. All Of Above #NavyDay2019 #IndianNavy #contestalert #giveaway #shopping #voucher #flipkart #indiannavyday #indiacontest #myloancare,flipkart
2019-12-04 10:22:26+00:00,@Flipkart you guys are no longer trustworthy and even put wrong descriptions of the product. Your technician said this is a faulty product and yet you deny it.,flipkart
2019-12-04 10:21:48+00:00,#contest Flipkart voucher ,flipkart
2019-12-04 10:21:11+00:00,@Flipkart @flipkartsupport 1-look at the pic where you claim that the product is moisture free and it has additional protection. 2- Now look at the fungus the wardrobe has caught and the shelves has blended because of it. 3- Yet you guys claim that it is not the product fault.,flipkart
2019-12-04 10:20:30+00:00,Did a huge amount of e-Shopping @Flipkart Yesterday night.,flipkart
2019-12-04 10:19:57+00:00,"Also, we'd like to tell you, please do not reveal Flipkart account details here. You can just DM us by clicking the below link. - Abdaa (2/2) ",flipkart
2019-12-04 10:19:33+00:00,ETF for Govt enterprises and corporations http://bit.ly/2OKN81j @ExportersIndia @ExportWW @IndiaEximBank @EximBankUS @CloudExpoAsia @AeroIndiashow @ICCCImumbai @CIIEvents @IndianBankInfo @TiEGlobal @USIBC @UKIBC @Walmart @Flipkart @amazonIN @DGCX @Barclays @BankofAmerica @HSBC,flipkart
2019-12-04 10:18:38+00:00,"@Flipkart I have placed one order for Jacket vide order no. OD117153910231564000. I applied for exchange request but when wishmaster came for exchange and pickup he refused to take it back stating that no tag is their, so you have to mention that thing also in the comments.",flipkart
2019-12-04 10:18:33+00:00,"No one has contacted me as of now, is this how @Flipkart defines ""earliest""?",flipkart
2019-12-04 10:18:29+00:00,@Flipkart Claims are rejected and cases are being closed immediately without providing a day for the Seller to respond @FEcoms_India @AIOVA3 @amazonIN @PaytmMall What a Dadagiri,flipkart
2019-12-04 10:18:08+00:00,Flipkart- Buy Kodak 108cm (43 inch) Ultra HD (4K) LED Smart TV at Rs 19999+ 10% off via HDFC Card http://www.dealnloot.com/daily-deals/home-kitchen/flipkart-buy-kodak-108cm-43-inch-ultra-hd-4k-led-smart-tv-at-rs-19999-10-off-via-hdfc-card/,flipkart
2019-12-04 10:17:20+00:00,One minus point of realme x2 pro is that notch If realme x2pro comes with bezel less phone then I can proudly say that it can beat One plus 7 pro,flipkart
2019-12-04 10:16:59+00:00,Order saturday and still not shipped...,flipkart
2019-12-04 10:16:33+00:00,"Overall the slowdown is felt but if you look at flip side of it, it has not impacted much on consumer spending..If we look at the amazon and flipkart sales that happened recently, it has contributed more than 19k crores in just 6 days",flipkart
2019-12-04 10:16:25+00:00,I this product on Flipkart! vibhavari Cold Pressed Groundnut Oil Groundnut Oil Plastic Bottle http://dl.flipkart.com/dl/vibhavari-cold-pressed-groundnut-oil-plastic-bottle/p/itmbdd93c7c26db8?pid=EDOFMKJUVNQDVAJU&amp;cmpid=product.share.pp #buyonflipkart via @Flipkart,flipkart
2019-12-04 10:16:05+00:00,"Flipkart- Buy Wonderchef Ruby Outer Lid 2 L, 3 L, 5 L Induction Bottom Pressure Cooker at Rs 1199 https://is.gd/W3LijL",flipkart
2019-12-04 10:16:02+00:00,"@flipkartsupport @Flipkart @_Kalyan_K MY ISSUE HAS NOT BEEN ADDRESS BY FLIPKART IN THE EMAIL, I WANT SOMEONE TO CALL ME AND ADDRESS MY ISSUE. I M TALKING ABOUT THE MONEY NOT ACCOUNT..",flipkart
2019-12-04 10:15:23+00:00,"Thanks for your revert back over phone. Hope things happen as committed in timely fashion. Albeit, this round of my shopping with flipcart has begun with unpleasant experience. @Flipkart @Kodak",flipkart
2019-12-04 10:14:27+00:00,@flipkartsupport @Flipkart I want someone to call me now.. why u guys are not talking about the money in my wallet I have been asking this when I will get the money or you saying that I won't get the money.. I WANT SOMEONE TO CALL ME. I M FILLING A CASE WITH CONSUMER FORUM,flipkart
2019-12-04 10:13:52+00:00,Best Popular MI Note 7 | Flash Sale Set for March 13 via Flipkart #samsungsmartgadget #gadgetitems,flipkart
2019-12-04 10:13:42+00:00, *Flipkart Refrigerators Sale + 10% instant discount with HDFC Cards - BEST OFFER* *Single Door https://ekaro.in/enkr2019120434461953 *Double Door https://ekaro.in/enkr2019120434461959 *Triple door https://ekaro.in/enkr2019120434461970 *Side by Side https://ekaro.in/enkr2019120434461984 *Convertible https://ekaro.in/enkr2019120434461993,flipkart
2019-12-04 10:13:23+00:00,"83% OFF 144 TC Microfiber Double Floral Bedsheet (Pack of 1, Multicolor) Offer on Flipkart ",flipkart
