date,tweet,word
2019-11-23 06:37:54+00:00,@myntra i have done my first payment throug paypal and in application they mentioned that you will get 50% cashback voucher but i never got they are making fool to everyone they will not give any vouchers.don't be trap on this.,myntra
2019-11-23 06:32:34+00:00,Very nice video,myntra
2019-11-23 06:29:39+00:00,"Glam it up the #NUSH way! Get this look now on http://www.nush.in, @myntra –http://myntra.com/nush, @Flipkart @centralandme @AJIOLife @TataCLiQ &amp; @AmazonFashionIn | @AnushkaSharma",myntra
2019-11-23 06:29:39+00:00,I have ordered a cargo pant from myntra and in a single wash color of pant faint such a poor quality product from flipkart nowadays so bycot mytra from now ownwards @MyntraSupport @myntra @ndtv,myntra
2019-11-23 06:28:38+00:00,Nice ..,myntra
2019-11-23 06:23:45+00:00,"Unfortunately, we have not received it. We request you to re-check again. -AG",myntra
2019-11-23 06:23:36+00:00,"Do you ever buy life style from @AJIOLife I request don't follow and don't buy from @AJIOLife Worst , experience from them and customer care response. You , Don't believe I have kept on order on November 3rd still not received. I would suggest go for @myntra @JabongIndia",myntra
2019-11-23 06:17:06+00:00,I have already sent you the bar cide number,myntra
2019-11-23 06:15:03+00:00,"Trusna, we have replied here http://srkl.in/6014BIh52O -DD",myntra
2019-11-23 06:14:41+00:00,"Trusna, we have responded here http://srkl.in/6011BIh52z -DD",myntra
2019-11-23 06:14:20+00:00,"Trusna, we are devastated to hear this and apologize for this harrowing experience you have had to endure with us. Do not worry as we've arranged a callback for you and one of our case managers will get in touch with you by 8 PM today in this regard. Request your patience. -DD",myntra
2019-11-23 06:13:33+00:00,"Hi Madhur! To hear such feedback is very upsetting and it was never our intention. We understand that the offer is a cashback point exclusively for our customers through our partner HDFC. At Myntra, we believe in (cont) http://srkl.in/l/6012BIh5F2",myntra
2019-11-23 06:09:11+00:00,"Yes, it will! We've replied to you via DM. -AG",myntra
2019-11-23 06:07:59+00:00,"hey @Uber_India, @amazonIN, @myntra and @oyorooms haaaaaaaave you met @getsimpl? #KeepItSimpl",myntra
2019-11-23 06:02:46+00:00,Osm,myntra
2019-11-23 06:01:59+00:00,We've replied to you via DM. -AG,myntra
2019-11-23 06:01:02+00:00,Nice businesses NUSH....,myntra
2019-11-23 06:00:53+00:00,#myntra is fooling people by giving 10% cashbacks from hdfc. It's just an point system which will give you half of point in your card. Don't go with cashbacks offers with myntra They don't provide you. Fake process #hdfcbank,myntra
2019-11-23 06:00:49+00:00,We've replied to you via DM. -AG,myntra
2019-11-23 06:00:27+00:00,"We will answer all your questions, Jitendra. We want to end this hassle for you. Kindly share with us the requested bar code details so that we can help you by giving the best possible resolution. -AG",myntra
2019-11-23 05:56:07+00:00,"When confronted, he was on full offensive mode. Finally, picked it up and asked me to throw it in the dustbin. Well done Myntra! Maan gaye!",myntra
2019-11-23 05:55:04+00:00,Gajanan! We truly regret the hassle that you had to go through regarding the delivery. Please be assured that we've escalated this issue. Our case manager will get in touch with you by today before 8:00 PM & address (cont) http://srkl.in/l/6011BIh5vP https://twitter.com/messages/compose?recipient_id=89443197,myntra
2019-11-23 05:54:17+00:00,"@MyntraSupport an ""agent"" came to pick up some items. He didn't mind littering right in front of my house &amp; that too with full impunity. Apparently, he didn't like the packet in which I returned and decided to simply throw it, right there! Wow! Anti-Swach Bharat at Myntra inc.?",myntra
2019-11-23 05:51:47+00:00,"Hi Priyam! We understand your concern with regards to the refund for the product ""Ginger by Lifestyle Women White Sneakers"". As we can check the product was picked up on 15th November and once picked, it will then take 7 business days for (cont) http://srkl.in/l/6019BIh5QP",myntra
2019-11-23 05:49:23+00:00,Okay great,myntra
2019-11-23 05:47:20+00:00,"@myntra If this pickup case is not resolved, I am going to file a case in consumer forum along with the previous case of miss delivery. It's not about the money, you have mentally disturbed me a lot.",myntra
2019-11-23 05:44:35+00:00,@myntra @MyntraSupport Order of 18Nov still not delivered. Shows approx delivery as 28 Nov. What a pity.,myntra
2019-11-23 05:43:54+00:00,"@myntra Again, the pickup guy is refusing to pick.. Your service really really really suck..",myntra
2019-11-23 05:41:16+00:00,@myntra @ecom_express replied in DM . Not sure if it will make any difference??,myntra
2019-11-23 05:39:40+00:00,No buddy!! It aint fake,myntra
2019-11-23 05:38:01+00:00,How much time will it take to be returned?Will i get my original order or have i wasted my time and both.Can i get reply from you MYNTRA? very much disappointed.,myntra
2019-11-23 05:35:16+00:00,"Please talk to the pickup guy, they will stay in the campus till 1pm..",myntra
2019-11-23 05:34:41+00:00,How disgusting your service is Myntra..,myntra
2019-11-23 05:34:16+00:00,They said they haven't received some message.. Asking me to again file a complain..,myntra
2019-11-23 05:33:10+00:00,The pickup guy is right here and not receiving..,myntra
2019-11-23 05:28:40+00:00,"Thank you for sharing the details, Animesh! Please be assured, we have highlighted the issue & are already working on it. One of our case managers will get in touch with you today at any time between 11 am to 8 pm and address the issue (cont) http://srkl.in/l/6016BIh5mA",myntra
2019-11-23 05:26:04+00:00,@myntra,myntra
2019-11-23 05:25:15+00:00,@myntra @MyntraSupport @gurgaonpolice @cmohry @HaryanaPolice27 @mlkhattar,myntra
2019-11-23 05:22:25+00:00,,myntra
2019-11-23 05:20:40+00:00,We have responded via http://srkl.in/6011BIh5Yv. -CP,myntra
2019-11-23 05:20:38+00:00,"@myntra kindly refund my money of white sneakers ,that was picked on 15 nov. there is no update after 19 nov ,kimdly update it and refund my money",myntra
2019-11-23 05:20:22+00:00,"Hi Anupama! It is unfortunate that things turned out this way. Request you to DM us the respective order number that you are referring to, so that we can assist you accordingly. -CP",myntra
2019-11-23 05:19:11+00:00,I ordered a pepe jeans shirt and i was delivered with a women kurta with shipping address of http://PUNE.My adress was of Kota RAJASTHAN. Is myntra not wasting our time and money.?,myntra
2019-11-23 05:17:29+00:00,@myntra Very 3rd Class and Bad service. Don't Purchase on @myntra. Not delivery yet. ,myntra
2019-11-23 05:15:25+00:00,"To hear such feedback is very upsetting and is definitely not the impression we want you to have of us. If you have had any bad experience, please share the order number and regd. Email ID elaborating the concern via DM so that we can get it fixed. Awaiting your response. -AG",myntra
2019-11-23 05:14:15+00:00,@myntra my only humble and genuine request from team Myntra is to get my product deliver on or before 25th November. Else I will be left with no other option than to register a complain with consumer forum.,myntra
2019-11-23 05:09:59+00:00,"Jitendar, we understand you are not happy with the product delivered. We never intended to cause the experience & this certainly is an unusual instance. We request you to share with us the below details via DM, so we can work on getting (cont) http://srkl.in/l/6017BIh5iH",myntra
2019-11-23 05:07:23+00:00,@myntra @ecom_express your carelessness is reflecting your attitude for customer and how little u think of them ? With this behaviour you are not going to stay in business for very long . Mark this!!,myntra
2019-11-23 05:07:12+00:00,The product is unused and unwashed,myntra
2019-11-23 05:06:15+00:00,@myntra @ecom_express this is how you use your system to play ‘request and complain’ game with customer? Do you have any respect of customers’ time? Are we suppose to keep calling and following up with all the support members forever living all important work behind??,myntra
2019-11-23 05:05:58+00:00,Email id-: animeshsingh203@gmail.com Order number-: 1125795-6361997-3813903,myntra
2019-11-23 05:04:14+00:00,"Hi Girish, as we can check a refund of ₹412 has been initiated by Myntra and the same is already processed from our end on 21st November. It will be credited to your account within 2-5 working day from the refund date. (1/2)",myntra
2019-11-23 05:03:19+00:00,"Hi Anupama! That's not good to hear. This is not the experience that we want you to have with us. Kindly give us a chance to look into it. Please DM us your regd. e-mail ID or order number, so that we can assist you accordingly. - VR",myntra
2019-11-23 05:00:10+00:00,I had a conversation with your escalation team yesterday and he committed me to deliver the product on or befor 25th . I am asking update on that only @myntra @MyntraSupport,myntra
2019-11-23 04:59:56+00:00,Thanks for reaching out to us. We truly regret the hassle that you had to go through regarding the order. We would like to inform you that we will unable to accept the exchange as an option for the same is not available (cont) http://srkl.in/l/6018BIh55k https://twitter.com/messages/compose?recipient_id=89443197,myntra
2019-11-23 04:58:29+00:00,@myntra @ecom_express raised return request six times &amp; is cancelled.Evry time I am raising complain to @myntra and evrytm as a pacifier they r raising new return request.@ecom_express is giving a very short miss call and then cancelling the request with status customer cancelled,myntra
2019-11-23 04:53:15+00:00,"@myntra @MyntraSupport Team, My recent order is marked as delivered and I haven't received it. Tried calling customer care but was told that I'll get a mail to verify recipient's sign - still waiting. Please check.",myntra
2019-11-23 04:50:31+00:00,"This was never our intention, Devesh. Sincere apologies! Myntra Credits are never on our list to investigate. Since high return rates or refusing to accept orders impact the availability of the products for our other (cont) http://srkl.in/l/6017BIh5dH https://twitter.com/messages/compose?recipient_id=89443197",myntra
2019-11-23 04:50:09+00:00,"Lneskart, Bhuman aur Myntra ka bhi",myntra
2019-11-23 04:49:02+00:00,"Animesh, thank you for sharing the Bar-code number. Please DM us the below details so that we can have a check on the concern and assist you accordingly: 1. Regd. Email ID and order number. 2. Product is unused/unwashed. -PB",myntra
2019-11-23 04:48:28+00:00,Hi Girish! We don't want our customers feeling this way. Please treat this as a confirmation that we have already initiated the refund amount from our end to your Paytm wallet. Request you to wait for 48 hours for it to reflect in your source account. -AG,myntra
2019-11-23 04:48:13+00:00,I rec below sms on 2st #myntra @MyntrasupportI3 Out for exchange: Your exchange order for Puma Women Pink Printed Sli... is expected to be delivered by our Style Delivery Agent (Ph No. : +9173148xxxxx) by end of the day. Please hand over the original item at the time of delivery,myntra
2019-11-23 04:46:25+00:00,No update yet!! No call no msg no email nothing !! Myntra Sucks big time,myntra
2019-11-23 04:43:54+00:00,100518694482,myntra
2019-11-23 04:34:51+00:00,Ordered 2 packs of briefs from @myntra Got wrong items in both. On calling I was offered a refund &amp; no exchange. Surely it's intentional as stocks are not available. Items are still being shown as available on website. Some1 orders again &amp; same cycle repeats. Height of negligence,myntra
2019-11-23 04:33:46+00:00,"Animesh! Please be informed, that you have shared the tracking number, not the bar code. We request you to DM us the below requested details so that we can take this forward and get it fixed. 1. Bar-code Number - It is a 12 digit number (cont) http://srkl.in/l/6014BIh5Z8",myntra
2019-11-23 04:26:41+00:00,@myntra at the time of feedback 2 years ago replied n now after 2 years when they fooled the customer n realised they can fool only for sometime ,myntra
2019-11-23 04:26:14+00:00,MYNC0019805119,myntra
2019-11-23 04:23:55+00:00,Nupur! This is not the experience we want you to have with us. Please be assured that we've escalated this issue. Our case manager will get in touch with you by today between 11: 00 AM - 8:00 PM & address your concern (cont) http://srkl.in/l/6011BIh5nZ,myntra
2019-11-23 04:21:09+00:00,Sure! We are on it and will surely get back to you with an update within the given time frame. We appreciate your understanding. -AG,myntra
2019-11-23 04:18:09+00:00,"That is not good to hear, Animesh! We never intended to cause the experience & this certainly is an unusual instance. We request you to share the below details with us via DM so that we can take it forward : 1. Bar-code Number - It is (cont) http://srkl.in/l/6016BIh5VM",myntra
2019-11-23 04:17:58+00:00,@myntra @MyntraSupport please update me on the status when it has been finalised to be delivered,myntra
2019-11-23 04:15:17+00:00,"Thank you for your positive comments, Samita! Your satisfaction builds our reputation. We take pride in providing the best in class service to our customers. Keep shopping with us for more such experiences! -AG",myntra
2019-11-23 04:14:20+00:00,I ordered this HRX Shoe on #myntra and i got it deliverd in 12th of this month when i opened the box i saw the box was of hrx but the shoe was of some local brand as u can look in the pic below after that on the same date i created return request the delivery boy ,myntra
2019-11-23 04:13:28+00:00,This tweet was not sarcastic. I am happy with your service. No need of any escalation. ,myntra
2019-11-23 04:10:58+00:00,@ANarayanan24 since you started Paylater with flipkart @myntra is cheating on us. Product returned but amount not adjusted in flipkart since long i am struggling complain close without call.I already cancel my 5000 rs order. now please help so tha I can delete this application ,myntra
2019-11-23 03:58:47+00:00,@JeffBezos @amazonIN @AmazonHelp @amazon @AmazonUK @amazonca @AmazonBusiness @AmazonSG @AmazonMediaClub @nytimes @FT @ficci_india @PMOIndia @IndianExpress @ETMarkets @moneycontrolcom @CNBCTV18Live @bsindia @RBI @ConsumerReports @Flipkart @myntra,myntra
2019-11-23 03:46:30+00:00,Bro it was updated,myntra
2019-11-23 03:41:11+00:00,Hi Maban! We truly regret the hassle that you had to go through regarding the Exchange. It is very unfortunate that your order was canceled. We tried our best to get the products delivered to you but as it was lost (cont) http://srkl.in/l/6012BIh5Po https://twitter.com/messages/compose?recipient_id=89443197,myntra
2019-11-23 03:35:51+00:00,Hii,myntra
2019-11-23 03:25:08+00:00,"Without any reason late fee has been charged against me, despite issue was from Myntra end. Now, I am getting repetitive messages &amp; call to pay the bill along with late fee. Raise this concern since month of August. #FlipkartPayLaterTeam @_Kalyan_K @Flipkart @flipkartsupport",myntra
2019-11-23 03:22:08+00:00,@MyntraSupport @myntra now that the order is cancelled how do I get the refund?,myntra
2019-11-23 03:19:40+00:00,Beauty dance,myntra
2019-11-23 03:16:49+00:00,"Hi Samita! That's not the experience we want to deliver to our customers. We truly regret the hassle that you had to go through. We have escalated this issue, and we are working on it with utmost priority. One of our case managers will (cont) http://srkl.in/l/6012BIh5MY",myntra
2019-11-23 03:16:28+00:00,"@mlkhattar @cmohry @gurgaonpolice @PMOIndia @TOIGurgaon @IndianExpress @ndtvindia @Dchautala 23-year-old man, who owned @myntra 's franchise, was found murdered at his office in U block, DLF phase 3, Gurgaon. Immediate action required. @htTweets @HTGurgaon",myntra
2019-11-23 03:09:30+00:00,"Thanks for reaching out to us, Aanand! We truly regret the hassle that you had to go through regarding the return. Please be assured that we've escalated this issue. Our case manager will get in touch with you by (cont) http://srkl.in/l/6013BIh5zx https://twitter.com/messages/compose?recipient_id=89443197",myntra
2019-11-23 02:53:34+00:00,@MyntraSupport @myntra return picked up yesterday for Return No. : 4071514464 by your pick up guy. Mobile number of pick up guy is 8867868688. Order status still says return will be picked up today.,myntra
2019-11-23 02:50:15+00:00,"Also, we request you to refrain from sharing any order related or personal account details on the public post for security purposes. As you've already shared, kindly hide the post in which the order details are available.-AG",myntra
2019-11-23 02:50:11+00:00,Good.,myntra
2019-11-23 02:50:00+00:00,"That's not good to hear, Hadrish! Such an instance is unfortunate and more importantly, unusual. Your understanding is what we rely upon under such unusual circumstances. Certainly, we intended the whole experience differently. We have (cont) http://srkl.in/l/6019BIh5yL",myntra
2019-11-23 02:48:46+00:00,Thank you @myntra for the hassle-free return of wrong products. Received the refund too on time. I would have been happier if the exchange was hassle-free. Don't have any hashtags this time ,myntra
2019-11-23 02:36:44+00:00,Wrong product delivered against order no is 1125686-9964900-1480001 and 1125742-4029310-2386301. Kindly contact me 7002946874,myntra
2019-11-23 02:29:35+00:00,Grey is the new black! Get the latest trend in bottom wear only at De Moza! Available @centralandme @Lifestyle_Store @shoppersstop @myprojecteve @myntra #womenfashion #fashion #style #fashionblogger #ootd… https://www.instagram.com/p/B5MPNc3j8Fn/?igshid=1qrryq1qt5p1d,myntra
2019-11-23 02:15:26+00:00,Awesome,myntra
2019-11-23 02:02:55+00:00,Movies mein nahi dikh rahe ho aunty,myntra
2019-11-23 02:00:33+00:00,Hello,myntra
2019-11-23 01:58:34+00:00,We've replied to you via DM. -AG,myntra
2019-11-23 01:58:24+00:00,We've replied to you via DM. -AG,myntra
2019-11-23 01:54:31+00:00,Nice video . Keep rocking,myntra
2019-11-23 01:54:25+00:00,Leisure la why romance pose... R u trying something,myntra
2019-11-23 01:38:13+00:00,"Just because Hindu Saints R obstacles for MNCs & missionaries who are involved in immoral activities, they frame innocent saints in fake cases. #FakeCaseExposedAgainstHinduSaints",myntra
2019-11-23 01:28:08+00:00,"@myntra I have ordered two Clovia women cotton nighty and on dated 20 Dec""19 the order is delivered to me. But both the order wrong product delivered to me.order no is 1125686-9964900-1480001 and 1125742-4029310-2386301. Email: hadrishborah@gmail.com PH-7002946874",myntra
2019-11-23 01:23:22+00:00,"@myntra I have ordered two Clovia women cotton nighty and on dated 20 Dec""19 the order is delivered to me. But both the order wrong product delivered to me. Instead of Cotton nighty one is Clovia Baby doll set and another one is Clovia Night lounge set. Kindly contact-7002946874",myntra
2019-11-23 01:19:09+00:00,NiceVidioQueen Axilaint ,myntra
2019-11-23 01:08:44+00:00,So nice,myntra
2019-11-23 01:01:45+00:00,Good,myntra
2019-11-23 00:34:23+00:00,Nice,myntra
2019-11-23 00:31:57+00:00,Hii,myntra
