date,tweet,word
2019-11-05 05:17:17+00:00,"Hi Harshit! We understand you did not have a pleasant experience so far, for which we regret. Over to us now, wait up while we straighten this out and share an update within the given time frame. Please bear with us meanwhile. We appreciate your understanding. -TS",myntra
2019-11-05 05:12:01+00:00,"We all created by nature we only made rules here , but nature dont differ us by gender so we too not #MyntraFashionSuperstar #ContestAlert",myntra
2019-11-05 05:10:41+00:00,We have responded to you via this link: http://srkl.in/6011BICBIl kindly have a check. -HN,myntra
2019-11-05 05:10:24+00:00,No,myntra
2019-11-05 05:09:59+00:00,,myntra
2019-11-05 05:09:55+00:00,"Kayan, we're saddened to hear that! Not to worry, we'll get this issue sorted for you with all our might. Kindly give us a chance to look into it. Please DM us your regd. E-mail ID & order number so that we can assist you accordingly. -HN",myntra
2019-11-05 05:08:40+00:00,Myntra One of the wrost company,myntra
2019-11-05 05:08:19+00:00,Myntra is totally fraud company,myntra
2019-11-05 05:07:50+00:00,"why tf is this in my timeline,trash content.",myntra
2019-11-05 05:05:02+00:00,ye to thik hai par raamji ki wife ka naam kyaa tha??? a) dropadi b) sita c) mandodari d) urmila,myntra
2019-11-05 05:04:00+00:00,Deepen Sharma Sumedha Sharma Jatin Jay #MyntraFashionSuperstar @MyntraFS @sonakshisinha @myntra,myntra
2019-11-05 05:03:43+00:00,Everyone is unique and they have their story to tell. Everyone has different role to play.. each one have ups and down. #MyntraFashionSuperstar @MyntraFS @myntra,myntra
2019-11-05 05:03:40+00:00,"Barot! We can understand your anxiety and we are extremely sorry for any inconvenience caused. Your privacy is of utmost importance to us & Myntra, cares deeply about the safety and security of our valuable customer's (cont) http://srkl.in/l/6010BICBvM https://twitter.com/messages/compose?recipient_id=89443197",myntra
2019-11-05 05:03:37+00:00,"#MyntraFashionSuperstar @myntra from where sonakshi looks like host of fashion superstar, did she win any fashion contest? No! She needs to study Ramayan let her do it.",myntra
2019-11-05 05:03:32+00:00,After passing out from college I failed on so many occasions but I knew my Hardwork will take me to next level and I got my goal in the end. #MyntraFashionSuperstar @MyntraFS @myntra,myntra
2019-11-05 05:03:18+00:00,Looks like no one did anything. I got the cancellation msg now .,myntra
2019-11-05 05:02:24+00:00,All the best Sumedha Beta. ,myntra
2019-11-05 05:01:14+00:00,"फ्री टाइम में हमारे पुराणो-ग्रंथो और रामायण,महाभारत का पाठ करिये बुद्धि को बल मिलेगा अगर देश की जनता ""बायकाट""करने लग गई ना तो,तुम जैसे मंद""बुध्धि""वाली को कोई भीक भी नहीं देगा.. ",myntra
2019-11-05 05:00:30+00:00,Hi there! We would like to inform you that a refund of Rs 460.95/- has already been credited to your Myntra account on 04-11-2019 in form of Myntra credits. We request you to kindly have a check. The expiry date for the same would be (cont) http://srkl.in/l/6017BICBQB,myntra
2019-11-05 05:00:27+00:00,White Outfit is amazing #MyntraFashionSuperstar @sonakshisinha @myntra,myntra
2019-11-05 04:57:09+00:00,,myntra
2019-11-05 04:54:35+00:00,You might be a good human but you are nonsense Actor.,myntra
2019-11-05 04:54:30+00:00,Who is Lord Hanuman's respected Mother,myntra
2019-11-05 04:54:18+00:00,"@sonakshisinha Huge fan, wishing you all the success. Loved you in all your films. You matched steps with biggies like Shahid and Prabhu Deva in dance, that is just wow :) Trollers gonna troll, haters gonna hate; but Sonakshi's gonna win win win.",myntra
2019-11-05 04:53:55+00:00,Jake pehle ramayan padhle,myntra
2019-11-05 04:50:56+00:00,"Still hopeful that, my refund will be made by you. Although yesterday you had sent a pick up person to collect the item which was picked 2 months back. And today again a person is being sent by you. @JagoGrahakJago_",myntra
2019-11-05 04:50:26+00:00,Good morning God bless you.,myntra
2019-11-05 04:49:20+00:00,Fashion and you ,myntra
2019-11-05 04:48:34+00:00, ,myntra
2019-11-05 04:47:41+00:00,Fav ,myntra
2019-11-05 04:45:53+00:00,9265153503 is no pe call aya tha 4th nov. 2019 . afternoon 1 pm call receive kiya virajbarot118@gmail.com current location : patan (384265) gujrat fraudster name may be dinesh perfect i dont know but hindi me bat karta tha 2 number ke photo mene bheji he wahi,myntra
2019-11-05 04:45:15+00:00,Hi Varun! Over to us now. We have taken a complaint in this regard. One of our case managers will contact you within 24 hrs anytime between 11 AM to 8 PM & address your concern on priority. Request your patience. (cont) http://srkl.in/l/6016BICBo8,myntra
2019-11-05 04:45:08+00:00,Good morning,myntra
2019-11-05 04:43:43+00:00,How many time should i unsubscribe your spamming!? @myntra ,myntra
2019-11-05 04:43:24+00:00,Ramayan Mahabharata ke baare me Kuch pafho,myntra
2019-11-05 04:42:49+00:00,For clothes I always prefer Myntra.. and it always gives me a satisfactory results...,myntra
2019-11-05 04:42:17+00:00,I am thinking about future of your kids.... kbc ........ ,myntra
2019-11-05 04:41:31+00:00,The way she carry herself. She is the style icon. #MyntraFashionSuperstar #ContestAlert @myntra @sonakshisinha @MyntraFS,myntra
2019-11-05 04:41:17+00:00,"Nothing, कौन है ये ?",myntra
2019-11-05 04:40:36+00:00,Sonakshisinha tere ko dekhkar Ghar me kam Karne wale ladies logo ka moral boost ho gaia hai wo bolti hai hum dikne me to Sonakshi se acche dikhte hai aur mind tere se 10 times excess hai Please advice,myntra
2019-11-05 04:40:35+00:00,"Thanku @sonakshisinha , @myntra And @myntraFS for this Amazing contest. It is very knowledgeable . #myntrafashionsuperstar",myntra
2019-11-05 04:40:01+00:00,We should respect all irrespective of what he/she is. #MyntraFashionSuperstar @MyntraFS @myntra,myntra
2019-11-05 04:40:00+00:00,@myntra @MyntraSupport Return no 4068123136 placed on 30 oct not yet picked by shadowfax. They called me on 30th and said will pick that day but didn’t pick yet. This is my office address and tonight I’m going out for a week. Tell me how my return will be processed then.,myntra
2019-11-05 04:39:39+00:00,Myntra logs Rs 539.2 cr loss in FY'19 https://retail.economictimes.indiatimes.com/news/apparel-fashion/apparel/myntra-logs-rs-539-2-cr-loss-in-fy19/71915645 #Myntra #Revenue #Loss #Ecommerce #Flipkart #Fashion #Retail #e-tailer #Business #Orders #Customers #Discount #Sale #Operations,myntra
2019-11-05 04:38:01+00:00,All is good,myntra
2019-11-05 04:37:54+00:00,After passing out from college I failed on so many occasions but I knew my Hardwork will take me to next level and I got my goal in the end. #MyntraFashionSuperstar @MyntraFS @myntra,myntra
2019-11-05 04:37:42+00:00,Everyone is unique and they have their story to tell. Everyone has different role to play.. each one have ups and down. #MyntraFashionSuperstar @MyntraFS @myntra,myntra
2019-11-05 04:37:22+00:00,"Barot, we understand your anxiety and apologize for any inconvenience faced. Please DM us the below details so that we can take the required action: 1: Mobile Number on which you got the Call/SMS/Whatsapp. If you were contacted via E-mail, (cont) http://srkl.in/l/6013BICBlc",myntra
2019-11-05 04:35:46+00:00,Ye Sonakshi se Fashion tips lene waale Myntra ko uninstall karna padega!!,myntra
2019-11-05 04:34:50+00:00,इसका बाप शत्रुघन सिन्हा पाकिस्तान समर्थक है। हटाओ इस पाकिस्तानी बाप-बेटी को ,myntra
2019-11-05 04:33:28+00:00,,myntra
2019-11-05 04:33:02+00:00,I would love to make a career in the fashion industry if i got a chance. It's makes dreams into reality and merges your attitude into style. #ContestAlert #MyntraFashionSuperstar,myntra
2019-11-05 04:32:03+00:00,It’s kind request to Twitter that don’t allow this type of Stupid person on your platform because she doesn’t have mind and sense is 0 .,myntra
2019-11-05 04:32:02+00:00,please ap action lo is topic par. ap apni team me forward karke action lo ... aur if apko trust nahi he to ap online vale no. pr call krke check kr sakte ho... apki company ka name pe log ye sab lar rahe he.. even logo ka address aur detail bhi unke pass he..,myntra
2019-11-05 04:31:59+00:00,First of all you answer that for whom.... Hanuman ji...were ask to brought sanjivani,myntra
2019-11-05 04:31:54+00:00,Myntra Fashion Superstar Show First Season is very entertaining and knowledgeable. It supports Equality . It gives me knowledge about Fashion industry. I remember that every contestants have unique personality and Style .I love this show. #MyntraFashionSuperstar,myntra
2019-11-05 04:31:47+00:00,हनुमान जी ने किसके लिये संजीवनी बूटी लाया था ? पहले ये बताओ,myntra
2019-11-05 04:31:08+00:00,Struggle struggle and struggle,myntra
2019-11-05 04:30:33+00:00,Myntra I have stopped following u from the time u r promoting ths jumbo dumbo.,myntra
2019-11-05 04:30:04+00:00,ETRetail | Myntra logs Rs 539.2 cr loss in FY'19 ,myntra
2019-11-05 04:25:41+00:00,"Hi Mickey! Thank you for giving us this pat on the back, you made our day. We at Myntra believe in providing great deals and discounts. But, the discounted price is subject to brand agreement. We will surely take this as feedback and will (cont) http://srkl.in/l/6013BICB9S",myntra
2019-11-05 04:23:50+00:00,Ashish! This is certainly not the experience we want you to have with us. Please share with us the below details 1. When was the defect observed? Before using the product or after using it. 2. Price tags/stickers available - (Yes/No). 3. (cont) http://srkl.in/l/6011BICB9z,myntra
2019-11-05 04:23:11+00:00,Who gives a damn,myntra
2019-11-05 04:22:07+00:00,Stop polluting people TL,myntra
2019-11-05 04:19:48+00:00,Hi Barot! We can understand your anxiety and we are extremely sorry for the inconvenience caused. We would request you to please file a complaint with the nearest Cyber Crime office. We would like to inform you that Myntra is not promoting (cont) http://srkl.in/l/6016BICB5I,myntra
2019-11-05 04:17:57+00:00,In red dress she looked beautiful #MyntraFashionSuperstar @myntra,myntra
2019-11-05 04:17:41+00:00,See what u deliver,myntra
2019-11-05 04:17:32+00:00,Even it too needs some IQ,myntra
2019-11-05 04:16:39+00:00,मंदबुद्धि इंसान की फसल,myntra
2019-11-05 04:16:25+00:00,Dumped damaged product and ran away,myntra
2019-11-05 04:15:23+00:00,A huge fan of @myntra after seen the collection the guys are so visionary and well known the style statement according to the time &amp; i continuously ordering the item but small amount of discount are a big mess,myntra
2019-11-05 04:14:46+00:00,52 years in the business of fashion. Delhi's oldest boutique. Raj Creations is Vintage!,myntra
2019-11-05 04:12:26+00:00,#ico #development #trending #tech #bitcoin #ieo #exchange Superlative and dynamic ICO development Services from specialist,myntra
2019-11-05 04:12:07+00:00,Aap Ke Pita @ShatruganSinha Ji KaKya Haal Chal Hai.,myntra
2019-11-05 04:10:52+00:00,report karo is number par... apki mehnat mitti mw mili ja rahi he.. trust tutata ja rahe he logo ka ap par se @myntra @Flipkart,myntra
2019-11-05 04:10:06+00:00, She is talking abt acting,myntra
2019-11-05 04:09:42+00:00,,myntra
2019-11-05 04:09:35+00:00,Ye Btao laxman k liye sanjivni kon lene gye the ,myntra
2019-11-05 04:09:06+00:00,,myntra
2019-11-05 04:07:10+00:00,Hi it's been 2 days @myntra @MyntraSupport informed this situation on Sunday till date no update on my product?,myntra
2019-11-05 04:06:47+00:00,Please invite your brother Pappu and your sister Alia as guests in the show. ,myntra
2019-11-05 04:05:50+00:00,see ye number pe gift card ke name pe pese le rahe he log,myntra
2019-11-05 04:05:27+00:00,"For me , working in fashion allows to meet so many people, all with different backgrounds, experiences and stories. One can learn a lot from the people around you in the fashion industry. Not to forget the glamour, the excitement, the clothing. #MyntraFashionSuperstar",myntra
2019-11-05 04:05:22+00:00,,myntra
2019-11-05 04:05:09+00:00,"What do you think about these two brands about for a party or a casual wear ? Give your opinion below:- #Bestdressdesigns #Diliards #Myntra Dillard,s Mytnra ",myntra
2019-11-05 04:05:06+00:00,Ab.. answer toh bataa ni sakte aap dang se.. toh question puchne lag gaye! Wah!,myntra
2019-11-05 04:03:24+00:00,Hi Barot! This is not the experience that we want you to have with us. Kindly give us a chance to look into it. Please DM us your regd. e-mail ID & order number(if any) elaborating the issue so that we can assist you accordingly. -PB,myntra
2019-11-05 04:01:36+00:00,Everyone knows that's this big company making fool that's y,myntra
2019-11-05 04:00:56+00:00,रामायण देख ली आपने ??,myntra
2019-11-05 03:59:39+00:00,"Dear, Afreen I want you to call me. 9998782510. The worst service by @Flipkart is not approving return imstead product is damaged. @flipkartsupport #flipkart #amazon #ecommerce #snapdeal #myntra #alibaba #infibeam #walmart #ebay #Google #Microsoft Check DM.",myntra
2019-11-05 03:58:37+00:00,@myntra @MyntraSupport this is how Myntra delivers product. Delivery person Pavan +918073883749. Great Service!!! ,myntra
2019-11-05 03:58:27+00:00,It's a monopoly. Myntra is one the best startups in India.,myntra
2019-11-05 03:56:46+00:00,"Hi @_Amar_N I don't know you but the only connection between us is @myntra . I am struggling with your company as first, delivered empty box second, no refund for the same. Your delivery boy is prime witness of empty box. I am just hoping that better sense will prevail.",myntra
2019-11-05 03:55:24+00:00,@myntra @Flipkart Duniya tamara par trust krin online shopping kre ch ane loko tamara name pr fake gift card na name par trust tode ch...,myntra
2019-11-05 03:53:57+00:00,Myntra logs Rs 539.2 cr loss in FY’19 https://www.indiaretailing.com/2019/11/05/retail/myntra-logs-rs-539-2-cr-loss-in-fy19/,myntra
2019-11-05 03:53:34+00:00,"Thank you for your appreciation, Nilesh! We will strive to deliver great experiences consistently. -AS",myntra
2019-11-05 03:51:05+00:00,@myntra @MyntraSupport @MFWknd @myntracoupons1 my return is pending since 1 month. Escalated it multiple times. Customer care giving only scripted answers to give them 24 hours with no resolution. Return my money back and take your package whenever you want,myntra
2019-11-05 03:49:39+00:00,Dude they not gonna reply as they busy spending my stolen money.. run @myntra,myntra
2019-11-05 03:47:47+00:00,Ist season of #MyntraFashionSuperstar is just amazing and has emerged as a unique platform to showcase the big fashion lovers a chance to be on the Biggest platform of fashion industry. #ContestAlert @sonakshisinha @MyntraFS @myntra @Sanjiv_34 @karan875 @chilled_Sup,myntra
2019-11-05 03:47:31+00:00,Myntra logs Rs 539.2 cr loss in FY'19 #ETRetail,myntra
2019-11-05 03:45:18+00:00,"हां वोह सब तो ठीक है लेकिन ये बताओ कि रामायण में ""शत्रुघ्न"" भगवान श्रीराम के कौन थे ??? उनकी पत्नी का नाम क्या था ???",myntra
2019-11-05 03:44:50+00:00,I dono how cheap the snapdeal gives very cheap price to sell the brand of fossil. Snapdeal uses the brand fossil and sell it fake one. #fossil #cassio #snapdeal #amazon #FlipKart #Paytm #jabong #Myntra kindly give me a proper answer from snapdeal.,myntra
2019-11-05 03:44:38+00:00,You got the right to promote and we got the right to Block you. Blocked.,myntra
2019-11-05 03:43:43+00:00,Ye ghatiya post meri wall pr kyu aya subah subah mood kharab krdiya ,myntra
2019-11-05 03:43:39+00:00,"Not surprised that Myntra lost Rs 539 Cr in 2018-19, but surprised that its operational income is mere Rs 1041 crs despite all the hype around it. ",myntra
2019-11-05 03:40:25+00:00,Take 2000 from me and buy few GK books,myntra
2019-11-05 03:40:17+00:00,Myntra.,myntra
2019-11-05 03:40:09+00:00,Fashion to humsey shuru hota hai but I want to meet you Sonakshi ,myntra
2019-11-05 03:38:32+00:00,Pahle aap Raja Dushrath ke putron kaa naam bataoo....,myntra
2019-11-05 03:32:57+00:00,सुग्रीव के भाई का क्या नाम था!,myntra
2019-11-05 03:32:35+00:00,Hello ma'am,myntra
2019-11-05 03:26:19+00:00,You should be given Nobel Prize for peace for all that you have undergone because of weight issues.,myntra
2019-11-05 03:26:13+00:00,हनुमान जी किसके लिए संजीवनी बूटी लाये थे?,myntra
2019-11-05 03:18:31+00:00,I think its great. Anyone with hardwork can have a successful career . #MyntraFashionSuperstar #myntra,myntra
2019-11-05 03:14:34+00:00,yes i loveee fashion and pretty good at it.. people in my family and friends always take advice from me when it comes to fashion...and i always suggest everyone that @myntra is the best online store available in india,myntra
2019-11-05 03:12:02+00:00,KHAAMOSH ,myntra
2019-11-05 03:11:29+00:00,yes i loveee fashion and pretty good at it.. people in my family and friends always take advice from me when it comes to fashion...and i always suggest everyone that @myntra is the best online store available in india,myntra
2019-11-05 03:11:05+00:00,yes i loveee fashion and pretty good at it.. people in my family and friends always take advice from me when it comes to fashion...and i always suggest everyone that @myntra is the best online store available in india,myntra
2019-11-05 03:09:45+00:00,yes i loveee fashion and pretty good at it.. people in my family and friends always take advice from me when it comes to fashion...and i always suggest everyone that @myntra is the best online store available in india,myntra
2019-11-05 03:07:17+00:00,"Thank you for your cooperation, Meghna. We could find out the order ID with your regd email ID as you may have contacted us previously. Not to worry, please allow us the given time frame for an update to be shared. Request your patience. -VR",myntra
2019-11-05 03:07:03+00:00,Passion and desire for your drive forward to acheive high in your carrer.,myntra
2019-11-05 03:06:35+00:00,#Myntra reports more than three-fold #increase in #losses https://www.livemint.com/companies/company-results/myntra-reports-more-than-three-fold-increase-in-losses-11572881336114.html,myntra
2019-11-05 03:05:03+00:00,SENA KANA UP FT WIZ KHALIFA AKON CAN'T SAY NO MEGHAN TRAINOR I WILL BE THERE FOR YOU WAVE MO BEAUTIFUL WRECK PLEASE SHARE THE VIDEOS TO EVERYONE AND SUSCRIBE BOYS GIRLS,myntra
2019-11-05 03:03:38+00:00,Myntra Fashion Superstar | Episode 3 - #BeWoke | Sonakshi Sinha | Kusha ... https://youtu.be/drpA3OQ_CLw vía @YouTube,myntra
2019-11-05 03:02:29+00:00,jai shri raam ,myntra
2019-11-05 02:58:41+00:00,Sure thanks. But just one question you never asked the order id. How will you go about dealing the situation?,myntra
2019-11-05 02:55:54+00:00,"If I get a chance, definitely yes coz I think dressing sense plays an important role in first and last impression #MyntraFashionSuperstar",myntra
2019-11-05 02:54:22+00:00,yes.. this would be a dream come true as i have a passion for fashion since childhood.. #ContestAlert #MyntraFashionSuperstar,myntra
2019-11-05 02:53:51+00:00,मंदबुद्धि बालिका,myntra
2019-11-05 02:52:12+00:00,#MyntraFashionSuperstar,myntra
2019-11-05 02:48:05+00:00,मेडम जितनी जानकारी साधन के लिए रखती हो उतनी साध्य के बारे में भी रखो.. भला उसी से होगा #KBC,myntra
2019-11-05 02:46:14+00:00,yes.. this would be a dream come true as i have a passion for fashion since childhood.. #ContestAlert #MyntraFashionSuperstar,myntra
2019-11-05 02:45:43+00:00,sanjivni booty kon laya,myntra
2019-11-05 02:44:33+00:00,Ye Sita Kiska Baap tha ?,myntra
2019-11-05 02:41:01+00:00,Yeah. She is such a beautiful model.,myntra
2019-11-05 02:38:59+00:00, ,myntra
2019-11-05 02:33:26+00:00,Being curvy and being plus size are two different things.,myntra
2019-11-05 02:27:15+00:00,Pagal aurat bhgwan से to dr... Ye kya likh rhi ho ,myntra
2019-11-05 02:18:59+00:00,Thankyou team for this amazing contest Finger crossed tightly Big wish to win #MyntraFashionSuperstar @MyntraFS,myntra
2019-11-05 02:16:09+00:00,Thankyou so much @sonakshisinha mam for this amazing contest #MyntraFashionSuperstar @MyntraFS,myntra
2019-11-05 02:14:37+00:00,Good morning ,myntra
2019-11-05 02:14:04+00:00,"HEY @Uber_India, @amazonIN, @SheinIndia, @myntra, @dominos_india, @NetflixIndia, @hotstartweets, @oyorooms and @becurefit Y U NO @getsimpl #KeepItSimpl",myntra
2019-11-05 02:14:00+00:00,"#MyntraFashionSuperstar I studied Marine Engineering but becoz of no placement I joined in a fashion studio as admin , later I got interested in designing and with support of my madam I am learning now designing and grooming myself to be model too .",myntra
2019-11-05 02:09:01+00:00,,myntra
2019-11-05 02:08:43+00:00,सम जिस्म जन्म मिलन महानायक वाक्य अवतार राम तक हक सम अक्षरो मोक्ष असर वाक्य वक्ता तैयार राम है महादेव दाता एवम राम तरह हमारे राम मेरा राम हर नाम गुण गुणी राम का कहानी | all means all names even letter sentence sent scene one lover get great at the he RAM ADAM SHIV is heaven need,myntra
2019-11-05 02:08:38+00:00,"HI Saif! This was never our intention. As our vendor failed to supply the (Ruosh Casual Men Grey Leather Driving Shoes) on time, and we didn't want you to wait too long, we had to cancel the order. As a token of apology, we have credited (cont) http://srkl.in/l/6014BICBzy",myntra
2019-11-05 02:02:08+00:00,"u look awesome Sonakshi, they are sick and perverted minds, ask them to post their pics and lets decide who is obesse and who is not",myntra
2019-11-05 02:01:04+00:00,You are welcome. -HN,myntra
2019-11-05 01:57:38+00:00,Thank you!!,myntra
2019-11-05 01:56:31+00:00,3/5 #Review on @myntra by varmakrishna570 : Myntra-customer-care-number7584814874 - http://bit.ly/2qo8F68,myntra
2019-11-05 01:53:39+00:00,Are u high bro ??? She is a superstar???? ,myntra
2019-11-05 01:53:29+00:00, ,myntra
2019-11-05 01:53:14+00:00,"I would, but my parents won't allow it..",myntra
2019-11-05 01:48:06+00:00,It's a very very disappointing factor to me as my earlier order cancelled by Myntra and no any call received to me after my repeated rquest. Myntra is a cheater and playing with their customers.,myntra
2019-11-05 01:47:06+00:00,Waited 1 week and got nothing in return. Total time waste. And you people say that ICON members are given priorities. Well it’s high time you people pull up your socks #wasteoftime @myntra @MyntraSupport,myntra
2019-11-05 01:47:06+00:00,"Wonderful service from #myntra. Out of the 2 products I ordered, One was a women wear which I had raise a compliant and return and now the other product got cancelled stating it to be of bad quality. Why do you put up such products then ? @myntra @MyntraSupport",myntra
2019-11-05 01:43:54+00:00,,myntra
2019-11-05 01:41:47+00:00,"Certainly,yes!",myntra
2019-11-05 01:38:52+00:00,"You're welcome, Sarika! Thank you for giving us this pat on the back, you made our day. It's only when we receive such positive feedback, we know that we have done our jobs well. We will strive to deliver great experiences consistently, do shop again. -TS",myntra
2019-11-05 01:37:18+00:00,"@XpressBees_IN WE ARE THE FIRST COURIER WHO CAN START DELIVERY IN THESE LOCATIONS ,CUSTOMER NOT ABLE TO SHOP FROM POPULAR SITE .Like FLIPKART,MYNTRA ,SNAPDEAL,UDDAN, AJIO, LIMEROAD ,JABONG , RSC NAME SUNDERBANI PIN CODES 185153 REGARDS RAKESH SHARMA 9988864626",myntra
2019-11-05 01:36:45+00:00,"No, since i didn't hv a surname which can give me a direct entry",myntra
2019-11-05 01:34:10+00:00,"Did you read about Ramayan or not ,if not hire me,I will give free coaching to you ",myntra
2019-11-05 01:34:07+00:00,Too fragile and fickle industry.,myntra
2019-11-05 01:32:57+00:00,"hey @Uber_India, @amazonIN, @myntra, @dominos_india, @NetflixIndia, @hotstartweets, @oyorooms and @jiosaavn haaaaaaaave you met @getsimpl? #KeepItSimpl",myntra
2019-11-05 01:30:05+00:00,Thanks for quick help and restoring my believe in online shopping. Now I can convert my Myntra wishlist to cart items.. thanks again ,myntra
2019-11-05 01:27:28+00:00,Btana...... Vo Sanjivani Buti kon laya that??? ,myntra
2019-11-05 01:26:53+00:00,Myntra ke kapde aapki tarah he bhains ki quality ke hai.... Aathuuu sonakshi bhains,myntra
2019-11-05 01:23:47+00:00,आजकल तो नग्नता ही फ़ैशन का परिचायक है।,myntra
2019-11-05 01:15:40+00:00,My daughter with her child model (from our Playway School) at a workshop held yesterday at INIFD Ludhiana.. ,myntra
2019-11-05 01:14:55+00:00,My view on gender fluidity after watching Deepen is that wear whatever makes you happy and confurtable. There is very less happiness in our surrounding so let others do whatever makes them happy. #MyntraFashionSuperstar,myntra
2019-11-05 01:14:40+00:00,"No, but i would love to do Photography in the same",myntra
2019-11-05 01:12:57+00:00,First brush up your knowledge about ramayana ,myntra
