date,tweet,word
2019-11-23 23:55:56+00:00,"No, you fix the issue on your end. How hard is it to just revert insider points, why am I automatically subscribed to it. And why can I not opt out of it. It's not like I can redeem it for discount on other products. Tweeting people is not my pleasure.",myntra
2019-11-23 23:54:15+00:00,"Renis, we have got your point & would want to inform you that our intention is never to hurt you in any way. Please note, the constantly changing marketplace and our efforts to offer you the lowest price may result (cont) http://srkl.in/l/6012BIhc1E",myntra
2019-11-23 23:46:13+00:00,For more +91- 8128791896 Congratulations Myntra,myntra
2019-11-23 21:57:54+00:00,"Thanks for reaching out to us, Rohit! It is upsetting to know of the situation. Request you to confirm the name of the product which you have received via DM so that we can take the required action to resolve the issue at the earliest. (cont) http://srkl.in/l/6014BIhcDp",myntra
2019-11-23 20:42:09+00:00,@myntra order#1126063-8197495-3118201 received just 1 shirt out of 2 in an opened packet left with the security guard without being contacted. Please help resolve this.,myntra
2019-11-23 19:05:10+00:00,"Good,",myntra
2019-11-23 19:05:04+00:00,"Love you mam,",myntra
2019-11-23 18:58:40+00:00,"We hear you, Akanksha. If we understand you correctly, you wish to return/ exchange the product. Please do not worry, we have arranged a call back for you in this regard. You will be contacted today between 11 AM and 8 PM. We appreciate (cont) http://srkl.in/l/6010BIhiN4",myntra
2019-11-23 18:58:36+00:00,Inspired by Fear of being Average. ___________________ Complete your wedding look hm_man High Nech Black Tshirt combined with Invictus Trousers and Shoes from @myntra #fashion #style #ootd #fashionblogger… https://www.instagram.com/p/B5OAZccloo7/?igshid=1qfplf2ro3vz0,myntra
2019-11-23 18:52:17+00:00,"@myntra @MyntraSupport @myntra_engg @Myntra_CC @MyntraFS @MFIbyMyntra @MFWknd Hi ,I have a concern regarding my ordr. Order no-1125278-9553273-8881003 Order hs bn delivered on 15th Nov.I couldnt try that time as I ws out of Delhi on official tour.I got back today, tried the suit,",myntra
2019-11-23 18:51:56+00:00,When will you return my money???,myntra
2019-11-23 18:51:48+00:00,"Prayash, we hear you! Please be assured that we've highlighted your concern regarding the compensation & one of our case managers will connect with you today between 11:00 AM to 8:00 PM to address the same. Request your kind patience. -AJ",myntra
2019-11-23 18:46:15+00:00,Myntra: The Kapil Sharma Show - Movie Housefull 4 Episode ... ,myntra
2019-11-23 18:46:00+00:00,Myntra: Rahat Fateh Ali Khan - Zaroori Tha ,myntra
2019-11-23 18:42:50+00:00,I hope I get my product ASAP within the next two days and I want an additional discount on the product for this delay or any free gift will do,myntra
2019-11-23 18:39:44+00:00,"Yes, Prayash! We agree that's a long wait. As per our records, we see that your order has been packed but due to some technical glitch, the same has not been shipped. We know your time is valuable. We have raised a complaint regarding the (cont) http://srkl.in/l/6017BIhi2c",myntra
2019-11-23 18:36:19+00:00,It is very upsetting and frustrating because we pay first but delivery time we don't know when our product will reach us...it's been 7 days since I had ordered the products but still the products haven't left the warehouse...I am hoping for a good reason to why this delay,myntra
2019-11-23 18:35:40+00:00,@myntra 10% hdfc bank debit card cashback option I didn't get for my order.,myntra
2019-11-23 18:31:37+00:00,"Hey Hitesh! We have replied to your DM, kindly check. -AO",myntra
2019-11-23 18:27:58+00:00,The reply in the DM doesn't provide the resolution.,myntra
2019-11-23 18:24:20+00:00,Thank you for sharing the details Prayash. We know that this situation could be quite upsetting. We will not let you lose faith in us. We have highlighted this hassle caused. One of our case managers looking at your complaint will contact (cont) http://srkl.in/l/6016BIhi0m,myntra
2019-11-23 18:22:48+00:00,"Hey Hitesh! We have replied to your DM, kindly check. Also, we request you to refrain from sharing any order related or personal account details on the public posts for security purposes and suggest you hide/remove any comments/posts that (cont) http://srkl.in/l/6011BIhi09",myntra
2019-11-23 18:15:53+00:00,We have replied via DM kindly have a check. -NS,myntra
2019-11-23 18:15:26+00:00,@MyntraSupport I had ordered on Myntra on 16th November and my order no is 112580683677408514603 and 112580492716476550603 my order hasn't been sent out frm the warehouse and today is the 23rd November 2019. I don't like Myntra taking money from customers and delivering late...,myntra
2019-11-23 18:14:35+00:00,Haan ,myntra
2019-11-23 18:13:59+00:00,@myntra I had ordered on Myntra on 16th November and my order no is 112580683677408514603 and 112580492716476550603 but my order hasn't been sent out from the warehouse and today is the 23rd of November 2019. I don't like Myntra taking money from customers and delivering late...,myntra
2019-11-23 18:11:21+00:00,Haan fair point but fir bhi.. profession se gaddaari na ho paaye,myntra
2019-11-23 18:10:30+00:00,@myntra complaint IN19112111392529198129. I ordered HRX joggers and what I received is some fake used track pant which is torned asked for original product they said refund will be given and when asked the same in written said even that is not possible.Below are OG and fake img ,myntra
2019-11-23 18:10:28+00:00,Hahahaha and you think all chowkidaars stay up all night??? Naive you are!,myntra
2019-11-23 18:09:40+00:00,Raat ko neend aati hai..na ho paaye yeh,myntra
2019-11-23 18:08:14+00:00,I agree! Chowkidaar ki naukri kar lo. I've seen guards in Mumbai sekoing their hands over a bonfire in November ,myntra
2019-11-23 18:06:31+00:00,The worst part is I like those clothes :( but pehnu kab aur kahan,myntra
2019-11-23 18:05:17+00:00, mujhe kya pata.. Myntra se pucho,myntra
2019-11-23 18:03:15+00:00,Meri shakal dekh ke main Bengali lagta hu???,myntra
2019-11-23 18:02:24+00:00,Arre they must be confusing you with Bengalis.,myntra
2019-11-23 18:02:20+00:00,"We totally understand that this has not been a happy experience. While we strive to provide the best customer service, we seem to have missed the mark here. We are here to help you. We request you to share the below-mentioned details via (cont) http://srkl.in/l/6012BIhia0",myntra
2019-11-23 18:00:25+00:00,Has lo tum bhi ,myntra
2019-11-23 17:59:35+00:00, ,myntra
2019-11-23 17:57:42+00:00,1/5 #Review on @myntra by ishangrover67 : Bad-experience -,myntra
2019-11-23 17:56:49+00:00,"@myntra I ordered a lipstick on one shade from your portal and got a delivery for another shade. Now they website says I can't return the product because of the 'nature of the product,' will I get assistance from your side to return this product as this not what I had ordered.",myntra
2019-11-23 17:49:42+00:00,Dekh na yaar :/ mazak ban jaata hai :/,myntra
2019-11-23 17:49:27+00:00,I say Bombay :),myntra
2019-11-23 17:48:29+00:00,Mumbai*,myntra
2019-11-23 17:47:03+00:00, ,myntra
2019-11-23 17:46:05+00:00,Myntra Offer: Buy Womens Footwear starting from Rs.499 https://ift.tt/2XIesA1 Myntra Offer: Buy Womens Footwear starting from Rs.499 FROM 499 OFFER WOMEN'S FOOTWEAR,myntra
2019-11-23 17:45:05+00:00,"We hear you loud and clear, Saaj! Please note that the advertisements and promotions on varied social media platforms and in our application/website is seasonal. Winter is coming and hence you're seeing the products that'd keep you warm (cont) http://srkl.in/l/6017BIhitS",myntra
2019-11-23 17:37:03+00:00,I prefer @amazonIN for gadgets @myntra for apparel @flipkart for mobiles &amp; gadgets @bigbasket_com for grocery #GiveawayAlert #freebies #free #freestuff #Giveaway #ContestIndia #ecommerce #shopping #onlineshopping Join @khemka_nidhi @angeleyess4uin @Abhishe_6 @Satyam143341,myntra
2019-11-23 17:36:11+00:00,Myntra Offer: Buy Mens Casual Shirts starting from Rs.349 https://ift.tt/35uggzr Myntra Offer : Buy Mens Casual Shirts starting from Rs.349 FROM 349 OFFER MEN'S CASUAL SHIRTS,myntra
2019-11-23 17:35:40+00:00,I was talking about the products shown inside the app ,myntra
2019-11-23 17:24:11+00:00,@myntra @MyntraSupport @gurgaonpolice,myntra
2019-11-23 17:18:06+00:00,"Hi, Saaj! Our advertisements & promotions are made for the whole of India depending on the seasons. Don't worry though, we still have our summer collection available. Do check out our app/website. -AJ",myntra
2019-11-23 17:15:33+00:00,I prefer @amazonIN and @myntra Following @amazingdeals_in helps get my best deals on Amazon Please follow @amazingdeals_in and RT @sonali31104 @tushard8 @tshinde @DrMalagi,myntra
2019-11-23 17:11:26+00:00,Myntra Offer: Get up to 45% off on Fusion Wear For Women https://ift.tt/35sji7h Myntra Offer: Get up to 45% off on Fusion Wear For Women 45% OFF FUSION WEAR,myntra
2019-11-23 17:07:47+00:00,"Required male female models for Myntra and Amazone garments shoot ,like ,t shirt , jacket, shirt plazo ,kurta etc . Female must have hight 5.5 inch Male hight 5.8 minimum",myntra
2019-11-23 17:06:55+00:00,I reviewed http://Myntra.com 1/5. Earn Rs.20 per review #WriteShareWin https://www.mouthshut.com/review/Myntra-com-review-uqpurusrulo via @MouthShut @myntra,myntra
2019-11-23 17:06:14+00:00,Myntra Offer: Buy Levis Men's Footwear Starting At Rs.599/- https://ift.tt/2XEn3E9 Myntra Offer: Buy Levis Men's Footwear Starting At Rs.599/- FROM 599 OFFER FOOTWEAR,myntra
2019-11-23 17:03:46+00:00,"Hi, Pranati! We get it that you're concerned about the refund. Please be informed that the refund has been successfully initiated from our end. Kindly wait till 26th Nov for the same to reflect your account. Also, (cont) http://srkl.in/l/6017BIhiYB",myntra
2019-11-23 16:52:35+00:00,"@myntra order id-1125444-3924842-3786803,the product is already picked up 4 days before.but still money is not refund.This is so late processing i am really not satisfied for delay.",myntra
2019-11-23 16:45:54+00:00, ,myntra
2019-11-23 16:17:30+00:00,Nice one,myntra
2019-11-23 16:06:57+00:00,"We get it you are concerned! Please be informed, the order is in shipped status and you shall receive the product on or before 25-November. In case if you have canceled the order it will take 72 hours for the status to get changed and the (cont) http://srkl.in/l/6014BIhikq",myntra
2019-11-23 16:02:54+00:00,"hi @Uber_India, @amazonIN, @SheinIndia, @myntra, @dominos_india, @NetflixIndia, @hotstartweets and @becurefit plz get pay later option #KeepItSimpl",myntra
2019-11-23 16:00:35+00:00,"Love the ease of @getsimpl. pls integrate with @Uber_India, @amazonIN, @myntra, @dominos_india, @NetflixIndia, @hotstartweets and @oyorooms #KeepItSimpl",myntra
2019-11-23 15:58:22+00:00,@myntra didn't get refund for my order number112602732626653687901. It's been more than 48 hours,myntra
2019-11-23 15:50:14+00:00,Supar Anush,myntra
2019-11-23 15:35:54+00:00,Classical & Elegant Dress suits yu! Thumbs up? .,myntra
2019-11-23 15:30:11+00:00,SOOOOOOOOOOOOOOOOO MAGNIFICENT!!!!!!!!!!! @AnushkaSharma ,myntra
2019-11-23 15:20:21+00:00,SOOOOOOOOOOOOOOOOOO MAGNIFICENT!!!!!!!!!!!!!!!!!!! @AnushkaSharma,myntra
2019-11-23 15:19:19+00:00,Good,myntra
2019-11-23 15:18:51+00:00,Love you mam,myntra
2019-11-23 15:18:39+00:00,Great Mam,myntra
2019-11-23 15:14:02+00:00,I liked,myntra
2019-11-23 15:12:54+00:00,SOOOOOOOOOOOOOOOO MAGNIFICENT!!!!!!!!!!!!!!!! @AnushkaSharma,myntra
2019-11-23 15:01:16+00:00,"We put great importance on the quality of our services and the satisfaction of our customers, Gaurav! Upsetting you is the last thing we can ever do. We know the importance of your concern and have escalated the same. Rest assured, one (cont) http://srkl.in/l/6019BIhiML",myntra
2019-11-23 14:58:54+00:00,Efforts are much appreciated,myntra
2019-11-23 14:57:45+00:00,Thank you for the confirmation! Apologies for the inconvenience though. We promise to give you a hassle-free experience next time. - AJ,myntra
2019-11-23 14:56:59+00:00,Hey Gaurav! We never wished to cause such an experience for you & would always make the best efforts to provide the most satisfying service. We will certainly look into this please DM your regd. E-mail ID & order (cont) http://srkl.in/l/6014BIhiMG,myntra
2019-11-23 14:56:58+00:00,My order id is: 1126034-4792481-0034101 Email-shilpigupta0785@gmail.com,myntra
2019-11-23 14:55:15+00:00,Hey Gaurav! We have replied to you here - http://srkl.in/6016BIhizI Please check. -AO,myntra
2019-11-23 14:54:54+00:00,Hey Gaurav! We never wished to cause such an experience for you & would always make the best efforts to provide the most satisfying service. We will certainly look into this please DM your regd. E-mail ID & order (cont) http://srkl.in/l/6010BIhizs https://twitter.com/messages/compose?recipient_id=89443197,myntra
2019-11-23 14:53:14+00:00,You are welcome Lucky. Our motto is to serve our customers. -PS,myntra
2019-11-23 14:51:44+00:00,"@myntra pls stop ‘insider points’ or rather stop cheating customers. I ordered a product and it’s damm small..and cannot return. Customer care guy says..its non-returnable, what should I do with the product ?",myntra
2019-11-23 14:50:49+00:00,"Thank you @myntra , The problem is sorted out ! ",myntra
2019-11-23 14:49:06+00:00,I myself got cheated by Myntra insider points. Customer care guy is well trained to repeat the a nonsense ‘sorry’. Myntra-never again,myntra
2019-11-23 14:26:35+00:00,Hii,myntra
2019-11-23 14:16:19+00:00,We have responded via DM. -PS,myntra
2019-11-23 14:11:46+00:00,We have replied to here: http://srkl.in/6014BIhiDk . Kindly check. -AZ,myntra
2019-11-23 14:10:41+00:00,"Whoa, Sandeep! Our intention was never to hurt your sentiments. We always care about our customers and want to deliver our best and we will never ignore our customers or their comments/posts. While we understand your situation, we have (cont) http://srkl.in/l/6012BIhiDn",myntra
2019-11-23 14:07:48+00:00,@MyntraSupport @myntra I know you will try to block me from here so that people shouldn't know what kind of dirty works you do. I just asked you guys a simple question #fraudcompany #myntra @GrabOnIn @Gadgets360,myntra
2019-11-23 14:07:30+00:00,@myntra I just wanna say you stop this Fucking INSIDER POINTS collection process. I mailed you myntra team and I will never ever again shopping on Myntra. Email ID - s.kikan25@gmail.com,myntra
2019-11-23 14:06:27+00:00,If NUSH is a growing brand then the reason can be seen in this picture ,myntra
2019-11-23 14:03:39+00:00,I knew that the Fraud team of myntra will decline to accept that they have delivered a bad quality product. You have proved how much value you have for the customers. As per the discussion on the M/s Pinki(Alias name provided to me) told me that she cannot comment on anything.,myntra
2019-11-23 14:03:35+00:00,"@myntra Hi Myntra Team, I just wanna tell you that my brother called your customer support on 21st Nov.11:51 am. The concern about I just recently bought two sandals from Myntra App (DRESSBERRY) their prices are:- 1.) Women Rose Gold 2.) Women Pink Heeled Sandals 8929550670 Call ",myntra
2019-11-23 14:02:09+00:00,Then there should be some way ! 1) The thing is the mode of refund is not chosen by us but rather chosen on our behalf. 2) the disrespectful manner of communication by customer care executive. Please respond. I do have proofs btw @myntra @MyntraSupport,myntra
2019-11-23 13:57:43+00:00,"Hi Kajal! We understand your concern about the refund mode. Please be informed that as the return is already picked up, we are unable to change the refund mode. Hence, we request you revert to the email with the (cont) http://srkl.in/l/6019BIhi6t",myntra
2019-11-23 13:47:46+00:00,Please note that there was no option chosen from our end in any form. It is hereby requested to assist us. The mode of refund cant be enforced.,myntra
2019-11-23 13:45:15+00:00,"Wish we could do that, Kajal. Since NEFT mode was selected for the refund at the time of creating a return, we will be unable to change the mode of the refund to Myntra credit at this moment. Request you to share the bank details by reverting (cont) http://srkl.in/l/6010BIh9Cp",myntra
2019-11-23 13:38:38+00:00,Pls suggest any other mode of refund. I dont mind myntra wallet credits.,myntra
2019-11-23 13:36:04+00:00,"We see that you've already reached out to us for this, Shear! Hang in there for the requested period provided by our case manager. We are putting in our best efforts to get it delivered to you as soon as possible. Request your kind patience and understanding.- SS",myntra
2019-11-23 13:35:14+00:00,"Thank you for reaching out to us, Kajal! Please be informed that we have sent you an email requesting bank details to process the refund. Request you to revert to the same email with the details so that we can proceed (cont) http://srkl.in/l/6017BIh9AB https://twitter.com/messages/compose?recipient_id=89443197",myntra
2019-11-23 13:28:16+00:00,What a shameless reply again ? How many times will I be contacted for the same useless reply ? One question which still remains answered is of a commitment for delivery. Shame on Myntra !! Develop some professionalism. @myntra @_Amar_N,myntra
2019-11-23 13:27:33+00:00,@myntra @MyntraSupport return number : 4071862072 Can you please assist me with modes of refund?,myntra
2019-11-23 13:25:06+00:00,Hi Sandeep! We have responded to your concern via http://srkl.in/6012BIh94K . Kindly have a check.- SS,myntra
2019-11-23 13:24:42+00:00,Hi Sandeep! We are sorry this has happened. Please be assured that we have escalated the concern related to the product & are actively working on it. our case manager will contact you tomorrow between 11:00 AM to 08:00 PM & address your (cont) http://srkl.in/l/6010BIh94y,myntra
2019-11-23 13:19:06+00:00,"Myntra team even denied on call to even listenor accept it that this order was delivered as a defective product to me. I just asked to replace this product, but they started stating me that 15 days are past and we cannot do anything now. At least they accepted it. @myntra #fraud",myntra
2019-11-23 13:12:15+00:00,"Hatts off to Myntra, what a shitty excuse provided by Customer care that if you collected insider points over Myntra app you can return or exchange the product you buyed from Myntra. Their priority is not to make customer Happy #myntra #fake #myntrafashionsuperstar #shopping",myntra
2019-11-23 13:09:55+00:00,Is it done?? @anantgoenka @CEATtyres,myntra
2019-11-23 13:08:33+00:00,"@MyntraSupport I have returned the product to the myntra pick up guy, and myntra is claiming that product has not been returned. So, I have given my product to some random guy who had all the details? Complaint number- 19110515030370914139 Account ID- rohan9836@yahoo.com",myntra
2019-11-23 12:57:35+00:00,"If i had a rupee for each time @myntra and @Lenskart_com send credits to my account, it'd be Twitter for iphone below.",myntra
2019-11-23 12:54:38+00:00,"Upsetting you is the last thing we could ever do, Vidhya! Please be assured that we have escalated the concern related to the return of the product & are actively working on it. Our case manager will contact you tomorrow between 11:00 AM (cont) http://srkl.in/l/6016BIh9ap",myntra
2019-11-23 12:53:34+00:00,Myntra wants to get rid of its bad products and make money on it . Despite umpteen complaints and assurances that product will taken back the product still lies with http://me.Today message comes problem solved. YOU HAVE NOT SOLVED MY PROBLEM#myntrafashionsuperstar,myntra
2019-11-23 12:51:54+00:00,Hi there! We have responded here http://srkl.in/6012BIh9vj -DD,myntra
2019-11-23 12:51:34+00:00,Hi there! Our smile has turned into a frown upon reading this. Allow us a chance to have a look at your issue. Just hit us up with a wee bit of elaboration on the issue and share your regd. email/order number via DM. -DD https://twitter.com/messages/compose?recipient_id=89443197,myntra
2019-11-23 12:49:15+00:00,"Delivering your bag of joy & to see you happy is our priority, Gaurav! We never wished to cause such an experience for you & would always make the best efforts to provide the most satisfying service. We will certainly (cont) http://srkl.in/l/6018BIh9Q4 https://twitter.com/messages/compose?recipient_id=89443197",myntra
2019-11-23 12:47:45+00:00,@myntra stop advertising as a company for customers if you harass customers for no fault of theirs SHAME ON YOU!!,myntra
2019-11-23 12:46:08+00:00,@myntra please take back your horrible product - broach - and return my moneyPaltry sum of 802 will not make you Rich,myntra
2019-11-23 12:44:57+00:00,"We agree that there has been a delay in the delivery of the exchange order which we never intended to, Shear! To err is human. Don't sweat it! We will make sure your product reaches you on priority. Simultaneously, our case manager will (cont) http://srkl.in/l/6019BIh9tx",myntra
2019-11-23 12:41:06+00:00,"Again after collecting all the information don’t tell he that we cannot refund the money , if that is the case I will need to file a legal complaint against myntra",myntra
2019-11-23 12:40:03+00:00,"As requested I have attached the screenshot , let me know if u guys need any furthers details",myntra
2019-11-23 12:40:00+00:00,"@myntra @MyntraSupport ur app is nice and ads r cool but kindly note: ur customer care and delivery always sucks. Assuring delivery on time and will not on time is ur moto. Insted of sending delivery time and style agent message Just send: Thank You For Ordering, Milega Tab Lelo.",myntra
2019-11-23 12:38:29+00:00,"That shouldn't have happened! Please check if you're using the latest version of the Myntra App &amp; try deleting the cache memory. You can do that by going into the Settings &gt; App. If you still face the same issue, kindly try to reinstall (cont) http://srkl.in/l/6011BIh9s9",myntra
2019-11-23 12:38:20+00:00,"@MyntraSupport @myntra ur app is nice and ads r cool but kindly note: ur customer care and delivery always sucks. Assuring delivery on time and will not on time is ur moto. Insted of sending delivery time and style agent message Just send: Thank You For Ordering, Milega Tab Lelo.",myntra
2019-11-23 12:37:40+00:00,"@myntra @MyntraSupport ur app is nice and ads r cool but kindly note: ur customer care and delivery always sucks. Assuring delivery on time and will not on time is ur moto. Insted of sending delivery time and style agent message Just send: Thank You For Ordering, Milega Tab Lelo.",myntra
2019-11-23 12:37:08+00:00,Excellant.,myntra
2019-11-23 12:35:15+00:00,"@myntra @MyntraSupport ur app is nice and ads r cool but kindly note: ur customer care and delivery always sucks. Assuring delivery on time and will not on time is ur moto. Insted of sending delivery time and style agent message Just send: Thank You For Ordering, Milega Tab Lelo.",myntra
2019-11-23 12:31:15+00:00,Myntra par search kijiye,myntra
2019-11-23 12:30:42+00:00,Same is the case with.@myntra @MyntraSupport is cheating..@ANarayanan24 https://twitter.com/thepotato_luver/status/1197387614124298241,myntra
2019-11-23 12:21:26+00:00,Hi Lucky! We are sorry to hear about this. Please DM us your regd. email. ID and return number so that we can have a check and help you accordingly. We await your response. -KS,myntra
2019-11-23 12:20:55+00:00,"Hi Samrat! We never intend to manipulate our customers. This certainly is an unusual instance. Not to worry, we are here to assist you. Do share with us an image of the product highlighting the defect, along with the order number and regd. (cont) http://srkl.in/l/6018BIh9We",myntra
2019-11-23 12:19:26+00:00,"Myntra Sale Live Upto 70% OFF on Roadster T-Shirt Limited Stocks Available, Buy Now! https://ekaro.in/enkr2019112331658908",myntra
2019-11-23 12:15:55+00:00,@StayWrogn I have bought a t-shirt (@StayWrogn ) from @myntra and delivery on 13/10/2019. T-shirt’s front print has started to disintegrate. You are cheating on the name of the brand. I did not wear more than 10 days. #Wrogntribe #StayMad #myntra,myntra
2019-11-23 12:14:33+00:00,@myntra My return is successful but refund not received. Call customer care and submit complaint regarding this but still refund not received.,myntra
2019-11-23 12:13:51+00:00,@MyntraSupport hi u deputed thief type person n not responding. Do share e mail to brief u n don’t send such poor jokers to collect item.. worried about you n your services.. any how disturbing n disgusting saturday by myntra..,myntra
2019-11-23 12:12:56+00:00,Love you honey,myntra
2019-11-23 12:12:43+00:00,well @JabongIndia is like a sad boyfriend who unwillingly celebrates his girlfriend @myntra sale,myntra
2019-11-23 12:12:06+00:00,"Hi Manthan! We at Myntra believe in providing great deals and discounts. However, discounted prices on our range are limited till the stocks last. Do keep an eye out! -MG",myntra
2019-11-23 12:09:13+00:00,"ok so @myntra I think you'll need new marketing Team ,as your sale products are the most expensive thing I have ever seen in a sale, the product which I see of 600 you sell that in 1500 and say get another one for 99 or 299 guys chill itna pagal mat banao yar #justmyntrathings",myntra
2019-11-23 12:06:47+00:00,@AnushkaSharma ,myntra
2019-11-23 12:00:45+00:00,This the new fraud @myntra has started...is your product returned???,myntra
2019-11-23 11:58:49+00:00,"Siddharth, we entirely empathize with the ordeal faced by you! Requesting you to wait seems unfair on our part, and we totally comprehend how upset you must feel. Please note that we are required certain time-lines to sort you the most (cont) http://srkl.in/l/6011BIh9iD",myntra
2019-11-23 11:57:54+00:00, ,myntra
2019-11-23 11:56:06+00:00,@MyntraSupport I have returned an order of Myntra but I didn't receive the full refund of the order .Please help me out.I can share the order details,myntra
