date,tweet,word
2019-11-18 07:43:47+00:00,"DM and wait for 24 hrs. Such fake concern, stop this drama. Also make sure to specify how many 24 hrs... Sometimes it can go upto 20 24 hrs. Be prepared. @myntra #Thanksgiving #youdeserveit",myntra
2019-11-18 07:43:40+00:00,@myntra pls stop sending fake products to your customers.. we pay a lot of money wants quality not fake products!! #myntra #fakeproducts #dontselltrynbuy,myntra
2019-11-18 07:41:17+00:00,"I second it! It's all fake concern, @Myntra doesn't really care. I have some issue pending for past 6 months, I've been asked to wait for 24 hrs everyday! Can u belive it!! How bad can it get.",myntra
2019-11-18 07:40:55+00:00,This Is Again Show You Finally I Know Well You Are Fraud @myntra @MyntraSupport,myntra
2019-11-18 07:40:25+00:00,Nice Mimicri Beta... ,myntra
2019-11-18 07:39:28+00:00,Thank You Beta Thank you.. Virat Kohli se bolke hamare Saboo Ko bhi Team Me khilwa do.,myntra
2019-11-18 07:38:53+00:00,I saw one designer palazzo to gift to my friend for her bday during Diwali for ₹1400. Today it's ₹559 in Myntra. Unbelievable. Diwali sales saale sirf Bahana. However bought &amp; returned at that time. Material was so good. You can buy if you want now. #socialserviceinmyblood,myntra
2019-11-18 07:38:36+00:00,"Really, what's good to hear then? Give us 24 hours time! Sure, take all the time in the world n don't bother to resolve the problem. @myntra = #pathetic",myntra
2019-11-18 07:36:54+00:00,"They r good for nothing, #myntra support is pathetic, I have been waiting for a refund for more than 6 months now. Just forget the money or whatever. @myntra",myntra
2019-11-18 07:34:12+00:00,@myntra how you guys can say you deliver fast when you are taking 9 days for delivery..! Even after cancelling the order on 16th i am getting the shirt on 18th.,myntra
2019-11-18 07:32:11+00:00,We are sorry for the delay and will surely work on this feedback so that the same issue should not be repeated in your upcoming orders. We appreciate your understanding in this regard. -SJ https://twitter.com/messages/compose?recipient_id=89443197,myntra
2019-11-18 07:27:52+00:00,"@myntra Finally A Good Move by Introducing Prices inclusive of all Taxes, Which makes shopping here more clear and transparent.",myntra
2019-11-18 07:22:23+00:00,@myntra such a bad service from myntra..i ordered a mufti shirt on 9th Nov and the delivery date was 15th..on 16th i raised a complaint and today on 18th i got the shirt. 9 days for delivery and customer service says we deliver fast.,myntra
2019-11-18 07:03:17+00:00,"We understand your point Ibrar! Please be informed We have already escalated your concern, one of our case managers will contact you by 08 PM today with an updated on your concern. We appreciate your patience so far. -SB https://twitter.com/messages/compose?recipient_id=89443197",myntra
2019-11-18 06:59:20+00:00,Yes true pleas call me if u don’t understand,myntra
2019-11-18 06:58:46+00:00,"Ibrar, let's quickly recap! You have returned the product on Friday (15th November 2019) and have been waiting for your refund. Looks like the delivery agent has still not updated the status which is worrying you the most. Rest easy knowing (cont) http://srkl.in/l/6015BIh1ol",myntra
2019-11-18 06:56:45+00:00,"Hi Pooja! We understand you are concerned about the delivery of your order. Please note that we do not have a real-time tracking site as it is being shipped through in house Logistics (Myntra logistics) however, (cont) http://srkl.in/l/6014BIh1Wa https://twitter.com/messages/compose?recipient_id=89443197",myntra
2019-11-18 06:52:09+00:00,"Hi there! That’s not what we want you to experience. Please be assured, we've escalated the issue further & we're working on it with utmost priority. You'll be contacted by our case managers at the earliest anytime before 8:00 PM. -A",myntra
2019-11-18 06:50:32+00:00,"Thank you for sharing the details, Ashwin! We value the importance of your concern. Rest assured, one of our case managers will contact you by the end of the day before 08:00 PM to address your concern. Appreciate your patience in this regard. -TS",myntra
2019-11-18 06:46:50+00:00,You guys’ are really not understanding the same was picked up on Friday thAn why the hell was not updated as picked up,myntra
2019-11-18 06:46:12+00:00,"We appreciate your understanding, Pooja! -ZA",myntra
2019-11-18 06:45:48+00:00,"Ibrar, we understand your concern with regards to the refund of the product. Please note that the status has not been updated as picked up and we have highlighted the concern and one of our case managers will get back to you with an update (cont) http://srkl.in/l/6011BIh1iP",myntra
2019-11-18 06:45:16+00:00,"@ANarayanan24 @jagograhakjago @JagoGrahakJago_ @consaff @consaffairs4you @myntra @MyntraSupport Dear Sir, Addressing tweet to aware you of how your customers are cheated and products are stolen. Big scam. Kindly look into it and get back my refund. https://www.mediafire.com/file/kqapheij5mlfd1w/918061561999-20191118111902/file",myntra
2019-11-18 06:42:54+00:00,"We understand that you're eagerly waiting for the delivery of the order, Pooja! While we realize that a faster delivery would be very convenient for our customers, we apologize as we don't have the service yet. We've (cont) http://srkl.in/l/6017BIh1gt https://twitter.com/messages/compose?recipient_id=89443197",myntra
2019-11-18 06:40:46+00:00,"Hi Bhavna! We understand your concern. Kindly give us a chance to look into it. Please DM your registered email ID & order number, so that we can assist you accordingly. -R https://twitter.com/messages/compose?recipient_id=89443197",myntra
2019-11-18 06:38:54+00:00,Thanks a lot sir But I am facing the same problem still,myntra
2019-11-18 06:37:27+00:00,"@MyntraSupport @myntra Can you please share the status, by when it will be delivered. ",myntra
2019-11-18 06:35:23+00:00,I can see the shoes has been picked up but the money is not been refunded could you please check it,myntra
2019-11-18 06:30:36+00:00,M talking to lazy pay,myntra
2019-11-18 06:29:01+00:00,I have shared my details over DM. Please check and revert,myntra
2019-11-18 06:27:09+00:00,"Hi Jayprakash! We are here to help you with your concern. Please share your regd. email ID and the order number (if any), via DM, so we can look into this and assist you accordingly. We await your response. -SB https://twitter.com/messages/compose?recipient_id=89443197",myntra
2019-11-18 06:25:36+00:00,"That's not good to hear, Prashanth! This is not the experience that we want you to have with us! Don't you worry. We request you to kindly confirm your pickup address here so that we can create a new return. Also, (cont) http://srkl.in/l/6015BIh1kT https://twitter.com/messages/compose?recipient_id=89443197",myntra
2019-11-18 06:25:08+00:00,We have replied to your concern here: http://srkl.in/6011BIh1k1 Kindly have a check. -R,myntra
2019-11-18 06:24:43+00:00,"We understand your concern, Sridhar! We strive hard to give away a flawless shopping experience to our customers and never intend to cause any inconvenience. Kindly give us a chance to look into your concern. Please (cont) http://srkl.in/l/6015BIh1Xh https://twitter.com/messages/compose?recipient_id=89443197",myntra
2019-11-18 06:24:01+00:00,@myntra I have done lakhs of rupees shopping on #myntra and this is the kind of customer service you have. I will buy from Amazon or may be other stores. If there is no value for the premium customer why should I buy on #mytra.,myntra
2019-11-18 06:21:13+00:00,Hey @myntra I tried to return my watch could not find return option and customer care did not respond properly and misguided me . Now they say return period is http://lapsed.How can I return it when pricetag and box everything is intact.,myntra
2019-11-18 06:19:49+00:00,Reply why I can not use my money?,myntra
2019-11-18 06:19:25+00:00,"Glad to know that, Debolin! We'll ensure that our level of service is maintained to serve you better. -A",myntra
2019-11-18 06:17:30+00:00,@myntra Fwd: My order number is 112259990321490152101he mera order ka abhi tak return picked nhi kiya gaya.pichle 3 din se requst approved ho chuki he parant aaj din tan koi picked nhi hua he... your couriour service very bad. So be alert on purchase of myntra app,myntra
2019-11-18 06:16:35+00:00,"Thanks @myntra for getting me the refund, took time but you guys got it resolved",myntra
2019-11-18 06:14:17+00:00,"We are always working to improve our standards of consumer experience. If you have faced any inconvenience, we regret for that. Please share the details and that would help us address the issue, at least for our future consumers.",myntra
2019-11-18 06:00:53+00:00,"Sunday or Monday, it’s always a Funday with the brand new #NushXChachaChaudhary Collection! Available now on http://www.nush.in, @myntra, @centralandme, @TataCLiQ | @prancomic | @DiamondbookIND | @AnushkaSharma",myntra
2019-11-18 05:56:18+00:00,1/5 #Review on @myntra by puni301992 : Exchange -,myntra
2019-11-18 05:43:53+00:00,"Vikas, thank you for giving us this pat on the back, you made our day! It's only when we receive such positive feedback, we know that we have done our jobs well. -SA",myntra
2019-11-18 05:37:53+00:00,Thanx to @myntra for this and Salute to them ,myntra
2019-11-18 05:36:16+00:00,Hi Deepti! We value the importance of your concern. We have sent an email to your registered email ID on 17th November 2019. Please have a check & revert on the same. Your kind understanding is appreciated. -BT,myntra
2019-11-18 05:19:41+00:00,"@MyntraSupport The delivery boy is refusing to deliver my order to the given adress its not the first time he is being very rough towards me he told me if you want your product come and get it from the office., then why the hell i paid rs 150 delivery charge myntra is cheating ",myntra
2019-11-18 05:19:37+00:00,"Myntra is designed to deliver smiles &amp; not the impression you're currently having, Tausif. Thank you for reaching out to us. We've highlighted this issue &amp; will get in touch with you by 8 PM end of the day to discuss (cont) http://srkl.in/l/6019BIhE2f https://twitter.com/messages/compose?recipient_id=89443197",myntra
2019-11-18 05:15:30+00:00,I don't want to receive any call by case managers.if there is any update reply here only. Already one case manager called me 3days back and gave me a fake assurance. I don't want to receive a call anymore. Kindly post update here only.,myntra
2019-11-18 05:10:12+00:00,We have replied to your concern here: http://srkl.in/6017BIhEI9 Kindly have a check. -R,myntra
2019-11-18 05:09:47+00:00,"We get your point, Pradeep. Please be assured that we are trying our best to get the issue resolved as early as possible. One of our case managers will get in touch with you before the requested time frame (01:00 pm) with an update. Please bear with us till then. -R",myntra
2019-11-18 05:09:45+00:00,@ANarayanan24 @MyntraSupport @myntra i m being punished for my biggest mistake of ordering frm my fav online store myntra by not getting shipping charges refunded in my bank account.,myntra
2019-11-18 05:05:08+00:00,2/2 Is issueing a gift card is more difficult then the order refunds and cancellations. Simple gift card man.,myntra
2019-11-18 05:04:42+00:00,"@myntra order id 112525143956479843701. Placed on 10Nov, expected delivery was 13 Nov 19. Still the product is not dispatched. Very poor service as i have booked it for family function which was on 17Nov. Need to think twice to place order from next time on #Myntra",myntra
2019-11-18 05:04:13+00:00,He gave me the timeline of 48 to 72 hrs. Do you people think I'm a fool today is the last day that's why I posted a tweet. By 1 pm 72 hrs completing. Wah wah what service Myntra u people want 72 hours for a simple gift card? 1/2,myntra
2019-11-18 05:02:02+00:00,Ashish! We understand your urgency in receiving the order. We are sorry that the wait is getting longer. Please be assured that we've escalated this issue. Our case manager will get in touch with you by today within (cont) http://srkl.in/l/6012BIhEQQ https://twitter.com/messages/compose?recipient_id=89443197,myntra
2019-11-18 04:57:52+00:00,We have replied to your concern here: http://srkl.in/6019BIhEtP Kindly have a check. -R,myntra
2019-11-18 04:57:12+00:00,Hi Pradeep! We understand that you're not happy with the experience you've had and we are really sorry about it. We see that you have spoken to one of our case managers regarding your concern on 15th Nov 2019 and has requested for a time (cont) http://srkl.in/l/6015BIhEtB,myntra
2019-11-18 04:53:29+00:00,If i didn't get resolution today i will definitely give free publicity to your company in every social media handles #myntra #CHEATING @myntra,myntra
2019-11-18 04:50:44+00:00,Today is 6th day can't u people stand on your words. Where is that case manager sudhansu he assured me the resolution in three days but nothing happened till now. Why would u people give a fake assurance when can't do anything in given timeline.,myntra
2019-11-18 04:46:51+00:00,"Hi Myntra, I want the invoice bill for my order with you. ORDER ID IS :1124938-5549212-2513103 @MyntraSupport @myntra",myntra
2019-11-18 04:24:29+00:00,"Vedant, we understand your concern with regards to the return and refund of the product. As per our records, the product had failed the quality check and for the same reason, it has been put on hold and is being reviewed for approval. Please (cont) http://srkl.in/l/6011BIhEgS",myntra
2019-11-18 04:24:12+00:00,Aapke naam ki toh hai #Mantra Ab refund to karna padega,myntra
2019-11-18 04:13:48+00:00,Guys avoid @myntra Harrasment by @MyntraSupport @myntra ordered a shoe and coz of size issue returned it. Now the company is making excuses in refunding my hard earned money Order no 1124736-4097516-9333703 Complain No IN19111809300307302149 Fraud company @myntra @MyntraSupport,myntra
2019-11-18 04:13:46+00:00,Sabu got a gender change,myntra
2019-11-18 03:59:31+00:00,"You guys will send wrong size of dress to customers and when i request for exchange you guys will handle things like this?2 Times the exchange order has been canceled by Myntra.If you cannot solve customer problems,please close your customer service and don't give FAKE promises.",myntra
2019-11-18 03:27:28+00:00,@Lazy_Pay - your server is down,myntra
2019-11-18 03:26:58+00:00,We've responded to you via DM. Kindly have a check. -SA,myntra
2019-11-18 03:26:48+00:00,"We've responded to you via DM, Mayur. Kindly have a check. -SA",myntra
2019-11-18 03:25:28+00:00,Nice ,myntra
2019-11-18 03:23:24+00:00,Nice,myntra
2019-11-18 03:06:13+00:00,We have replied to your concern here: http://srkl.in/6013BIhEPW Kindly have a check. -R,myntra
2019-11-18 03:05:39+00:00,"That's not good to hear, Mayur! This is not the experience that we want you to have with us. Kindly give us a chance to look into your concern. Please DM your registered email ID & order number, so that we can assist you accordingly. -R",myntra
2019-11-18 03:01:37+00:00,"Anzar, we understand your concern with regards to the pick up not getting completed. As we can check you had created the return stating ""I did not like the fit"". However, as per our records, a mail has been sent to your registered email (cont) http://srkl.in/l/6017BIhEPD",myntra
2019-11-18 02:57:28+00:00,"We aim to deliver smiles & not the impression you're currently having, Manvi! We tried reaching out to you on your contact numbers ending with ******4926 & ******8243, although we were unable to connect to you. We've sent an email to your (cont) http://srkl.in/l/6011BIhEOW",myntra
2019-11-18 02:54:53+00:00,"Very very happy. Guilt free #shopping @TheDataAreClean We had talked about this recently, now you can go back to shopping with @amazon . And @myntra could you please plo follow suit? ",myntra
2019-11-18 02:37:55+00:00,U DID NOT REFUND...STOP LYING FRAUDS,myntra
2019-11-18 02:30:12+00:00,Hey @myntra what's stopping you from giving a decent customer experience... Btw I'm not talking great customer experience because that's not even theoretically possible in your case...,myntra
2019-11-18 02:27:13+00:00,"Tried @getsimpl today.Awesome exp.Hope to use it soon on @Uber_India, @amazonIN, @myntra, @dominos_india, @NetflixIndia and @hotstartweets #KeepItSimpl",myntra
2019-11-18 02:20:09+00:00,Mantra commenting on myntra ,myntra
2019-11-18 00:25:19+00:00,Profile image bhi myntra se churaya hai aapne toh..,myntra
2019-11-18 00:04:04+00:00,"Thanks for reaching out to us, Ibrar! It is upsetting to know of the situation. Please be assured that the complaint about the return of the product ""Nike Men Blue Zoom Strike Running Shoes"" has already been logged and being worked with (cont) http://srkl.in/l/6019BIhEB9",myntra
