date,tweet,word
2019-11-05 13:21:45+00:00,"That's not the service we talk about & we apologies for this experience, Pooja! We put great importance on the quality of our services and the satisfaction of our customers. Guess what? We are here to help you. Kindly (cont) http://srkl.in/l/6011BIC1BT",myntra
2019-11-05 13:17:44+00:00,@myntra On 24th oct request been generated &amp; on 30th October Executive came for pic up ....after seeing the parcel denied to accept it &amp; sais i dnt have update from @myntra so he did not took it ..again i called to customer care tell what has happen with parcel,myntra
2019-11-05 13:17:41+00:00,Yes Thanks and regards,myntra
2019-11-05 13:15:54+00:00,@myntra I ordered Wall clock before diwali.On 24th of October I received my parcel...which is completely broken....on the same very moment i click the picture and call to customer care for Replacement or Refund. ,myntra
2019-11-05 13:15:02+00:00,"Terribly upset with Myntra Customer Care. With a brand name like this, the least they should do is teach their customer care representatives to help a customer in need. Very poor quality of assistance. @myntra @MyntraSupport @Myntra_CC @_Amar_N – at Banjara Hills",myntra
2019-11-05 13:14:54+00:00,"Hi Pooja! We intended this entirely the other way around. Trust us, we are concerned about it more than we can express. Please DM us your regd. email address and order number and we'll take it up from there. Also, (cont) http://srkl.in/l/6019BICEh5",myntra
2019-11-05 13:14:49+00:00,@firstcryindia ordered 3 product on 25th oct from #firstcryapp. Products were out for delivery on 30th Oct. Till today products are not delivered. #Poorservice from #firstcry. @myntra @amazonIN @Flipkart.,myntra
2019-11-05 13:11:35+00:00,Hi Anwesha! We heard you. We have responded to your query via DM. Kindly check. ^HH https://twitter.com/messages/compose?recipient_id=89443197,myntra
2019-11-05 13:10:48+00:00,रामायण देखी क्या,myntra
2019-11-05 13:09:03+00:00,"You've mistaken us. We realize that at this point asking you to wait would be upsetting. Please be assured, we've escalated the issue further & one of our case managers will be calling you within 24 hrs anytime between 11:00 AM - 8:00 PM to discuss in this regard. -A",myntra
2019-11-05 13:08:44+00:00,Tired of the wait. It’s been a month now. Cancelling my order @myntra @MyntraSupport It’s no even possible to contact you through a call. #disappointed #Myntra,myntra
2019-11-05 13:08:11+00:00,"Now I""m going to post one of the worst and creepy audio converstion between me and @myntra That will blow mind of all the customers That how they cheated me So from next time customers will think 100 times before shopping on @myntra Just wait and watch @iHrithik @sonakshisinha",myntra
2019-11-05 13:05:27+00:00,"We never intended to provide you with an unpleasant experience, Sufia! Please treat this as an unusual instance and DM the requested details below so that we can sort out this hassle and assist you accordingly: 1. (cont) http://srkl.in/l/6015BICE7z https://twitter.com/messages/compose?recipient_id=89443197",myntra
2019-11-05 13:03:35+00:00,"Sriram, we have responded via DM. -DD https://twitter.com/messages/compose?recipient_id=89443197",myntra
2019-11-05 13:01:39+00:00,"Further, please don't provide your order details over tweet/comment as we consider it to be personal information and our page is visible to the public. Kindly hide or delete the tweet with the order number. -A",myntra
2019-11-05 13:01:07+00:00,"That is not the service we talk about, Istakhar! Please be assured, we've arranged a callback on priority. One of our case managers will be calling you within 24 hrs anytime between 11:00 AM - 8:00 PM to discuss in this regard. -A",myntra
2019-11-05 13:00:34+00:00,I seek immediate action..This was my first and awful experience with Myntra.,myntra
2019-11-05 13:00:12+00:00,We have responded here http://srkl.in/6017BICEfR .-PS,myntra
2019-11-05 12:59:52+00:00,Hey Sufia. This is not good to hear. We request you to kindly share the details via DM so that we can assist you accordingly. 1) Bar-code Number - It is a 12 digit number starting with 10 or 9 and should be available on the sticker pasted (cont) http://srkl.in/l/6017BICEfH,myntra
2019-11-05 12:59:37+00:00,"HEY @amazonIN, @myntra, @NetflixIndia and @oyorooms Y U NO @getsimpl #KeepItSimpl",myntra
2019-11-05 12:58:53+00:00,@myntra ..pls refer image for the detail ,myntra
2019-11-05 12:58:09+00:00,@myntra is shit @myntra is cheater They have cheated my 967 rs Contacted multiple times via call and email but did not received my refund yet. Now @myntra will have to face the power of customers. ,myntra
2019-11-05 12:56:03+00:00,"Manvi! We’re hurt to know you feel this way, you are important to us. As per our records, we see that our case manager has addressed your concern and has sent an email with the reference number IN1910*****504221 kindly have a check. -NS",myntra
2019-11-05 12:53:00+00:00,@myntra https://www.myntra.com/10608398.. This was what I got.,myntra
2019-11-05 12:52:23+00:00,@Myntra https://www.myntra.com/10608384 this was what I ordered.,myntra
2019-11-05 12:51:50+00:00,ఊబకాయం 8 వివిధ కారణాల వల్ల ఊబకాయం వస్తుంది. ఇక్కడ ఉన్న కారణాలపై మేము చర్చించెదను. మనకు అధిగంగా ఆలోచనలు ఉంటే జీవక్రియ నెమ్మదిగా ఉంటుంది సరియిన సమయానికి తినకుండా ఉండడం మరియు జంక్ ఫుడ more https://indiangrandmotherremedies.blogspot.com/2019/08/OBESITY8.html,myntra
2019-11-05 12:51:32+00:00,@MyntraSupport My order is not getting delivered. How do i reach your customer support ? @myntra,myntra
2019-11-05 12:51:19+00:00,"hi @Uber_India, @amazonIN and @myntra plz get pay later option #KeepItSimpl",myntra
2019-11-05 12:49:41+00:00,"Says enough about u, u can just fill pockets of celebrities by stealing hard earned money of customers @PayPal shame on both of u @JagoGrahakJago_",myntra
2019-11-05 12:43:07+00:00,@myntra @MyntraSupport I have ordered two items which got delivered today. I paid for two items but after opening the shipment I found one item is missing. Order id is 1124653-5185842-1279204.Kindly resolve the issue as soon as possible.,myntra
2019-11-05 12:42:26+00:00,"Hi Rohan, please be informed, in case of transaction related to MYNTRA, the transaction type is ""ADD AND PAY"" in which we do not show Refund to Source option (1/2)",myntra
2019-11-05 12:42:23+00:00,"Aruna, we are happy that we could help. -NJ",myntra
2019-11-05 12:34:00+00:00,Thank you @myntra for your support.,myntra
2019-11-05 12:33:59+00:00,"Women are naturally built to have meat on their bones, and you certainly do not look overweight. A mentally healthy man would appreciate a woman your size, and any woman that would attack you for your weight is likely just jealous. Haters gonna hate.",myntra
2019-11-05 12:29:15+00:00,"Whoa, we certainly don't want you to feel this way, Kartik! We at Myntra make sure that all our products go through a stringent quality check to ensure it meets your expectations as well as company standards. Also, (cont) http://srkl.in/l/6013BICEv3",myntra
2019-11-05 12:27:04+00:00,@myntra @aajtak One of the wrost company in india...myntra ek no ki fraud company h,myntra
2019-11-05 12:26:40+00:00,This was pic of my kind of #Diwali evening. . . . . . . Forgot to post that time. @myntra @OnePlus_IN @amazfitindia @CellBellDesk #shotoncanon #shotoncanon200dmark2 #diwali2019 #studio #youtube #youtuber… https://www.instagram.com/p/B4e9PE-HL6W/?igshid=209xwcafb59,myntra
2019-11-05 12:20:41+00:00,"This is not indicative of the quality we adhere to at Myntra. Please be assured, we've escalated the issue further &amp; we're working on it with utmost priority. We'll share you with an update within 24 hours. -A",myntra
2019-11-05 12:20:18+00:00,"Ankur, we understand that it has taken a long time. Not to worry, we are working on your refund related query. Request you to wait as per the time frame provided. We appreciate your understanding. -MG",myntra
2019-11-05 12:16:57+00:00,@myntra see the quality of shoes i got from myntra.... .....keep it up myntra...... ,myntra
2019-11-05 12:13:22+00:00,"Hi Manu! Our intention was never to hurt your sentiments. We always care about our customers and want to deliver our best. But sometimes, things go out of place which is not acceptable, we agree. Can we have a look? As a part of customer (cont) http://srkl.in/l/6013BICEUZ",myntra
2019-11-05 12:11:23+00:00,"Its really rediculous that how the online sites are providing the services. I ordered few clothes and asked for exchange due to size issue, the delivery boy rejected the item without any reason.. I have no idea what's going on...@myntra @MyntraSupport @mukeshbansal06",myntra
2019-11-05 12:09:21+00:00,Thanku so much team once again,myntra
2019-11-05 12:08:19+00:00,"Hi Shubham! This was never our intention to cause you such an experience. Please be assured, we've escalated the issue & we're working on it with utmost priority. We'll share you with an update within 24 hours. -A",myntra
2019-11-05 12:07:51+00:00,Thankyou so much team for this amazing contest Thankyou so much for selecting me as a lucky winner Congrats to Co Winner #MyntraFashionSuperstar @myntra,myntra
2019-11-05 12:04:39+00:00,Hi Paramdeep! We have responded to you on DM please have a check. ~VI,myntra
2019-11-05 12:04:26+00:00,Congratulations @acidkidrock bhai,myntra
2019-11-05 12:01:29+00:00,"We assure you that it was never our intention to cause any discomfort to you and apologize for the experience you have had in this regard. While we cannot change what has happened, we would hate to lose you as a customer and hope you would (cont) http://srkl.in/l/6015BICEYv",myntra
2019-11-05 12:01:16+00:00,Why are products delivered late everytime to me @myntra !!! I want my product to be delivered today itself! Speak to the courier guy and just do that delivery.,myntra
2019-11-05 12:01:04+00:00,"Ankur, we know that the wait is getting longer than expected. As much as you are concerned about the issue, we are with all our might to solve this for you. As informed by our case manager we request you to wait (cont) http://srkl.in/l/6019BICEY5",myntra
2019-11-05 11:55:51+00:00,"Hey Sushma! We have replied to your DM, kindly check. -AO https://twitter.com/messages/compose?recipient_id=89443197",myntra
2019-11-05 11:55:23+00:00,"Hey Sushma! We have replied to your DM, kindly check. -AO",myntra
2019-11-05 11:53:52+00:00,elephants are cute...pls don't use them in this context,myntra
2019-11-05 11:53:19+00:00,"U refund it directly to a given Bank account, this experience of loosing 800 with u, trust me, i am never purchasing with u again...shame on u...u already have my bank account details",myntra
2019-11-05 11:49:38+00:00,Motakshi sinha was especially funny ,myntra
2019-11-05 11:47:13+00:00,"3/3 I GIVE UP! I WILL NEVER EVER ORDER FROM MYNTRA EVER AGAIN. NO COMPANY WHICH MAKES THE CUSTOMER CRY ON A CALL AND DOESN'T EVEN ACKNOWLEDGE IT DESERVES NO SINGLE PENNY FROM THAT CUSTOMER. Sincerely, Ex-Customer!",myntra
2019-11-05 11:45:55+00:00,N u even charging me delivery charges bcz I had returned many products but let me remind u that I had accepted many products so it is totally unfair please do something regarding with it n u r not even providing me cod,myntra
2019-11-05 11:42:19+00:00,Hey Sushma! We comprehend your disappointment about the missing component in your order. Our intention was never to provide such an experience for you. We're coordinating internally to sort it out as soon as possible. Please be assured (cont) http://srkl.in/l/6011BICEjx,myntra
2019-11-05 11:37:48+00:00,"Hi Ankur! We never intended to provide you with this unpleasant experience. Please be assured, we have highlighted the issue & one of our case managers will contact you at the earliest to address your concern. Appreciate your patience in this regard. -BT",myntra
2019-11-05 11:37:13+00:00,That is not good to hear Sufia! We never intended to cause the experience & this certainly is an unusual instance. We request you to share the below details with us via DM to take it forward: 1. Bar-code Number - It is a 12 digit number (cont) http://srkl.in/l/6010BICEwg,myntra
2019-11-05 11:37:11+00:00,"Pls don't bother. Close my account , do not attempt to call me.",myntra
2019-11-05 11:36:35+00:00,That is not good to hear Sufia! We never intended to cause the experience & this certainly is an unusual instance. We request you to share the below details with us to take it forward : 1. Bar-code Number - It is a 12 digit number starting (cont) http://srkl.in/l/6010BICEwn,myntra
2019-11-05 11:36:08+00:00,Hi Aakash! We are already addressing your concern on Facebook. Kindly follow the same to avoid multiple correspondences. ^HH https://twitter.com/messages/compose?recipient_id=89443197,myntra
2019-11-05 11:35:16+00:00,"Chetan, we have replied to DM. -DD",myntra
2019-11-05 11:34:49+00:00,"Yogesh, we have responded to your concern via DM. Please have a check. -ZA",myntra
2019-11-05 11:34:35+00:00,"Totally disappointed please improve ur service,order number 1123907-7624638-5541203 from @myntra please improve your service it is clearly written on that product that this set is consist of top and skirt please don't misguide us by providing wrong information . ",myntra
2019-11-05 11:34:29+00:00,@myntra this is to inform you that I haven't received the product I ordered Instead have received some other http://item.It's disgusting.I need to talk to the concerned authority.Kindly let me know how to reach the same.,myntra
2019-11-05 11:33:37+00:00,Abye khmosh ,myntra
2019-11-05 11:33:27+00:00,@ankeshrasela We request you to DM the order number and email ID so that we can assist you accordingly. -PS,myntra
2019-11-05 11:32:22+00:00,"Hey Vinay! We have replied to your DM, kindly check. -AO",myntra
2019-11-05 11:31:02+00:00,Hey Manvi. We get your point here. Please be informed the refund is already initiated from our end. We request you to check with the Paypal team for the refund amount. We request your understanding in this regard. -PS,myntra
2019-11-05 11:30:03+00:00,@myntra You are fraud. Because I have ordered one jeans and one shirt. I only got jeans. And you have received money of both jeans and shirt. You are so cheap. ,myntra
2019-11-05 11:28:49+00:00,"Hi Ankesh, we get your concern. Kindly share your regd. email ID/order number of the product via DM so that we can assist you. We await your response. -ZA https://twitter.com/messages/compose?recipient_id=89443197",myntra
2019-11-05 11:28:14+00:00,"Pls don't bother. Close my account , do not attempt to call me.",myntra
2019-11-05 11:26:41+00:00,"Read your mail U DENIED MY REFUNDS, I am not counting on @PayPal , i purchased from u Nd returned the product to YOU. U DENIED PAYPAL U RECEIVED THE PRODUCT AND THEY CANCELLED MY REFUND.",myntra
2019-11-05 11:26:12+00:00,"Chetan, we have responded in DM. -DD",myntra
2019-11-05 11:22:39+00:00,Dear @myntra @MyntraSupport if you don't want supply us things then don't place our orders... By supplying small sizes it doesn't mean that you are fulfilling my all requirements.,myntra
2019-11-05 11:18:57+00:00,Wow.....Same expressions for all emotions..... ,myntra
2019-11-05 11:18:36+00:00,Myntra Fashion Superstar | Grand Finale - #ThePitch Ft. Sonakshi Sinha &amp;... https://youtu.be/Ohx5r43PidU via @MFS @Myntra,myntra
2019-11-05 11:18:24+00:00,Very Bad services,myntra
2019-11-05 11:17:10+00:00,Thankyou Myntra Giving your Bad services .Mr Mohan has given me the wonderfull Resolution .To exchange my Denim jackets I need to take follow up from you guys Instead of Giving me the Resolution you people are Teaching me the Exchange policy .Never Excepted myntra .,myntra
2019-11-05 11:16:49+00:00,Thankyou Myntra Giving your Bad services .Mr Mohan has given me the wonderfull Resolution .To exchange my Denim jackets I need to take follow up from you guys Instead of Giving me the Resolution you people are Teaching me the Exchange policy .Never Excepted from myntra,myntra
2019-11-05 11:16:45+00:00,"Nandan, we have responded to your concern via DM, please check. Further, request you to refrain from sharing any order related or personal account details on the public post for security purposes and suggest you hide/remove any comments/posts (cont) http://srkl.in/l/6012BICErK",myntra
2019-11-05 11:16:15+00:00,Hi Jasmine! We have replied via DM. Kindly check. -MG,myntra
2019-11-05 11:14:32+00:00,Thankyou Myntra Giving your Bad services .Mr Mohan has given me the wonderfull Resolution .To exchange my Denim jackets I need to take follow up from you guys Instead of Giving me the Resolution you people are Teaching me the Exchange policy .Never Excepted myntra,myntra
2019-11-05 11:14:02+00:00,@MyntraSupportThankyou Myntra Giving your Bad services .Mr Mohan has given me the wonderfull Resolution .To exchange my Denim jackets I need to take follow up from you guys Instead of Giving me the Resolution you people are Teaching me the Exchange policy .Never Excepted from,myntra
2019-11-05 11:13:08+00:00,"Anyways, kindly delete my account.",myntra
2019-11-05 11:12:12+00:00,Thankyou Myntra Giving your Bad services .Mr Mohan has given me the wonderfull Resolution .To exchange my Denim jackets I need to take follow up from you guys Instead of Giving me the Resolution you people are Teaching me the Exchange policy .Never Excepted,myntra
2019-11-05 11:07:43+00:00,"Hlo . I used your size chart, ordered size 48, and yet you sent me size 44. I dare you to dispute that fact. Challenge accepted?",myntra
2019-11-05 11:05:30+00:00,"Chetan! We certainly do not want you to feel this way. As we understand your reasons to return are genuine, we request you to make an informed shopping choice by using our Size chart, Product Images, additional details and Try & buy by (cont) http://srkl.in/l/6012BICEOy",myntra
2019-11-05 11:05:30+00:00,stop misleading customers guys.. You cant have best of both worlds.. awaiting your favorable reply,myntra
2019-11-05 11:05:03+00:00,Hi there! We understand your concern. Please note that the pricing and offers are the decision of the sellers. The constantly changing marketplace and our efforts to offer you the lowest price may result in fluctuations in our prices over (cont) http://srkl.in/l/6016BICE32,myntra
2019-11-05 11:01:36+00:00,"Congratulations on winning the contest, Shilpi! Please DM us your email address so that we can take it up further. -DD",myntra
2019-11-05 11:00:59+00:00,"So i am being ""punished"" for your mistakes?",myntra
2019-11-05 11:00:00+00:00,"ICYMI, @upen_dev_singh will be speaking at #ReactFoo #Delhi about how his team at @JabongIndia and @myntra built a high performant PWA using #Preact",myntra
2019-11-05 10:59:45+00:00,@myntra Bhai 1200 price hike kaun karta hai ek din me ?,myntra
2019-11-05 10:56:49+00:00,Hi Jasmine! We have replied via DM. Kindly check. -NJ,myntra
2019-11-05 10:53:41+00:00,Thanks a lot team.. This is my first win on twitter... So happy,myntra
2019-11-05 10:48:57+00:00,"We get your point, Chetan! We noticed that you have returned most of your orders on Myntra. As, high return rates and refusal to accept orders impact the availability of products for other customers, we had to disable (cont) http://srkl.in/l/6018BICEHa https://twitter.com/messages/compose?recipient_id=89443197",myntra
2019-11-05 10:47:04+00:00,very good video,myntra
2019-11-05 10:46:47+00:00,That unfair. You're an actress your weight shouldn't matter people should criticise you for legitimate reason like how bad an actress you are because you're terrible.,myntra
2019-11-05 10:44:09+00:00,,myntra
2019-11-05 10:43:03+00:00,"Bhanu, we have replied here http://srkl.in/6014BICE1r -DD",myntra
2019-11-05 10:42:46+00:00,"Bhanu, we have responded here http://srkl.in/6013BICE1R -DD",myntra
2019-11-05 10:42:22+00:00,"Bhanu, this seems to be a misconception. The item value for the product post discount is Rs.1979 upon which GST of Rs.356.22 was levied amounting the total as Rs.2335.22. You can refer to the bill break up available under the order section (cont) http://srkl.in/l/6013BICE1H",myntra
2019-11-05 10:41:43+00:00,Where are the winners??,myntra
2019-11-05 10:38:26+00:00,"@myntra i am surprised that you sent me an email that my account is ""subject to fair usage policy - your account has been identified to have very high returns"" Well, you send me wrong sized items and you expect me not to return it ?",myntra
2019-11-05 10:31:48+00:00,I appreciate your attitude but i guess you choose a wrong profession really a wrong profession.,myntra
2019-11-05 10:30:05+00:00,"Saif, we get your concern regarding the discount. We understand that you are confused about the coupon applicability and the discount alignment. To inform you of the same, certain products may have a restricted maximum (cont) http://srkl.in/l/6018BICDh2",myntra
2019-11-05 10:24:08+00:00,"Love the ease of @getsimpl. pls integrate with @Uber_India, @amazonIN, @myntra, @NetflixIndia, @SheinIndia, @dominos_india, @jiosaavn, @oyor #KeepItSimpl",myntra
2019-11-05 10:20:42+00:00,"Hi Sanket, that's not what we want to hear from our customers. Kindly share your regd. email ID, via DM. So that we can look into the issue and assist you appropriately. We await your response. -ZA",myntra
2019-11-05 10:20:25+00:00,@myntra awaiting your reply on DM,myntra
2019-11-05 10:19:33+00:00,Aravind! We understand your concern about the product as it turned defective within a short span of usage. Do share with us an image of the product highlighting the defect. We'll get this sorted right away! -CK,myntra
2019-11-05 10:17:34+00:00,@myntra fraud team if price increased after shipment then why you have added increased price on my product,myntra
2019-11-05 10:16:16+00:00,As gay I felt wow just wow because he is not just wear cloth he have speculated sense yeah gender equality is more important so yeah thank u deepen and thank u Myntra to take him in @myntra #MyntraFashionSuperstar,myntra
2019-11-05 10:11:07+00:00,"That's not good to hear, Chandan. This is not the experience that we want you to have with us! We request you to please share the screenshot of the error message which you are receiving while trying to place an order along with your regd (cont) http://srkl.in/l/6012BICD28",myntra
2019-11-05 10:09:18+00:00,@myntra @Flipkart @FlipkartStories these scums are down to Vengeance now. They disabled mynta account as I stand up against #froudflipkart for d damage products that i returned months ago. No one gives a crap.#BoycottFlipkart #boycottMyntra,myntra
2019-11-05 10:09:01+00:00,How I would remember is first fall Myntra is not just a small fashion app or brand and others thing r like @sonakshisinha @shaleenanathani and another 10 beautiful people from thousand of fashion people and yeah them style as shaleena day stay stylish #goromlageche,myntra
2019-11-05 10:08:59+00:00,"Tu nastik hai, aadharmi",myntra
2019-11-05 10:08:37+00:00,What @PMOIndia and #McLarenEdition has to do with your tweet,myntra
2019-11-05 10:08:21+00:00,"You are welcome, Pooja! -DD",myntra
2019-11-05 10:08:00+00:00,@myntra I want to request for all people please don’t purchase from Myntra as it’s totally fraud making machine so please purchase other store instead of Myntra fraud,myntra
2019-11-05 10:06:08+00:00,"Bhanu, we understand your concern with regards to the price of the product. Please note that the payable amount for the order will not be changed once the order is placed irrespective of the price fluctuation happening for the product after (cont) http://srkl.in/l/6010BICD0i",myntra
2019-11-05 10:06:02+00:00,@myntra fraud team I want petition on court about your disappointing nature always as of now it’s proved Myntra is a machine for fraud making,myntra
2019-11-05 10:05:39+00:00,This coupon code is of no use as it doesn’t get applied on any of the product which I wish listed no ether on the one which I had previously. What’s the point of giving such things !,myntra
2019-11-05 10:04:53+00:00,Actually product is good when I got from myntra. But the pair is damaged after I wore them for 3 times only.,myntra
2019-11-05 10:04:45+00:00,"Dear @myntra When I Apply the coupon after making the purchase, it started telling invalids. You guys fooled me ",myntra
2019-11-05 10:04:40+00:00,@_Kalyan_K,myntra
2019-11-05 10:03:26+00:00,"Nikhil, we get your concern here. We would need the requested details of the product to take the issue forward. Please share the details with us via DM as soon as you can. So that we can assist you. -ZA",myntra
2019-11-05 10:02:05+00:00,"@myntra fraud team always trying different-2 type of fraud with customer product such as price increases,duplicate product,after expected delivery of product etc so please beware shopping with Myntra",myntra
2019-11-05 10:02:04+00:00,I have been listening these words since 5 days. So Is these your service . No any updates of my product from last 6 days. @Flipkart @FlipkartStories @flipkartsupport @Walmart @PhonePeSupport @PhonePe_ @myntra,myntra
2019-11-05 10:01:56+00:00,"Hi Shiva! We have replied to your concern here: http://srkl.in/6018BICDLE , kindly check. -VR https://twitter.com/messages/compose?recipient_id=89443197",myntra
2019-11-05 10:01:20+00:00,Hi Shiva! We have arranged a callback for you in this regard. One of our case managers will contact you within 24 hrs anytime between 11 AM to 8 PM & address your concern on priority. Request your patience. -VR https://twitter.com/messages/compose?recipient_id=89443197,myntra
