date,tweet,word
2019-11-18 13:46:56+00:00,Ordered from myntra paid Rupees 584 but didn't receive any order conformation this is cheating @myntra @MyntraSupport,myntra
2019-11-18 13:44:01+00:00,"Deepak, we get your concern regarding the GST of the product. Please be informed, we do not charge GST over MRP as the selling price shown is including GST. For better understanding, we have arranged a callback for you. One of our case (cont) http://srkl.in/l/6014BIhyXm",myntra
2019-11-18 13:30:23+00:00,Hi there! We are definitely here to take a deeper look at your concern. Could you please DM us your regd. e-mail ID & order number so that we can look into it & assist you accordingly. -A https://twitter.com/messages/compose?recipient_id=89443197,myntra
2019-11-18 13:27:58+00:00,Still you can't calculate gst over mrp. I just had a discussion with CA in this regards. You will get consumer court notice very soon.,myntra
2019-11-18 13:27:26+00:00,"First of all that should not have happened, Sohil! We always take joy in delivering the orders to our customers on or before the promised date rather than getting it delayed. This is one of those instances where (cont) http://srkl.in/l/6016BIhyTr",myntra
2019-11-18 13:26:25+00:00,@myntra I ordered an order in which the number has given not working now.will I change my number for this order,myntra
2019-11-18 13:23:46+00:00,@myntra @MyntraSupport When will i receive this jacket after winter? Do you and your delivery guys have sense of responsibility. Note: Put your Apologies in your As* before replying to this tweet you SOB.,myntra
2019-11-18 13:12:07+00:00,I offered help for Myntra .. Even I can help you to track down details what happened with your ac. But (Paid)..,myntra
2019-11-18 13:03:05+00:00,Movember Tales: Be ‘beard-tiful’ this No Shave November - fashion and trends from Myntra - Hindustan Times ,myntra
2019-11-18 13:02:54+00:00,"Thank you for sharing the details, Santosh! We are always on an urge to provide the best customer service. We see that you have also shared an email with the required details. Please be assured, we are already working (cont) http://srkl.in/l/6010BIhyMQ https://twitter.com/messages/compose?recipient_id=89443197",myntra
2019-11-18 12:47:50+00:00,"From ad free music to going on online shopping sprees and everything in between, with #TheAllInOne membership for every need - Times Prime Get it here - http://bit.ly/2ISTSHA #TimesPrime #OnlineShopping #AdFreeMusic #GaanaPlus #Myntra @gaana @myntra ",myntra
2019-11-18 12:41:25+00:00,"That is not good to hear, Ishan! We wouldn't want such experience for you & this certainly is an unusual instance. We request you to DM us the below details with us to take it forward : 1. Article Id (Alphanumeric article Id found on the (cont) http://srkl.in/l/6011BIhyED",myntra
2019-11-18 12:40:24+00:00,"Mid-Season Sale @myntra! Flat 50-80% off on Apparels, Footwear, Handbags, Home Decor, Handbags, Beauty &amp; more + Extra up to 8% TCB #Cashback. https://www.topcashback.in/myntra/ #ThodaAurZyaada #Myntra #MyntraFashionUpgrade #Myntrafashion #Fashion #desifashion #fashionista #indianmen",myntra
2019-11-18 12:34:43+00:00,"We value the importance of your order, Prateek! It was not our intention to keep you waiting. We’ve highlighted your concern & are following up on this with utmost priority. One of our case managers will connect with you soon to address this. -AJ",myntra
2019-11-18 12:25:18+00:00,@_Amar_N sir may b u r 2 busy in meetings n all but @myntra and @MyntraSupport r not able to help in below. order plced 11th Nov and delivery date 18th Nov.. still not received the parcel.,myntra
2019-11-18 12:03:34+00:00,"Hi. Since this order was placed through Myntra, we kindly ask you to contact their Customer Service team with regards to your enquiry. Thank you for your understanding. Best regards.",myntra
2019-11-18 11:59:48+00:00,Hey there! We have replied to you here - http://srkl.in/6018BIhHxk Please check. -AO,myntra
2019-11-18 11:59:25+00:00,Hey there! We have replied to you here - http://srkl.in/6012BIhHxr Please check. -AO,myntra
2019-11-18 11:56:09+00:00,@myntra,myntra
2019-11-18 11:53:21+00:00,payment to myntra by phonpe ,myntra
2019-11-18 11:51:41+00:00,Hello Anil! How may we assist you? -AJ,myntra
2019-11-18 11:37:26+00:00,I have been shopping from @myntra from years but i didn’t face such issue. First time I shopped from you and i had to gone through the bad experience.,myntra
2019-11-18 11:36:22+00:00,Hi Priyamvada! We comprehend that you have a concern related to your recent order. This is never the kind of impression we want you to have of us. Kindly DM us your regd. email ID and order number so that we can (cont) http://srkl.in/l/6019BIhHWP https://twitter.com/messages/compose?recipient_id=89443197,myntra
2019-11-18 11:36:13+00:00,Myntra?,myntra
2019-11-18 11:31:47+00:00,"This is not the experience we want you to have with us, Mihir! We are definitely here to take a closer look at your concern. Could you please DM us your registered email ID and order number elaborating your concern, (cont) http://srkl.in/l/6011BIhHlz",myntra
2019-11-18 11:28:01+00:00,"Delivering your packet of joy & to see you happy is our priority, Rachit! We never want to cause our customers any hassle. We will certainly look into this please DM us your regd E-mail ID & order number so that we can put this right. We await your response. -AO",myntra
2019-11-18 11:26:50+00:00,@myntra @MyntraSupport @MyntraShoppiing Can your assistance staff give more than a minute to type anything? within a minute they just sign us off without confirming whether query was resolved.,myntra
2019-11-18 11:24:00+00:00,Cutie pie @AnushkaSharma,myntra
2019-11-18 11:23:58+00:00,@myntra @MyntraSupport had order fossil watch which was supposed to be delivered on 17 Nov. Till now no update from Myntra!! Hv registered the complaint but m told to wait for 48hrs !! Really?? Address dedo 8hrs mai toh khudh chalkar lene aata hu ! #Myntra,myntra
2019-11-18 11:20:45+00:00,. @myntra They show you Kareena's Kurta and send you GanguBai's frock and name it 'Bag of Joy'. Returning it. ,myntra
2019-11-18 11:07:56+00:00,"@MyntraSupport Hi team Myntra support just now sent a DM, please check and do the needful at the earliest. Thanks",myntra
2019-11-18 11:06:38+00:00,Hey Gauri! We never wished to cause such an experience for you & would always make the best efforts to provide the most satisfying service. We will certainly look into this please DM us your regd E-Mail ID & order number so that we can put this right. We await your response. -AO https://twitter.com/messages/compose?recipient_id=89443197,myntra
2019-11-18 11:01:59+00:00,@myntra @MyntraShoppiing @MyntraSupport,myntra
2019-11-18 11:01:50+00:00, wow,myntra
2019-11-18 10:57:44+00:00,@InddusIndia @myntra @Flipkart pathetic service by this brand called Inddus!! i ordered a kurta palazzo set where the kurta and palazzo dont match AT ALL!! its worth 3000 and service is worth rupees 3!! shame!!@flipkartsupport @MyntraSupport,myntra
2019-11-18 10:56:33+00:00,Looking for some Monday-motivation? We give you ample with up to 50% OFF on your wishlisted products from @facescanada. #ForAllYourFaces Shop now @myntra http://bit.ly/MyntraFaces,myntra
2019-11-18 10:45:56+00:00,@myntra @MyntraSupport @UfterYou @RoflGandhi_ I seriously had bad experience but seeing you guys shouting on a customer and that too female @ConsumerReports,myntra
2019-11-18 10:45:13+00:00,Are bhaibi's x chacha ,myntra
2019-11-18 10:30:30+00:00,"Sunil! It is very upsetting and is not the impression we want you to have of us. Kindly give us a chance to look into it. Could you please DM us with your regd. E-mail ID & order number, so that we can assist you accordingly. We await your response. -KB https://twitter.com/messages/compose?recipient_id=89443197",myntra
2019-11-18 10:30:23+00:00,"That's not good to hear, Himani. This is not the experience that we want you to have with us! Kindly give us a chance to look into your concern. Please DM your registered email ID & order number, so that we can assist you accordingly. -R https://twitter.com/messages/compose?recipient_id=89443197",myntra
2019-11-18 10:29:58+00:00,@myntra yelling at a female. Is this your level of customer service?????,myntra
2019-11-18 10:28:55+00:00,@myntra such a poor experience with you guys. If this what a 1st time user has to deal with. Bloody delivery guy calling and yelling. WTF @karan_purewall @sarcasmisgod,myntra
2019-11-18 10:26:13+00:00,Yesterday you have approved. Nd said that we send the mail to ekart courier. But they said u dont send any mail worst app . Tomorrow i go to consumer court. Please i request to all people delete myntra only buy products from @amazonIN,myntra
2019-11-18 10:25:37+00:00,"Apparently,the option to exchange a damaged product on @myntra is multistep. They say I need to raise the complaint by calling the customer care, and the option checked as 'recieved damaged product' is merely a feedback.Highly disappointed @MyntraSupport poorest customercare.",myntra
2019-11-18 10:23:04+00:00,@myntra world's worst e commerce website and worst customer care service .I have placed an order I haven't received the product but my money has been deducted,myntra
2019-11-18 10:21:44+00:00,https://twitter.com/dhanushkraja/status/1195999810202918913?s=09 #Dhanush,myntra
2019-11-18 10:18:09+00:00,@UNICEF @TOIMumbai @Flipkart @amazon @myntra @LEVIS @Wrangler @Google @ZomatoIN @swiggy_in @BeingSalmanKhan @SonuSood @iHrithik @ABPNews @abpmajhatv @gujratsamachar @cromaretail @Cinemax @PMOIndia let's celebrate #InternationalMensDay,myntra
2019-11-18 10:16:10+00:00,Check my order details mentioned on myntra support,myntra
2019-11-18 10:09:42+00:00,"We heard you, Priyam! With regards to the product ""Crew STREET Women Blue Sneakers,'' We see that product was picked up on 12th Nov 2019. Once the product is picked up it will take 7 business days for the product to reach our warehouse. (cont) http://srkl.in/l/6013BIhHEJ",myntra
2019-11-18 10:08:59+00:00,"We get your concern regarding the price variation, Ashwin! Myntra doesn't offer a price match guarantee. The constantly changing marketplace and our efforts to offer you the lowest price, may result in fluctuations (cont) http://srkl.in/l/6010BIhHDa",myntra
2019-11-18 10:07:45+00:00,#amezon #flipkart #myntra #snepdeal #fashionjewelry #style #fashionshoes#highheelshoes #shoes #fashion #weddingdresses #amazingdress #fashionstyle #sandals #boots #footwear #highheels Cotton Printed/Solid Slim… https://www.instagram.com/p/B5ALq2dnmfp/?igshid=1g1yw8s8se756,myntra
2019-11-18 10:04:41+00:00,Yeah really. thats your excuse. @Myntra does not offer price match guarantee. Your system and your marketing is misleading and sham. That is the correct reason. Why would I buy something during a sale if the price after sale is less.,myntra
2019-11-18 10:03:50+00:00,It's the second day of using this bag and again there are quality issues that I am facing. Have already gotten this product replaced once. Really unhappy with @pumaindia's quality and with @myntra. Want my refund now. Please initiate it asap @MyntraSupport @PUMA,myntra
2019-11-18 10:00:55+00:00,"Hi Ashwin! We comprehend your concern regarding the price variation. Myntra doesn't offer a price match guarantee. The constantly changing marketplace and our efforts to offer you the lowest price, may result in (cont) http://srkl.in/l/6015BIhH6T https://twitter.com/messages/compose?recipient_id=89443197",myntra
2019-11-18 09:59:28+00:00,"Drop all that you're doing right now and shop your most-loved brands and styles at 50-80% Off during the Myntra Mid Season Sale. *Hurry, Sale ends on the 19th of Nov* Shop now - http://bit.ly/2CVbCON",myntra
2019-11-18 09:55:54+00:00,"We get your concern here, Sudhir! Please note, that the order is eligible for free shipping if order value is Rs. 1199/- or greater & if the order value is less than Rs. 1199/- a shipping charge of Rs. 149/- will (cont) http://srkl.in/l/6010BIhGCj https://twitter.com/messages/compose?recipient_id=89443197",myntra
2019-11-18 09:54:20+00:00,I bought some items from @myntra during the sale season. Shocked to find that the products were available at lower price post the sale season. The sales is just a sham.,myntra
2019-11-18 09:53:45+00:00,@myntra kindly refund my money of crew street shoes and white sneakers,myntra
2019-11-18 09:50:39+00:00,Next time i will think twice before ordering anything from @myntra @MyntraSupport! As they only credit you the refund of the mrp! What about the delivery! For no reason my 100 rs is wasted just coz the delivered item doesnt fit me! I mean wtf! #myntrafraud,myntra
2019-11-18 09:49:47+00:00,"Thanks for reaching out to us Gulamhasan! Please be informed that once the order is delivered, it would take up to 72 hours for the status to be updated. Please follow the below steps on the app where you can mark (cont) http://srkl.in/l/6012BIhGfu https://twitter.com/messages/compose?recipient_id=89443197",myntra
2019-11-18 09:43:52+00:00,why still not mark diliverd i alredyvreiceve bit iteks so plz mark diliverd @myntra ,myntra
2019-11-18 09:41:23+00:00,"Your welcome Yatish! We are glad that we were able to resolve your issue. Let us know if you have any concern, as we are here to help you. -SB https://twitter.com/messages/compose?recipient_id=89443197",myntra
2019-11-18 09:38:41+00:00,"Thank you, concern solved ",myntra
2019-11-18 09:38:25+00:00,,myntra
2019-11-18 09:21:37+00:00,"Love the ease of @getsimpl. pls integrate with @Uber_India, @amazonIN, @SheinIndia, @myntra, @dominos_india, @NetflixIndia and @hotstartweets #KeepItSimpl",myntra
2019-11-18 09:18:12+00:00,Daniel Wellington’s Iconic Link Collection now available online on Myntra MOre : http://bit.ly/2XoJRrb @myntra,myntra
2019-11-18 09:17:15+00:00,We have replied to your post via DM Hitesh! Kindly have a check. -SB,myntra
2019-11-18 09:16:39+00:00,Few fresh graduates(girls) have joined our team and are being mentored by other girls from the team. Now they all will sit together and browse Myntra. Com in the training room! ,myntra
2019-11-18 09:07:27+00:00,Hey Vedant! Thank you for reaching out to us along with an alternate contact number. We've arranged a callback & one of our case managers will reach out to you tomorrow from 11 AM to 8 PM to discuss this issue. Thank you for your patience & understanding. -SA https://twitter.com/messages/compose?recipient_id=89443197,myntra
2019-11-18 09:06:13+00:00,"Hi there! We have responded to you via DM, please check! - HS",myntra
2019-11-18 09:00:11+00:00,"@myntra @MyntraSupport highly highly disappointed with your service. I have ordered this watch just because there's a bracelet along with it but surprise surprise, I haven't received the bracelet. How are we supposed to trust you with our orders?",myntra
2019-11-18 08:59:05+00:00,When my product will be pick up ? Call me on my numbers so I will tell you in brief,myntra
2019-11-18 08:56:26+00:00,"Apologies for the hassle caused, Roy! This is not the experience that we want you to have with us. Please be assured, we've escalated this case and are looking into this on a priority basis. One of our case managers (cont) http://srkl.in/l/6018BIhG5i https://twitter.com/messages/compose?recipient_id=89443197",myntra
2019-11-18 08:56:05+00:00,"I got a mail saying no contact could be made on my number, but the fact is I didn't get any call from your side. Alternate number- 7014540886",myntra
2019-11-18 08:54:40+00:00,@MakeupRVLTN this is how @myntra delivered your product. @Flipkart still awaiting action. This is what I Received. This was a birthday present to my sister. Customer sentiment matters or not. It was a beautiful eye palatte shown on your site but it's a deceit https://twitter.com/BisakhaRoy1/status/1196347412685570048,myntra
2019-11-18 08:49:08+00:00,Awesome ,myntra
2019-11-18 08:45:07+00:00,"That's not the kind of feedback we'd want you to have for us. We see that you're eagerly waiting for the delivery of the product, while we realize that a faster delivery would be very convenient for our customers, we apologize as we don't (cont) http://srkl.in/l/6019BIhGZv",myntra
2019-11-18 08:42:32+00:00,Replied with all details in DM reply me there,myntra
2019-11-18 08:40:59+00:00,"Hey Manohar! We apologize for the inconvenience caused to you. We would like to inform you that your claim for the wrong product is approved. Although, we see that you have tried multiple times & the pick up was (cont) http://srkl.in/l/6013BIhGk3 https://twitter.com/messages/compose?recipient_id=89443197",myntra
2019-11-18 08:40:24+00:00,"@myntra As you can see that a defective eye palette was delivered from you end. DM is sent, your action would be appreciated. @MakeupRVLTN @MyNykaa Nykaa this never happens. Then why are you putting defective items on sale. https://twitter.com/myntra/status/1196339547568664576",myntra
2019-11-18 08:38:35+00:00,"No one told me that government has banned good clothes, it was not in the newspaper too. #myntrashopping @myntra .",myntra
2019-11-18 08:30:23+00:00,"Thank you for the pat on the back, Biplab! It is very thoughtful of you to save mother nature. We have cascaded your feedback for review and would like to bring a change. - HS",myntra
2019-11-18 08:28:37+00:00,I love chacha chaudhary and his bodyguard sabu...,myntra
2019-11-18 08:28:33+00:00,Yes worst service from Myntra. They are becoming like their parent company Flipkart.,myntra
2019-11-18 08:27:53+00:00,@myntra your customer support says we do faster delivery and you are saying we do not have that service? What kind of customer service is this?? I mean do think on what you are saying..!,myntra
2019-11-18 08:25:04+00:00,@myntra the products that u deliever are quite genuine and very good in quality.But kindly stop using polythene for packing those products.,myntra
2019-11-18 08:22:11+00:00,We have addressed your concern via DM. Kindly have a check. -R,myntra
2019-11-18 08:21:49+00:00,"We're wide awake when your concerns are yet to be resolved, Pragya! Sending you a copy of an invoice for one of your previous orders is super easy. However, we are unable to fetch order information with the details provided. Can you please (cont) http://srkl.in/l/6019BIhGRX",myntra
2019-11-18 08:21:45+00:00,"Thanks for highlighting the issue to us, Rahul! We request you to share the pin code of your location and the screenshot of the error which you are getting upon changing the address so that, we can get the issue sorted as early as possible. We await your response. -ZA",myntra
2019-11-18 08:20:48+00:00,@myntra @MyntraSupport My name is manohar i brought a shoe for my sister Its shoetopia women black flats on Image show did not match with actual product. i returned the product 5 times from product delivery why can't tacking i purchased product that's not used it's just unboxed,myntra
2019-11-18 08:19:30+00:00,"@myntra hello, solve Concern. All details messaged",myntra
2019-11-18 08:17:53+00:00,@aanatamez no sabía que también salías en la tv hindú,myntra
2019-11-18 08:14:11+00:00,We have addressed your concern via DM. Kindly have a check. -R,myntra
2019-11-18 08:13:08+00:00,@myntra Order no :- 110150269595858272001 I didn’t received any invoice of my order. Just got emails of product delivery info. From last 2 days your customer support were not able to provide me my invoice. I need it for warranty issue and you guys are just sleeping.,myntra
2019-11-18 08:10:28+00:00,"Hi Ankur! We understand you are not happy with the quality of the product. On your query, about the authenticity of the products on Myntra, we would like to tell you that all the items are procured directly from the brands and are 100% (cont) http://srkl.in/l/6013BIhGMR",myntra
2019-11-18 08:10:08+00:00,Cuutyyyy,myntra
2019-11-18 08:09:09+00:00,"That's not good to hear, Roy! This is not the experience that we want you to have with us! Don't you worry, please share the order number, regd, email ID via DM, so we can look into this and assist you accordingly. -TS https://twitter.com/messages/compose?recipient_id=89443197",myntra
2019-11-18 08:07:42+00:00,"We understand your situation, Pradeep. We know we might sound repeating & a simple apology can't compensate for the discomfort you're going through. Please be assured that the requested time frame is the maximum time within which we will (cont) http://srkl.in/l/6019BIhGzP",myntra
2019-11-18 08:07:27+00:00,Sunday ho ya Monday roz hai Funday. #NushXChachaChaudhary Ka Damag Computer Se Tez Chalta Hai Aur Jab Sabu Ko Gussa Aata Hai Toh Kahin Door Jwala Mukhi Phatti Hai #Nush. #GoodNewzz!:),myntra
2019-11-18 08:07:22+00:00,No used bro myntra is fraud company they are fooling vendors everytime Team is Useless kuch nhi pblm hota hai customer ko batate hai vendor is not good. I am making a vedio blog As HOW MYNTRA FOOLS? I WANT YOU ALL SUPPORT AND TEACH MYNTRA LESSON I WANT ALL SUPPORT,myntra
2019-11-18 08:04:21+00:00,"@myntra received a damaged product from you, and since it's a cosmetic item, it cannot be returned. We trust you so we ordered only to be fooled at the end. It was a birthday gift for my sister. @MyNykaa is better #shamemyntra",myntra
2019-11-18 08:02:59+00:00,Buy 1 Get 1 Free. Hurry Up Viratians still loves Anushkaholics. A must watch #GoodNewzzTrailer :),myntra
2019-11-18 08:01:17+00:00,@myntra unable to add correct address when i put pincode its show different district.,myntra
2019-11-18 08:00:23+00:00,"hi @Uber_India, @amazonIN, @myntra, @dominos_india, @NetflixIndia, @hotstartweets, @oyorooms and @jiosaavn plz get pay later option #KeepItSimpl",myntra
2019-11-18 07:57:51+00:00,"We value the importance of your concern, Ajay. We never intend to cause you any sort of inconvenience. Please be assured that we have escalated this issue and one of our case managers will contact you at the earliest, to address your concern. Appreciate your understanding. -R",myntra
2019-11-18 07:57:27+00:00,Hey Gowri! We have responded to you under the following link: http://srkl.in/6016BIhGHK Please have a check for the same. -SA,myntra
2019-11-18 07:57:10+00:00,We have responded to you under the following link: http://srkl.in/6010BIhGG4 Please have a check for the same. -SA,myntra
2019-11-18 07:56:59+00:00,See this is your case manager's work. Asking me to wait for another 24 hours. R u people working or sleeping there. How many days u people will take to issue a simple gift card. This has to be the last waiting. Otherwise u people will hear cuss words from me,myntra
2019-11-18 07:56:38+00:00,We have responded to you under the following link: http://srkl.in/6013BIhGGx Please have a check for the same. -SA https://twitter.com/messages/compose?recipient_id=89443197,myntra
2019-11-18 07:56:35+00:00,"Hi Team, it’s more than 48 hours and amount is not refunded back. @HDFC_Bank @HDFCBank_Cares usually doesn’t act until told to. @FinMinIndia",myntra
2019-11-18 07:56:05+00:00,"Hi Ashraf! We have responded to you via DM, please check! - HS",myntra
2019-11-18 07:55:54+00:00,This is funny ,myntra
2019-11-18 07:55:42+00:00,"Gowri, we have responded to you under the following link: http://srkl.in/6015BIhGGz Please have a check for the same. -SA https://twitter.com/messages/compose?recipient_id=89443197",myntra
2019-11-18 07:55:15+00:00,Hey Gowri! We have responded to you under the following link: http://srkl.in/6013BIhG1h Please have a check for the same. -SA https://twitter.com/messages/compose?recipient_id=89443197,myntra
2019-11-18 07:54:43+00:00,My order number is 4071136304,myntra
2019-11-18 07:54:30+00:00,"Gowri, we made you wait really long. We apologize for the delay. Please be assured that we are working on this issue with the utmost priority. We'll reach out to you at the earliest & discuss this issue. Please bear with us till then. Thank you for your understanding. -SA https://twitter.com/messages/compose?recipient_id=89443197",myntra
2019-11-18 07:54:22+00:00,"Yeah , I lost Rs 27,000 because of @myntra",myntra
2019-11-18 07:53:26+00:00,#cutiepie @AnushkaSharma,myntra
2019-11-18 07:53:10+00:00,We love @imVkohli ,myntra
2019-11-18 07:52:28+00:00,I got the delivery next day of placing the order. Since I’m a die hard fan of LP shoes I did cross check with Louis Philippe customer support and got an answer and which made me believe this a fake product. My email ID Is pal.ankur01@gmail.com since the product was on try and buy,myntra
2019-11-18 07:50:12+00:00,Myntra is baddest application while placing the order never confirm the address my order got placed in old address same can't be changed and the order was on emi if cancel the order I will be in loss for 600 bugs @_Amar_N @myntra ,myntra
2019-11-18 07:48:42+00:00,EveryTime Show You You Are Thief @myntra @MyntraSupport,myntra
2019-11-18 07:48:22+00:00,"I'm with you. Worst ever experience with @myntra. These guys r resolving my issue from the past 6 months only. I've seen 100s of 24 hours so far. Rest assured, ur issue will be resolved within the next 2 years.",myntra
2019-11-18 07:48:18+00:00,"Hi Ankur! That's not good to hear. This is not the experience that we want you to have with us. About the authenticity of the products on Myntra, we would like to tell you that all the items are procured directly (cont) http://srkl.in/l/6014BIhG8m",myntra
2019-11-18 07:46:09+00:00,"Rest assured that your money is gone! Wait for 24 hrs, @Myntra is busy conducting some #fashion events spending crores of our money.",myntra
2019-11-18 07:44:14+00:00,"Hi there! Sorry to disappoint you, but we do not have a faster delivery option at the moment. However, it is of highest priority and we will do our best to deliver the order to your address at the earliest, Further, (cont) http://srkl.in/l/6014BIhG6q https://twitter.com/messages/compose?recipient_id=89443197",myntra
